video_id,likes,comments,shares,plays,clean_description,hashtag_list,hashtag_count,create_time,create_hour,create_day,create_month,create_year,day_of_week,is_weekend,time_period,total_engagement,engagement_rate_per_play,weighted_engagement,weighted_engagement_rate,commenting_rate,sharing_rate,viral_coefficient,viral_coefficient_norm,is_viral_plays,is_highly_engaging,total_engagement_capped,engagement_rate_per_play_capped,description_length,word_count,readability_score,sentiment_polarity,sentiment_subjectivity,has_question,has_exclamation,exclamation_count,has_tag_fyp,has_tag_viral,has_tag_fypシ,has_tag_foryoupage,has_tag_foryou,has_tag_trending,has_tag_relatable,has_tag_funny,has_tag_tiktok,has_tag_fypシviral
7505500877390630166,353000,1224,86500,2000000.0,no description,[],0,2025-05-17 19:36:43,19,17,5,2025,5,1,evening,440724,0.220362,1224120,0.61206,0.000612,0.04325,0.08785599999999999,30.957865464015374,0,0,440724.0,0.220362,14,2,35.60500000000002,0.0,0.0,0,0,0,0,0,0,0,0,0,0,0,0,0
7507705695047814430,132100,1542,469,637200.0,is it a flop or not,[],0,2025-05-23 18:12:50,18,23,5,2025,4,0,evening,134111,0.21046924042686754,144500,0.22677338355304458,0.0024199623352165727,0.0007360326428123038,0.06399278091650971,22.520964909673147,0,0,134111.0,0.21046924042686754,20,6,116.14500000000001,0.0,0.0,0,0,0,0,0,0,0,0,0,0,0,0,0
7505918628395502891,435200,1453,1038,3100000.0,consintiéndole a mi hija para su cumpleaños,[],0,2025-05-18 22:38:22,22,18,5,2025,6,1,night,437691,0.14119064516129032,452845,0.1460790322580645,0.00046870967741935486,0.0003348387096774194,0.042618354838709675,14.963983322503221,0,0,437691.0,0.14119064516129032,45,7,54.70142857142861,0.0,0.0,0,0,0,0,0,0,0,0,0,0,0,0,0
7507498579519491374,243600,423,14200,913900.0,insane how similar they are unicorn starbucks   charlixcx lorde old nostalgia,"['unicorn', 'starbucks', '2015', '2025', 'charlixcx', 'lorde', 'old', 'nostalgia']",8,2025-05-23 04:49:32,4,23,5,2025,4,0,night,258223,0.2825506072874494,387715,0.4242422584527848,0.00046285151548309443,0.015537805011489223,0.09262665499507604,32.644542422044864,0,0,258223.0,0.2825506072874494,95,11,43.963076923076954,-0.3,0.5333333333333333,0,0,0,0,0,0,0,0,0,0,0,0,0
7507395652779904302,191100,3455,597,2000000.0,taking steps  grief griefjourney grievingmom childloss griefjourney grievingjourney grievingmother foreverzack,"['grief', 'griefjourney', 'grievingmom', 'childloss', 'griefjourney', 'grievingjourney', 'grievingmother', 'foreverzack']",8,2025-05-22 22:09:34,22,22,5,2025,3,0,night,195152,0.097576,214345,0.1071725,0.0017275,0.0002985,0.029767549999999997,10.420549258217056,0,0,195152.0,0.097576,122,10,10.564999999999998,-0.8,0.2,0,0,0,0,0,0,0,0,0,0,0,0,0
7507472565082787103,91800,152,314,678200.0,no description,[],0,2025-05-23 03:08:10,3,23,5,2025,4,0,night,92266,0.13604541433205544,95700,0.141108817457977,0.00022412267767620171,0.0004629902683574167,0.04108994396933058,14.423609852100453,0,0,92266.0,0.13604541433205544,14,2,35.60500000000002,0.0,0.0,0,0,0,0,0,0,0,0,0,0,0,0,0
7507744606004481326,8981,274,4232,207200.0,i hit the point where you just shove shit in the closet to be done teacherproblem endoftheschoolyear teacherlife,"['teacherproblem', 'endoftheschoolyear', 'teacherlife']",3,2025-05-23 20:44:02,20,23,5,2025,4,0,evening,13487,0.06509169884169884,52671,0.25420366795366794,0.0013223938223938224,0.020424710424710425,0.03000434362934363,10.504268235765068,0,0,13487.0,0.06509169884169884,117,18,89.60000000000004,-0.2,0.8,0,0,0,0,0,0,0,0,0,0,0,0,0
7507301272903617834,45300,416,174,1200000.0,movie fyp,"['movie', 'fyp']",2,2025-05-22 16:25:00,16,22,5,2025,3,0,afternoon,45890,0.03824166666666667,49120,0.040933333333333335,0.00034666666666666667,0.000145,0.011614333333333332,4.002434282938814,0,0,45890.0,0.03824166666666667,11,2,77.90500000000002,0.0,0.0,0,0,0,1,0,0,0,0,0,0,0,0,0
7506961534434692360,423100,780,185600,2600000.0,inst whobeliv,[],0,2025-05-21 18:04:51,18,21,5,2025,2,0,evening,609480,0.2344153846153846,2283000,0.8780769230769231,0.0003,0.07138461538461538,0.10607692307692307,37.399918209308055,0,0,609480.0,0.2344153846153846,15,2,35.60500000000002,0.0,0.0,0,0,0,0,0,0,0,0,0,0,0,0,0
7506506458041715990,862300,4415,77600,8900000.0,deep conversations with joshoconnor loewe,"['joshoconnor', 'loewe']",2,2025-05-20 12:38:56,12,20,5,2025,1,0,afternoon,944315,0.10610280898876405,1660375,0.18655898876404495,0.0004960674157303371,0.008719101123595505,0.03628960674157303,12.726438666762887,0,0,776181.5999999995,0.10610280898876405,44,5,32.56000000000003,0.0,0.4,0,0,0,0,0,0,0,0,0,0,0,0,0
7499196240765209886,176300,514,2783,2700000.0,lash serum  curler linked  makeup makeuptherapy makeuproutine grwm eyelashes lashcurler lashes lashserum babelash shiseido lashcurler besteyelashcurler lash longlashes serum beauty makeuptutorial viral diml mascara loreal eyelashserum eyelashcurler makeuphacks therapy girly fyp foryou foryoupage fypシ lorealtelescopic,"['makeup', 'makeuptherapy', 'makeuproutine', 'grwm', 'eyelashes', 'lashcurler', 'lashes', 'lashserum', 'babelash', 'shiseido', 'besteyelashcurler', 'lash', 'longlashes', 'serum', 'beauty', 'makeuptutorial', 'viral', 'diml', 'mascara', 'loreal', 'eyelashserum', 'eyelashcurler', 'makeuphacks', 'therapy', 'girly', 'fyp', 'foryou', 'foryoupage', 'fypシ', 'lorealtelescopic']",30,2025-04-30 19:51:55,19,30,4,2025,2,0,evening,179597,0.06651740740740741,206700,0.07655555555555556,0.00019037037037037037,0.0010307407407407407,0.02050866666666667,7.147047990249629,0,0,179597.0,0.06651740740740741,352,35,-19.6442857142857,0.0,0.0,0,0,0,1,1,1,1,1,0,0,0,0,0
7506687781654121759,147300,2536,611,701500.0,if i see one more tiktok commission for teeth paint i will crash out pls read up on the history of teeth blackening i got my swag from my grandma and sukiibaby shout out molly santana and sadboi honorable mentions to the baddies that do it for the culture,[],0,2025-05-21 00:22:40,0,21,5,2025,2,0,night,150447,0.2144647184604419,166090,0.2367640769779045,0.0036151104775481112,0.0008709907341411261,0.06549793300071274,23.05311517863529,0,0,150447.0,0.2144647184604419,259,49,77.75738775510206,0.5,0.5,0,0,0,0,0,0,0,0,0,0,0,0,0
7505540358508498218,34600,157,15400,519800.0,prepare to see your favorite pizza place from a whole new perspective ever thought little caesars was just about cheesy goodness think again this wild exploration of the origins of its name reveals a side thats pure comedic gold from the quirky decisionmaking of the ceowhose marine background led to a playful nicknameto the surprising lengths of historical connections this deep dive uncovers some seriously hilarious secrets did you ever notice the mascots fittingly cheeky design spoiler alert its sparking debates about hidden messages and historical humor this video will have you laughing out loud while reconsidering everything you thought you knew about pizza and its branding you wouldnt want to miss this ribtickling journey into one of the most successful jokes in fast food history  littlecaesars pizzahumor ceostories comedyinpizza fastfoodfun hiddenmessages hilariousjokes foodmemes criticalthinkingthe_fat_electricianthefatfiles,"['littlecaesars', 'pizzahumor', 'ceostories', 'comedyinpizza', 'fastfoodfun', 'hiddenmessages', 'hilariousjokes', 'foodmemes', 'criticalthinking', 'the_fat_electrician', 'thefatfiles']",11,2025-05-17 22:10:41,22,17,5,2025,5,1,night,50157,0.09649288187764525,189385,0.3643420546363986,0.0003020392458637938,0.029626779530588686,0.04382166217776068,15.389415629869802,0,0,50157.0,0.09649288187764525,976,135,32.436666666666696,0.1866569833675097,0.5704146730462519,1,1,4,0,0,0,0,0,0,0,0,0,0
7505563757893012766,176700,720,7402,907200.0,please tell me someone gets it harrypotter after hungergames lucygray voldemort fyp foryoupage trending,"['harrypotter', 'after', 'hungergames', 'lucygray', 'voldemort', 'fyp', 'foryoupage', 'trending']",8,2025-05-17 23:41:05,23,17,5,2025,5,1,night,184822,0.2037279541446208,254320,0.2803350970017637,0.0007936507936507937,0.008159171075837742,0.06535670194003528,23.00318258530196,0,0,184822.0,0.2037279541446208,113,14,53.639285714285734,0.0,0.0,0,0,0,1,0,0,1,0,1,0,0,0,0
7507150712468524306,477000,7594,186400,4500000.0,arina о ну мы моя любимая гуляем  утра пробежка вдвоем,"['гуляем', '6', 'утра', 'пробежка', 'вдвоем']",5,2025-05-22 06:18:57,6,22,5,2025,3,0,morning,670994,0.14910977777777779,2378970,0.52866,0.0016875555555555556,0.04142222222222222,0.06578155555555555,23.153390639452425,0,0,670994.0,0.14910977777777779,62,10,103.37909090909093,0.0,0.0,0,0,0,0,0,0,0,0,0,0,0,0,0
7506946263716220190,143100,3079,12400,780200.0,i feel like sum wrong should i fall backfallback relationship fyp trending blowthisup viral viralvideo foryoupage foryou xyzbca,"['fallback', 'relationship', 'fyp', 'trending', 'blowthisup', 'viral', 'viralvideo', 'foryoupage', 'foryou', 'xyzbca']",10,2025-05-21 17:05:40,17,21,5,2025,2,0,evening,158579,0.203254293770828,282495,0.36208023583696486,0.003946423993847732,0.01589336067674955,0.06971225326839271,24.54309860786861,0,0,158579.0,0.203254293770828,141,18,61.400000000000034,-0.5,0.9,1,0,0,1,1,0,1,1,1,0,0,0,0
7505409497414798599,842300,7361,169500,5200000.0,back by high demands,[],0,2025-05-17 13:42:09,13,17,5,2025,5,1,afternoon,1019161,0.1959925,2574105,0.4950201923076923,0.001415576923076923,0.032596153846153844,0.0753789423076923,26.546570634407917,0,0,776181.5999999995,0.1959925,20,4,97.025,0.08,0.27,0,0,0,0,0,0,0,0,0,0,0,0,0
7507651121150807327,72600,255,192,669700.0,no description,[],0,2025-05-23 14:41:13,14,23,5,2025,4,0,afternoon,73047,0.10907421233388084,75795,0.11317754218306704,0.00038076750783933103,0.00028669553531431984,0.03294176496938928,11.5428008681589,0,0,73047.0,0.10907421233388084,14,2,35.60500000000002,0.0,0.0,0,0,0,0,0,0,0,0,0,0,0,0,0
7507057438391078174,27400,300,5428,247900.0,cookieking cookie fyp funny,"['cookieking', 'cookie', 'fyp', 'funny']",4,2025-05-22 00:17:04,0,22,5,2025,3,0,night,33128,0.1336345300524405,83180,0.3355385235982251,0.0012101653892698668,0.02189592577652279,0.05128035498184752,18.02645505163857,0,0,33128.0,0.1336345300524405,32,4,33.57500000000002,0.25,1.0,0,0,0,1,0,0,0,0,0,0,1,0,0
7505067720455703854,128600,640,1062,1900000.0,replying to thekharashow the life of glorilla  glorilla raptok musichistory history evolution bigglo,"['glorilla', 'raptok', 'musichistory', 'history', 'evolution', 'bigglo']",6,2025-05-16 15:36:05,15,16,5,2025,4,0,afternoon,130302,0.06858,142420,0.0749578947368421,0.0003368421052631579,0.0005589473684210526,0.020920842105263158,7.292773643365174,0,0,130302.0,0.06858,111,13,-8.098461538461521,0.0,0.0,0,0,0,0,0,0,0,0,0,0,0,0,0
7507450815469096235,22800,5789,10700,418400.0,do they  follow me for a surprise ig yariseason yari twins yari viral yariseason yaribetter sturdyqueen fyp fypシ foryou dance trending foryoupage twin twins yaritwins yaritwin school,"['yari', 'viral', 'yariseason', 'yaribetter', 'sturdyqueen', 'fyp', 'fypシ', 'foryou', 'dance', 'trending', 'foryoupage', 'twin', 'twins', 'yaritwins', 'yaritwin', 'school']",16,2025-05-23 01:43:52,1,23,5,2025,4,0,night,39289,0.0939029636711281,158745,0.37940965583173997,0.01383604206500956,0.0255736137667304,0.04372490439770554,15.355206675691072,0,0,39289.0,0.0939029636711281,202,27,60.363333333333344,0.0,0.0,0,0,0,1,1,1,1,1,1,0,0,0,0
7501302645982793002,205600,1173,7586,1900000.0,no description,[],0,2025-05-06 12:06:32,12,6,5,2025,1,0,afternoon,214359,0.11282052631578947,287325,0.15122368421052632,0.0006173684210526315,0.003992631578947368,0.035965947368421056,12.61200808909396,0,0,214359.0,0.11282052631578947,14,2,35.60500000000002,0.0,0.0,0,0,0,0,0,0,0,0,0,0,0,0,0
7507223839244340523,368700,4522,106300,1600000.0,fyp school leavingbsf sad,"['fyp', 'school', 'leavingbsf', 'sad']",4,2025-05-22 11:02:56,11,22,5,2025,3,0,morning,479522,0.29970125,1454310,0.90894375,0.00282625,0.0664375,0.12369437499999998,43.628612224808215,0,0,479522.0,0.29827418750907736,30,4,54.72500000000002,-0.5,1.0,0,0,0,1,0,0,0,0,0,0,0,0,0
7506931134190701867,26200,275,820,1400000.0,movie tiktok,"['movie', 'tiktok']",2,2025-05-21 16:07:04,16,21,5,2025,2,0,afternoon,27295,0.01949642857142857,35775,0.02555357142857143,0.00019642857142857144,0.0005857142857142858,0.006181071428571428,2.0814910013223593,0,0,27295.0,0.01949642857142857,14,2,35.60500000000002,0.0,0.0,0,0,0,0,0,0,0,0,0,0,0,1,0
7500390142771825951,419100,580,33800,4800000.0,dramatic horsefyp funny foryou horse horses funnyhorse funnyvideos funnytiktok,"['fyp', 'funny', 'foryou', 'horse', 'horses', 'funnyhorse', 'funnyvideos', 'funnytiktok']",8,2025-05-04 01:04:49,1,4,5,2025,6,1,night,453480,0.094475,760000,0.15833333333333333,0.00012083333333333333,0.0070416666666666666,0.0318875,11.170062861876342,0,0,453480.0,0.094475,88,9,9.700000000000017,-0.09166666666666667,0.8,0,0,0,1,0,0,0,1,0,0,1,0,0
7497368979132960043,89400,227,4989,764200.0,chia seed pudding recipes live on substack i have been loving chia seed pudding and changing up the flavor so it doesnt get boring  the perfect nourishing healthy superfood thats packed with fiber and protein  healthyrecipe chiaseedpuding foodasmr hormonehealthy,"['healthyrecipe', 'chiaseedpuding', 'foodasmr', 'hormonehealthy']",4,2025-04-25 21:41:21,21,25,4,2025,4,0,evening,94616,0.1238105208060717,140425,0.18375425281339963,0.00029704265898979326,0.006528395707929862,0.0404667626275844,14.203282536274418,0,0,94616.0,0.1238105208060717,277,39,59.21000000000001,0.24727272727272726,0.79,0,1,2,0,0,0,0,0,0,0,0,0,0
7507019917003099435,84100,701,7039,517600.0,kencarson kencarson,['kencarson'],1,2025-05-21 21:51:32,21,21,5,2025,2,0,evening,91840,0.17743431221020092,157995,0.3052453632148377,0.0013543276661514684,0.013599304482225657,0.0603008114374034,21.21565990300551,0,0,91840.0,0.17743431221020092,22,2,-48.994999999999976,0.0,0.0,0,0,0,0,0,0,0,0,0,0,0,0,0
7505628780564598059,42700,380,1275,299800.0,no way ddg reunites with charcfypシ ddg charc,"['fypシ', 'ddg', 'charc']",3,2025-05-18 03:53:34,3,18,5,2025,6,1,night,44355,0.1479486324216144,57350,0.19129419613075382,0.001267511674449633,0.004252835223482321,0.046764509673115406,16.42986669299064,0,0,44355.0,0.1479486324216144,50,8,71.81500000000001,0.0,0.0,0,0,0,0,0,1,0,0,0,0,0,0,0
7507435794748017963,651100,4747,35100,2100000.0,fyp fypシ viral fypage fyppppppppppppppppppppppp fy relatable makemefamous spam jesuslovesyou growingup,"['fyp', 'fypシ', 'viral', 'fypage', 'fyppppppppppppppppppppppp', 'fy', 'relatable', 'makemefamous', 'spam', 'jesuslovesyou', 'growingup']",11,2025-05-23 00:45:47,0,23,5,2025,4,0,night,690947,0.32902238095238096,1025835,0.4884928571428571,0.0022604761904761904,0.016714285714285713,0.10751595238095238,37.90869060461659,0,0,690947.0,0.29827418750907736,114,11,41.8518181818182,0.0,0.0,0,0,0,1,1,1,0,0,0,1,0,0,0
7506557524636634390,326900,2340,86100,2600000.0,рекомендации дружбаnzuko,"['рекомендации', 'дружба']",2,2025-05-20 15:57:05,15,20,5,2025,1,0,afternoon,415340,0.15974615384615384,1199600,0.4613846153846154,0.0009,0.033115384615384616,0.06466153846153845,22.757405805707876,0,0,415340.0,0.15974615384615384,30,2,120.20500000000001,0.0,0.0,0,0,0,0,0,0,0,0,0,0,0,0,0
7507198561801489707,83800,228,16600,620000.0,true story paramore music fyp foryoupage rock funny viral,"['paramore', 'music', 'fyp', 'foryoupage', 'rock', 'funny', 'viral']",7,2025-05-22 09:24:51,9,22,5,2025,3,0,morning,100628,0.16230322580645162,250940,0.40474193548387094,0.00036774193548387097,0.026774193548387098,0.06215161290322581,21.870015371911116,0,0,100628.0,0.16230322580645162,66,9,47.30000000000004,0.3,0.825,0,0,0,1,1,0,1,0,0,0,1,0,0
7506468773520493855,240600,1041,69700,3700000.0,the funny life of cats and dogs funnycat funnydog cat dog catsoftiktok dogsoftiktok fyp pets tiktok,"['funnycat', 'funnydog', 'cat', 'dog', 'catsoftiktok', 'dogsoftiktok', 'fyp', 'pets', 'tiktok']",9,2025-05-20 10:13:27,10,20,5,2025,1,0,morning,311341,0.08414621621621622,942805,0.2548121621621622,0.00028135135135135133,0.018837837837837837,0.03471905405405405,12.171165851574264,0,0,311341.0,0.08414621621621622,112,16,53.120000000000005,0.25,1.0,0,0,0,1,0,0,0,0,0,0,0,1,0
7506677032131071262,59700,769,41400,1700000.0,season for chickamauga turn train ride just opened from the tennessee valley railroad  send to someone who would love this  tennessee valley railroads chickamauga turn train ride just started back up for summer and takes you on a fun day trip from chattanooga to north georgia   destination the train takes you to chickamauga ga where you will have  minutes to explore tour  shop   followed by a nd stop at the chickamauga battlefield   when  select saturdays  sundays thru october  lasts around  hours round trip   we really enjoyed walking to the top of wilder tower exploring the gordonlee mansion and having lunch on the train  ryan had a brisket sandwich with  sides and i had a chicken salad dfgf  faq   tickets start at adult  tickets with dining car lunch start at adult  climatecontrolled coaches  restrooms on board  snacks  drinks available   service animals only  everyone who worked on the train was so friendly and made our experience great highly recommend  thanks tvrail for having us  i put a  to the ride on my page   tennesseevalleyrailroad  trainride train,"['tennesseevalleyrailroad', 'trainride', 'train']",3,2025-05-20 23:40:55,23,20,5,2025,1,0,night,101869,0.05992294117647059,477545,0.28090882352941177,0.0004523529411764706,0.024352941176470588,0.030243823529411764,10.588936951019688,0,0,101869.0,0.05992294117647059,1148,174,50.29861423220976,0.20900000000000005,0.4893333333333334,0,1,7,0,0,0,0,0,0,0,0,0,0
7507346928322022699,34000,1023,608,1200000.0,see you soon europe,[],0,2025-05-22 19:00:30,19,22,5,2025,3,0,evening,35631,0.0296925,45195,0.0376625,0.0008525,0.0005066666666666667,0.009331583333333332,3.195362333716789,0,0,35631.0,0.0296925,22,4,97.025,0.0,0.0,0,0,0,0,0,0,0,0,0,0,0,0,0
7507449453071076616,286400,430,1662,6300000.0,no description,[],0,2025-05-23 01:38:13,1,23,5,2025,4,0,night,288492,0.04579238095238095,305170,0.04843968253968254,6.825396825396825e-05,0.0002638095238095238,0.01388326984126984,4.8046224376300115,0,0,288492.0,0.04579238095238095,14,2,35.60500000000002,0.0,0.0,0,0,0,0,0,0,0,0,0,0,0,0,0
7502216216098934046,92100,419,6807,463100.0,real intamarcuswetrust fyp foru fypp quotes viral yourpage fyy foru fyppage righttime tiktok instagram,"['real', 'intamarcuswetrust', 'fyp', 'foru', 'fypp', 'quotes', 'viral', 'yourpage', 'fyy', 'fyppage', 'righttime', 'tiktok', 'instagram']",13,2025-05-08 23:10:41,23,8,5,2025,3,0,night,99326,0.21448067372057872,162265,0.350388684949255,0.00090477218743252,0.01469876916432736,0.0718745411358238,25.307580870029046,0,0,99326.0,0.21448067372057872,121,14,47.59642857142859,0.2,0.30000000000000004,1,0,0,1,1,0,0,0,0,0,0,1,0
7501787126137343278,140300,682,1830,4000000.0,my son is always feeling good singing had to sing a couple songs after we did a skit in hollywood ifeelgood singer,"['ifeelgood', 'singer']",2,2025-05-07 19:26:12,19,7,5,2025,2,0,evening,142812,0.035703,162010,0.0405025,0.0001705,0.0004575,0.010973749999999999,3.775954449635791,0,0,142812.0,0.035703,118,22,72.61545454545457,0.7,0.6000000000000001,0,1,1,0,0,0,0,0,0,0,0,0,0
7506273834241133870,27100,3172,555,354300.0,like stopppp,[],0,2025-05-19 21:36:50,21,19,5,2025,0,0,evening,30827,0.08700818515382444,48510,0.13691786621507196,0.008952864803838554,0.0015664690939881456,0.028676263053909114,10.034722039843551,0,0,30827.0,0.08700818515382444,12,2,120.20500000000001,0.0,0.0,0,0,0,0,0,0,0,0,0,0,0,0,0
7506561126843338015,43800,182,134,477500.0,grwm to get married,[],0,2025-05-20 16:11:35,16,20,5,2025,1,0,afternoon,44116,0.09238952879581151,46050,0.09643979057591623,0.000381151832460733,0.0002806282722513089,0.027933403141361255,9.77208206717072,0,0,44116.0,0.09238952879581151,20,4,75.87500000000001,0.25,0.25,0,0,0,0,0,0,0,0,0,0,0,0,0
7501361469326478635,2500000,11000,505000,15500000.0,all my links in bio  go follow _j elifrmhunnit fyp relatable beevswasp explore foryoupage,"['elifrm10hunnit', 'fyp', 'relatable', 'beevswasp', 'explore', 'foryoupage']",6,2025-05-06 15:54:42,15,6,5,2025,1,0,afternoon,3016000,0.1945806451612903,7605000,0.4906451612903226,0.0007096774193548388,0.03258064516129032,0.07480645161290321,26.344165123092658,1,0,776181.5999999995,0.1945806451612903,106,14,59.68214285714288,0.0,0.0,0,0,0,1,0,0,1,0,0,1,0,0,0
7505155796523633951,186700,1205,3242,1600000.0,joost  joost joostklein eurovision europapa eurovision fyp,"['joost', 'joostklein', 'eurovision', 'europapa', 'eurovision2023', 'fyp']",6,2025-05-16 21:17:45,21,16,5,2025,4,0,evening,191147,0.119466875,225145,0.140715625,0.000753125,0.00202625,0.0370038125,12.97894789186386,0,0,191147.0,0.119466875,72,7,-5.727142857142809,0.0,0.0,0,0,0,1,0,0,0,0,0,0,0,0,0
7506899160600169735,153600,270,37300,1100000.0,we didnt make it to the restaurant if youre wondering,[],0,2025-05-21 14:02:47,14,21,5,2025,2,0,afternoon,191170,0.17379090909090908,527950,0.47995454545454547,0.00024545454545454545,0.03390909090909091,0.06914090909090909,24.341098450602868,0,0,191170.0,0.17379090909090908,56,10,69.78500000000001,0.0,0.0,0,0,0,0,0,0,0,0,0,0,0,0,0
7507489748588514567,442900,1453,23200,3100000.0,que bonito cantan águilas  tiktokdeportes clubamerica,"['tiktokdeportes', 'clubamerica']",2,2025-05-23 04:14:35,4,23,5,2025,4,0,night,467553,0.15082354838709677,682165,0.22005322580645162,0.00046870967741935486,0.007483870967741935,0.04908274193548387,17.24948348446544,0,0,467553.0,0.15082354838709677,59,6,17.44500000000002,0.0,0.0,0,0,0,0,0,0,0,0,0,0,0,0,0
7505133906706976007,210100,507,33300,1100000.0,тгк nikulyatg,[],0,2025-05-16 19:52:44,19,16,5,2025,4,0,evening,243907,0.22173363636363635,545635,0.4960318181818182,0.0004609090909090909,0.030272727272727274,0.08174863636363637,28.798591835888026,0,0,243907.0,0.22173363636363635,14,2,77.90500000000002,0.0,0.0,0,0,0,0,0,0,0,0,0,0,0,0,0
7507354436470115627,9580,3916,178,367400.0,viral xyzbca trending money fyp,"['viral', 'xyzbca', 'trending', 'money', 'fyp']",5,2025-05-22 19:29:39,19,22,5,2025,3,0,evening,13674,0.03721829069134459,30940,0.08421339139902013,0.010658682634730538,0.0004844855743059336,0.013539466521502449,4.683069917453175,0,0,13674.0,0.03721829069134459,37,5,49.48000000000002,0.0,0.0,0,0,0,1,1,0,0,0,1,0,0,0,0
7505273225585315118,427800,1353,46900,1500000.0,feels good tbh fypシ foryou foryoupage,"['fypシ', 'foryou', 'foryoupage']",3,2025-05-17 04:54:10,4,17,5,2025,5,1,night,476053,0.3173686666666667,903565,0.6023766666666667,0.000902,0.031266666666666665,0.11102433333333334,39.14908743030995,0,0,476053.0,0.29827418750907736,41,6,87.94500000000002,0.7,0.6000000000000001,0,0,0,0,0,1,1,1,0,0,0,0,0
7505878043571817745,44800,185,20800,1100000.0,ensalada de garbanzo y nopales  tazas de garbanzo cocido  tazas de nopales cocidos  tomates sin semilla  limones amarillos o real  cucharadas de salsa macha  o más depende de tu gusto  taza de cebollita verde  jalapeños sin semilla cilantro fresco picado  de taza de aceite de oliva sal y pimienta recetas comida receta,"['recetas', 'comida', 'receta']",3,2025-05-18 20:00:37,20,18,5,2025,6,1,evening,65785,0.05980454545454546,253725,0.2306590909090909,0.0001681818181818182,0.01890909090909091,0.027429545454545456,9.593941926801023,0,0,65785.0,0.05980454545454546,337,52,6.345000000000027,0.2,0.30000000000000004,0,0,0,0,0,0,0,0,0,0,0,0,0
7507817684143246622,49400,131,187,487600.0,extra emily questions agents qualification as a streamers university professor  fyp viral agent extraemily streamer college,"['fyp', 'viral', 'agent00', 'extraemily', 'streamer', 'college']",6,2025-05-24 01:27:21,1,24,5,2025,5,1,night,49718,0.10196472518457753,51925,0.1064909762100082,0.0002686628383921247,0.0003835110746513536,0.030834905660377356,10.797915510909606,0,0,49718.0,0.10196472518457753,134,16,-10.329999999999984,0.0,0.1,0,0,0,1,1,0,0,0,0,0,0,0,0
7501031930155273518,385100,911,19000,1800000.0,happy cinco de mayo to all who celebrate cincodemayo mexicanindependanceday overwhelmedbyculture,"['cincodemayo', 'mexicanindependanceday', 'overwhelmedbyculture']",3,2025-05-05 18:35:54,18,5,5,2025,0,0,evening,405011,0.2250061111111111,579655,0.32203055555555554,0.0005061111111111111,0.010555555555555556,0.07288083333333334,25.66335798330511,0,0,405011.0,0.2250061111111111,101,11,-14.092954545454518,0.8,1.0,0,1,1,0,0,0,0,0,0,0,0,0,0
7505957022072917290,102800,706,2008,660700.0,this is being deleted airball,['airball'],1,2025-05-19 01:07:17,1,19,5,2025,0,0,night,105514,0.15970031784471014,126410,0.19132738005146058,0.0010685636446193432,0.0030392008475858935,0.04964340850612986,17.44770854723398,0,0,105514.0,0.15970031784471014,32,5,49.48000000000002,0.0,0.0,0,0,0,0,0,0,0,0,0,0,0,0,0
7506227182474136863,124900,240,616,1100000.0,this was so fun  popeyes popeyes orderingwhatthecarinfrontofmegot sarahlynnrain,[],0,2025-05-19 18:35:36,18,19,5,2025,0,0,evening,125756,0.11432363636363636,132260,0.12023636363636364,0.00021818181818181818,0.00056,0.034620727272727275,12.136402173087294,0,0,125756.0,0.11432363636363636,85,8,18.940000000000026,0.3,0.2,0,0,0,0,0,0,0,0,0,0,0,0,0
7506539078591057198,234600,689,22500,843200.0,no description,[],0,2025-05-20 14:46:33,14,20,5,2025,1,0,afternoon,257789,0.30572699240986717,463045,0.5491520398481974,0.0008171252371916509,0.02668406072106262,0.10522355313092978,37.09820713901114,0,0,257789.0,0.29827418750907736,14,2,35.60500000000002,0.0,0.0,0,0,0,0,0,0,0,0,0,0,0,0,0
7506349315451800878,120900,288,8557,528500.0,yay this is cringe nahni,[],0,2025-05-20 02:29:36,2,20,5,2025,1,0,night,129745,0.24549668874172184,207910,0.3933964049195837,0.0005449385052034058,0.016191106906338695,0.08185354777672657,28.8356835273384,0,0,129745.0,0.24549668874172184,32,5,100.24000000000002,0.0,0.0,0,0,0,0,0,0,0,0,0,0,0,0,0
