video_id,likes,comments,shares,plays,clean_description,hashtag_list,hashtag_count,create_time,create_hour,create_day,create_month,create_year,day_of_week,is_weekend,time_period,total_engagement,engagement_rate_per_play,weighted_engagement,weighted_engagement_rate,commenting_rate,sharing_rate,viral_coefficient,viral_coefficient_norm,is_viral_plays,is_highly_engaging,total_engagement_capped,engagement_rate_per_play_capped,description_length,word_count,readability_score,sentiment_polarity,sentiment_subjectivity,has_question,has_exclamation,exclamation_count,has_tag_fyp,has_tag_viral,has_tag_fypシ,has_tag_foryoupage,has_tag_foryou,has_tag_trending,has_tag_relatable,has_tag_funny,has_tag_tiktok,has_tag_fypシviral
7503908054266760494,76300,149,182,594500.0,fear of being perceived when theres no walls to be hide behind i love having agoraphobia,[],0,2025-05-13 12:36:59,12,13,5,2025,1,0,afternoon,76631,0.12889991589571068,78865,0.13265769554247267,0.00025063078216989066,0.00030613961312026916,0.03887317073170732,13.639864151576166,0,0,76631.0,0.12889991589571068,91,16,66.5275,0.04999999999999999,0.6499999999999999,0,0,0,0,0,0,0,0,0,0,0,0,0
7501749724031061294,552300,2206,132600,5400000.0,we were not thinking what rhett was thinking goodmythicalmorning funny humor lol comedy joke jokes,"['goodmythicalmorning', 'funny', 'humor', 'lol', 'comedy', 'joke', 'jokes']",7,2025-05-07 17:00:27,17,7,5,2025,2,0,evening,687106,0.12724185185185186,1889330,0.3498759259259259,0.0004085185185185185,0.024555555555555556,0.050532037037037035,17.761885378062395,0,0,687106.0,0.12724185185185186,106,15,52.58250000000001,0.525,0.85,0,0,0,0,0,0,0,0,0,0,1,0,0
7505226322109549854,165500,1197,770,659600.0,,[],0,2025-05-17 01:51:30,1,17,5,2025,5,1,night,167467,0.2538917525773196,179185,0.2716570648878108,0.0018147362037598544,0.0011673741661613099,0.07711416009702851,27.16006120655305,0,0,167467.0,0.2538917525773196,1,0,49.48000000000002,0.0,0.0,0,0,0,0,0,0,0,0,0,0,0,0,0
7507394664970882334,183300,480,7926,3800000.0,he lives a fairytale life with me,[],0,2025-05-22 22:05:46,22,22,5,2025,3,0,night,191706,0.05044894736842105,264960,0.06972631578947368,0.0001263157894736842,0.0020857894736842106,0.016202842105263154,5.624712990017451,0,0,191706.0,0.05044894736842105,35,7,90.95857142857145,0.0,0.0,0,0,0,0,0,0,0,0,0,0,0,0,0
7504830220269063455,69900,169,703,622900.0,the internets bff alix earle is turning heads on the  sports illustrated swimsuit issue launch party red carpet in nyc,[],0,2025-05-16 00:14:27,0,16,5,2025,4,0,night,70772,0.11361695296195216,77775,0.12485952801412747,0.0002713116069995184,0.0011285920693530262,0.03470364424466207,12.165717675075248,0,0,70772.0,0.11361695296195216,125,20,56.6057142857143,0.0,0.0,0,0,0,0,0,0,0,0,0,0,0,0,0
7507142330932038942,310200,758,7765,1500000.0,ginnyandgeorgia ginnyandgeorgiaedit ginnyandgeorgianetflix ginny ginnymiller georgiamiller abbylittman marcusbaker imdoingitareyou cringe funny iconic ate foryou foryoupage viral blow_output,[],0,2025-05-22 05:46:50,5,22,5,2025,3,0,morning,318723,0.212482,391640,0.26109333333333334,0.0005053333333333333,0.005176666666666667,0.06643399999999999,23.384063998136842,0,0,318723.0,0.212482,207,17,-49.29058823529411,0.375,0.75,0,0,0,0,0,0,0,0,0,0,0,0,0
7497254599179406614,584000,4252,85300,5900000.0,top  worst laughs   funnycompilation funnyvideos usa_tiktok fyp,"['funnycompilation', 'funnyvideos', 'usa_tiktok', 'fyp']",4,2025-04-25 14:16:58,14,25,4,2025,4,0,afternoon,673552,0.11416135593220339,1458260,0.24716271186440678,0.0007206779661016949,0.014457627118644067,0.04162135593220339,14.611491875412542,0,0,673552.0,0.11416135593220339,72,7,40.09,-0.25,0.75,0,0,0,1,0,0,0,0,0,0,0,0,0
7506581467384827166,235700,2287,9447,1300000.0,dont you hear it,[],0,2025-05-20 17:30:26,17,20,5,2025,1,0,evening,247434,0.19033384615384616,341605,0.26277307692307694,0.0017592307692307692,0.007266923076923077,0.06108546153846153,21.49307490093268,0,0,247434.0,0.19033384615384616,19,4,118.17500000000001,0.0,0.0,1,0,0,0,0,0,0,0,0,0,0,0,0
7505512214900641054,23600,108,1022,358700.0,lol  funnyvideos funny,"['funnyvideos', 'funny']",2,2025-05-17 20:21:01,20,17,5,2025,5,1,evening,24730,0.06894340674658489,34360,0.09579035405631448,0.00030108725954836914,0.0028491775857262336,0.022167828268748257,7.733648707921875,0,0,24730.0,0.06894340674658489,26,3,62.79000000000002,0.525,0.85,0,0,0,0,0,0,0,0,0,0,1,0,0
7505563860775030062,32800,80300,325,808500.0,pt,[],0,2025-05-17 23:41:44,23,17,5,2025,5,1,night,113425,0.14029066171923316,437550,0.5411873840445269,0.09931972789115646,0.00040197897340754483,0.06215213358070501,21.870199458730983,0,0,113425.0,0.14029066171923316,4,1,49.48000000000002,0.0,0.0,0,0,0,0,0,0,0,0,0,0,0,0,0
7507079297715293471,146200,584,7434,1100000.0,the socks on the night stand didnt stand a chance tunatunahaulferretferretsoftiktokferrettokpetsfypforyouforyoupageanimaltokdogtokcattokbabytoktoddlermomtokmomlifedogsoftiktokfunnyanimalsfunnypetsanimalvoiceoversvoiceoversoutherngirlpetsoftiktokzoohomehouseclotheswildlifewildliferehabgeorgiasouthgeorgia babytoddlermomhack,"['tuna', 'tunahaul', 'ferret', 'ferretsoftiktok', 'ferrettok', 'pets', 'fyp', 'foryou', 'foryoupage', 'animaltok', 'dogtok', 'cattok', 'babytok', 'toddler', 'momtok', 'momlife', 'dogsoftiktok', 'funnyanimals', 'funnypets', 'animalvoiceovers', 'voiceover', 'southerngirl', 'petsoftiktok', 'zoo', 'home', 'house', 'clothes', 'wildlife', 'wildliferehab', 'georgia', 'southgeorgia', 'baby', 'momhack']",33,2025-05-22 01:42:08,1,22,5,2025,3,0,night,154218,0.1401981818181818,223460,0.20314545454545455,0.0005309090909090909,0.0067581818181818186,0.045544727272727265,15.99860958664611,0,0,154218.0,0.1401981818181818,359,12,-355.245,0.0,0.0,0,0,0,1,0,0,1,1,0,0,0,0,0
7505754784025136415,30200,81,290,427300.0,debloat protocol in bio gs debloat healthtips looksmax bloated bloatedstomach bloatingtips,"['debloat', 'healthtips', 'looksmax', 'bloated', 'bloatedstomach', 'bloatingtips']",6,2025-05-18 12:02:52,12,18,5,2025,6,1,afternoon,30571,0.07154458226070676,33505,0.0784109524923941,0.0001895623683594664,0.0006786800842499415,0.02184062719400889,7.617965952833741,0,0,30571.0,0.07154458226070676,98,11,26.470000000000027,0.0,0.0,0,0,0,0,0,0,0,0,0,0,0,0,0
7506206189412306218,102700,270,7983,661300.0,is there a prettier ice cream shop around i dont think so drove up to kohler for a little day trip and had to stop into the greenhouse always such a dreamy visit  fyi several people have commented that bipoc visitors have experienced racial profiling and discomfort from security and patrons here  including being closely watched i didnt see this happen while i visited but believe the people sharing their stories please be aware of this context if youre planning a visit and thank you to everyone who spoke up  icecream wisconsin kohler icecreamshop cafes cafetok icecreamtok dessert cafe thingstodoinwisconsin midwest midwestlife daytrip daytripfrommilwaukee mkefoodie visitwisconsin visitkohler,"['icecream', 'wisconsin', 'kohler', 'icecreamshop', 'cafes', 'cafetok', 'icecreamtok', 'dessert', 'cafe', 'thingstodoinwisconsin', 'midwest', 'midwestlife', 'daytrip', 'daytripfrommilwaukee', 'mkefoodie', 'visitwisconsin', 'visitkohler']",17,2025-05-19 17:14:53,17,19,5,2025,0,0,evening,110953,0.16778013004687736,183880,0.278058369877514,0.0004082867079993951,0.012071676999848784,0.05645153485558748,19.854738578295898,0,0,110953.0,0.16778013004687736,731,107,48.56965537383178,0.17250000000000001,0.43,1,1,3,0,0,0,0,0,0,0,0,0,0
7507670883297660202,25600,212,180,779700.0,deshae frost is recieving backlash after making fun of a janitor doing his job at streamer university   deshaefrost rayasianboy kaicenat streameruniversity,"['deshaefrost', 'rayasianboy', 'kaicenat', 'streameruniversity']",4,2025-05-23 15:58:09,15,23,5,2025,4,0,afternoon,25992,0.03333589842247018,28460,0.036501218417340005,0.0002718994485058356,0.0002308580223162755,0.010170578427600357,3.491991139375667,0,0,25992.0,0.03333589842247018,162,21,16.32000000000002,0.3,0.2,0,0,0,0,0,0,0,0,0,0,0,0,0
7506306825709456671,30200,32,1096,303200.0,fypfamilypov,"['fyp', 'family', 'pov']",3,2025-05-19 23:44:31,23,19,5,2025,0,0,night,31328,0.1033245382585752,41320,0.1362796833773087,0.00010554089709762533,0.0036147757255936674,0.03282585751978892,11.501821500607342,0,0,31328.0,0.1033245382585752,15,1,-217.17999999999998,0.0,0.0,0,0,0,1,0,0,0,0,0,0,0,0,0
7504732894900866322,162400,738,2790,8400000.0,penyuntikan anti radang pada induk sapi tiktok shorts,"['tiktok', 'shorts']",2,2025-05-15 17:56:34,17,15,5,2025,3,0,evening,165928,0.019753333333333335,193990,0.023094047619047618,8.785714285714286e-05,0.00033214285714285713,0.006109642857142857,2.056237251952958,0,0,165928.0,0.019753333333333335,56,8,61.24000000000001,0.0,0.0,0,0,0,0,0,0,0,0,0,0,0,1,0
7505295743628905759,107500,301,5379,474000.0,i literally told him let her cry until she gets out the tub dad had other plans wthelly fyp viral girldad,"['fyp', 'viral', 'girldad']",3,2025-05-17 06:21:14,6,17,5,2025,5,1,morning,113180,0.23877637130801688,162795,0.34344936708860757,0.0006350210970464135,0.011348101265822785,0.07743396624472573,27.2731294667634,0,0,113180.0,0.23877637130801688,111,21,72.72000000000003,-0.125,0.375,0,0,0,1,1,0,0,0,0,0,0,0,0
7505622085008493867,97000,697,6783,374800.0,high school sweethearts highschoolhearts,['highschoolhearts'],1,2025-05-18 03:27:50,3,18,5,2025,6,1,night,104480,0.27876200640341514,168315,0.4490795090715048,0.0018596584845250801,0.018097652081109927,0.09304935965848452,32.79399070882279,0,0,104480.0,0.27876200640341514,48,4,54.72500000000002,0.16,0.54,0,0,0,0,0,0,0,0,0,0,0,0,0
7507275239974423854,67100,749,3855,542800.0,her kt adriannaaa,[],0,2025-05-22 14:22:24,14,22,5,2025,3,0,afternoon,71704,0.13210022107590272,109395,0.20153831982313927,0.0013798820928518792,0.007102063375092115,0.04345707442888725,15.260514723004949,0,0,71704.0,0.13210022107590272,24,3,62.79000000000002,0.0,0.0,0,0,0,0,0,0,0,0,0,0,0,0,0
7507347194672876856,40400,1725,49600,862000.0,name someone who doesnt do this,[],0,2025-05-22 19:01:24,19,22,5,2025,3,0,evening,91725,0.10640951276102088,545025,0.6322795823665893,0.0020011600928074246,0.05754060324825986,0.061093387470997684,21.495877134125692,0,0,91725.0,0.10640951276102088,33,6,87.94500000000002,0.0,0.0,0,0,0,0,0,0,0,0,0,0,0,0,0
7499516222107585814,368700,4009,109800,2900000.0,no description,[],0,2025-05-01 16:33:14,16,1,5,2025,3,0,afternoon,482509,0.16638241379310345,1486745,0.5126706896551724,0.0013824137931034482,0.03786206896551724,0.06912224137931035,24.334498434662663,0,0,482509.0,0.16638241379310345,14,2,35.60500000000002,0.0,0.0,0,0,0,0,0,0,0,0,0,0,0,0,0
7507418334967745823,48400,968,244,820400.0,guess what store was use to be,[],0,2025-05-22 23:37:33,23,22,5,2025,3,0,night,49612,0.060472940029254026,55680,0.06786933203315455,0.0011799122379327158,0.0002974158946855193,0.01852657240370551,6.446273625842727,0,0,49612.0,0.060472940029254026,30,7,115.13000000000002,0.0,0.0,0,0,0,0,0,0,0,0,0,0,0,0,0
7507701925173890335,18000,35,84,253100.0,my happy ass jumped right outta bed for some free margs,[],0,2025-05-23 17:58:21,17,23,5,2025,4,0,evening,18119,0.07158830501777953,19015,0.07512840774397471,0.0001382852627419992,0.0003318846305807981,0.02167009087317266,7.5576724117668475,0,0,18119.0,0.07158830501777953,55,11,95.68818181818183,0.49523809523809526,0.7785714285714285,0,0,0,0,0,0,0,0,0,0,0,0,0
7505401199647149329,287600,1581,67800,1800000.0,tommycash tiktok fyp foryou,"['tommycash', 'tiktok', 'fyp', 'foryou']",4,2025-05-17 13:10:33,13,17,5,2025,5,1,afternoon,356981,0.19832277777777776,973505,0.5408361111111111,0.0008783333333333333,0.03766666666666667,0.07850583333333333,27.652090746145493,0,0,356981.0,0.19832277777777776,32,4,33.57500000000002,0.0,0.0,0,0,0,1,0,0,0,1,0,0,0,1,0
7507691723452189994,127100,207,1573,749500.0,when do i start the hunger games thehungergames sotrcastingcontest,"['thehungergames', 'sotrcastingcontest']",2,2025-05-23 17:18:56,17,23,5,2025,4,0,evening,128880,0.17195463642428285,143865,0.1919479653102068,0.000276184122748499,0.0020987324883255504,0.05269099399599733,18.52518998923512,0,0,128880.0,0.17195463642428285,71,9,61.26750000000001,0.0,0.0,1,0,0,0,0,0,0,0,0,0,0,0,0
7507089649978903839,64600,2875,7749,1100000.0,rude karen gets instant karma  she was angry about sitting next to someone wearing a maga hat hat karen flying,[],0,2025-05-22 12:00:00,12,22,5,2025,3,0,afternoon,75224,0.06838545454545454,156465,0.14224090909090908,0.0026136363636363636,0.007044545454545454,0.02456063636363636,8.579631970765194,0,0,75224.0,0.06838545454545454,116,20,68.93833333333333,-0.2,0.5666666666666667,0,1,1,0,0,0,0,0,0,0,0,0,0
7502110368307678486,484000,2237,60100,3400000.0,it took  minutes for the pain to go away i did not see it on time  motorcycle funnytiktok biker insta foryoupagе,"['motorcycle', 'funnytiktok', 'biker', 'insta360', 'foryoupagе']",5,2025-05-08 16:19:48,16,8,5,2025,3,0,afternoon,546337,0.16068735294117648,1096185,0.32240735294117645,0.0006579411764705882,0.017676470588235293,0.05717602941176471,20.110885433472635,0,0,546337.0,0.16068735294117648,124,21,72.61545454545457,0.0,0.0,0,0,0,0,0,0,0,0,0,0,0,0,0
7507259172547857695,439200,1824,82000,2200000.0,redbull fyp bikinibottom spongebob relateable foryouu redbullgivesyouwings viral,"['redbull', 'fyp', 'bikinibottom', 'spongebob', 'relateable', 'foryouu', 'redbullgivesyouwings', 'viral']",8,2025-05-22 13:20:01,13,22,5,2025,3,0,afternoon,523024,0.23773818181818182,1268320,0.5765090909090909,0.0008290909090909091,0.03727272727272727,0.09012363636363636,31.759593949450377,0,0,523024.0,0.23773818181818182,89,8,-2.2099999999999795,0.0,0.0,0,0,0,1,1,0,0,0,0,0,0,0,0
7507797277499559174,1000000,11900,22800,7600000.0,por lo menos las chicas no me rechazan se logró gente parati fyp josé peláez,"['parati', 'fyp']",2,2025-05-24 00:07:58,0,24,5,2025,5,1,night,1034700,0.13614473684210526,1287500,0.16940789473684212,0.0015657894736842105,0.003,0.04265657894736842,14.977497551342339,0,0,776181.5999999995,0.13614473684210526,87,15,84.45000000000003,0.0,0.0,0,0,0,1,0,0,0,0,0,0,0,0,0
7505870319341571370,37900,5815,910,240400.0,trump trumpsupporters democrats,"['trump', 'trumpsupporters', 'democrats']",3,2025-05-18 19:30:54,19,18,5,2025,6,1,evening,44625,0.18562811980033278,76075,0.31645174708818635,0.024188851913477537,0.003785357737104825,0.06241888519134775,21.964510155197768,0,0,44625.0,0.18562811980033278,35,3,-21.809999999999945,0.0,0.0,0,0,0,0,0,0,0,0,0,0,0,0,0
7507072582122884383,62500,174,9472,437800.0,fypシ mcallen  parati fypシ,"['fypシ', 'mcallen', 'parati']",3,2025-05-22 01:15:54,1,22,5,2025,3,0,night,72146,0.164792142530836,158090,0.36110095934216535,0.00039744175422567384,0.02163544997715852,0.06033485609867519,21.227696477809246,0,0,72146.0,0.164792142530836,30,4,75.87500000000001,0.0,0.0,0,0,0,0,0,1,0,0,0,0,0,0,0
7505077011447074091,48400,143,546,731800.0,it used to be so droopy  what causes facial asymmetry repetitive habits like chewing on one side raising one eyebrow sleeping on one side prolonged poor posture a forward head tilt all of these can cause uneven tension which can visibly be seen across the face how does facial yoga help  facial yoga can restore muscular balance  retrain  realign the facial muscles through intentional movements muscle engagement  relaxing massage exactly why the face routine bundle was born link in bio,[],0,2025-05-16 16:12:08,16,16,5,2025,4,0,afternoon,49089,0.06707980322492484,54575,0.07457638699098114,0.00019540858157966658,0.0007461054933041815,0.020536075430445472,7.1567384269635586,0,0,49089.0,0.06707980322492484,510,80,56.702500000000015,-0.07500000000000001,0.1625,1,1,5,0,0,0,0,0,0,0,0,0,0
7506967781632478510,180300,309,21800,669900.0,no description,[],0,2025-05-21 18:29:15,18,21,5,2025,2,0,evening,202409,0.3021480818032542,399845,0.5968726675623227,0.0004612628750559785,0.03254217047320496,0.10700776235258992,37.729018754100466,0,0,202409.0,0.29827418750907736,14,2,35.60500000000002,0.0,0.0,0,0,0,0,0,0,0,0,0,0,0,0,0
7505929089354599697,55900,70,5009,336100.0,no description,[],0,2025-05-18 23:19:48,23,18,5,2025,6,1,night,60979,0.18143112168997322,106340,0.31639393037786373,0.00020827134781315084,0.014903302588515323,0.06192264207081226,21.789062163705665,0,0,60979.0,0.18143112168997322,14,2,35.60500000000002,0.0,0.0,0,0,0,0,0,0,0,0,0,0,0,0,0
7506840066648493343,156000,243,3709,1100000.0,harris dickinsons directorial debut is a criticism of the homelessness crisis in the uk and during his time premiering the movie in cannes he wore a tshirt that d former home secretary suella braverman harrisdickinson cannesfilmfestival cannesfilmfestival urchin urchinmovie urchinfilm homelessness homeless uk government,"['harrisdickinson', 'cannesfilmfestival', 'cannesfilmfestival2025', 'urchin', 'urchinmovie', 'urchinfilm', 'homelessness', 'homeless', 'uk', 'government']",10,2025-05-21 10:13:37,10,21,5,2025,2,0,morning,159952,0.1454109090909091,194305,0.1766409090909091,0.00022090909090909092,0.003371818181818182,0.045353363636363636,15.93095249629009,0,0,159952.0,0.1454109090909091,342,44,1.845909090909089,0.0,0.0,0,0,0,0,0,0,0,0,0,0,0,0,0
7507459052645960991,305000,1331,18500,981900.0,si sailor moon fuera una adelita  sailormoon sailormooncosplay sailormooncosplayer,"['sailormoon', 'sailormooncosplay', 'sailormooncosplayer']",3,2025-05-23 02:15:38,2,23,5,2025,4,0,night,324831,0.3308188206538344,496655,0.5058101639678175,0.0013555351868825747,0.018841022507383644,0.10893726448721865,38.41119904051941,0,0,324831.0,0.29827418750907736,90,9,9.700000000000017,0.0,0.0,0,0,0,0,0,0,0,0,0,0,0,0,0
7507400990916644139,56700,83,453,579000.0,woah streameruniversity kaicenat aka cbandzzz,"['streameruniversity', 'kaicenat']",2,2025-05-22 22:30:16,22,22,5,2025,3,0,night,57236,0.098853195164076,61645,0.10646804835924006,0.00014335060449050086,0.0007823834196891192,0.030075820379965455,10.529539019008267,0,0,57236.0,0.098853195164076,51,5,32.56000000000003,0.0,0.0,0,0,0,0,0,0,0,0,0,0,0,0,0
7507832137005927711,53700,454,3101,694200.0,fyp duggarfamily kidsandcounting tlc gulfshores memorialdayweekend,"['fyp', 'duggarfamily', '19kidsandcounting', 'tlc', 'gulfshores', 'memorialdayweekend']",6,2025-05-24 02:23:24,2,24,5,2025,5,1,night,57255,0.082476231633535,86980,0.12529530394698934,0.0006539902045520023,0.004467012388360703,0.027107173725151253,9.479966598790398,0,0,57255.0,0.082476231633535,75,6,-95.35499999999996,0.0,0.0,0,0,0,1,0,0,0,0,0,0,0,0,0
7501123536505802014,152700,108,665,925500.0,inspired by queen jessfammm,[],0,2025-05-06 00:30:38,0,6,5,2025,1,0,night,153473,0.1658271204754187,159890,0.17276066990815775,0.0001166936790923825,0.0007185305240410589,0.05013074014046461,17.620005860579774,0,0,153473.0,0.1658271204754187,29,4,33.57500000000002,0.0,0.0,0,0,0,0,0,0,0,0,0,0,0,0,0
7507376108300487967,79900,1978,5223,1000000.0,lily is getting free things at disney,[],0,2025-05-22 20:53:40,20,22,5,2025,3,0,evening,87101,0.087101,142020,0.14202,0.001978,0.005223,0.029137399999999997,10.197758155905257,0,0,87101.0,0.087101,37,7,78.87285714285717,0.4,0.8,0,0,0,0,0,0,0,0,0,0,0,0,0
7506561579207462186,183400,1088,15800,1900000.0,not lost just foreshadowing   rhode skin is on its way to sephora,[],0,2025-05-20 16:13:29,16,20,5,2025,1,0,afternoon,200288,0.10541473684210527,346840,0.18254736842105262,0.0005726315789473684,0.00831578947368421,0.03589684210526316,12.587575751151416,0,0,200288.0,0.10541473684210527,70,12,74.805,0.0,0.0,0,0,0,0,0,0,0,0,0,0,0,0,0
7507694958443482399,126700,862,23200,1100000.0,bmw just pulled the cover off the m cs at concorso deleganza villa deste  details of the trackoriented sports car remain to be revealed but what we do know is that it cranks out  horsepower sent straight to the rear wheels the coupe also sports a carbon fiber roof carbon fiber side mirrors and one aggressivelooking ducktail spoiler what do you think of the m css design bmwm mcs coupe sportscar track reveal concoursdelegance carsoftiktok cartok caranddriver,"['bmw', 'bmwm2', 'm2cs', 'coupe', 'sportscar', 'track', 'reveal', 'concoursdelegance', 'carsoftiktok', 'cartok', 'caranddriver']",11,2025-05-23 17:31:17,17,23,5,2025,4,0,evening,150762,0.13705636363636364,363010,0.3300090909090909,0.0007836363636363636,0.02109090909090909,0.05181909090909091,18.216926480799128,0,0,150762.0,0.13705636363636364,493,77,57.21153481012661,0.2,0.4,0,0,0,0,0,0,0,0,0,0,0,0,0
7506198101544291627,27000,314,1086,384300.0,cant wait to figure out what the role is about that wasnt included in the text  job linkedin notascam unemployed brainrot brainrotcore jobs,"['job', 'linkedin', 'notascam', 'unemployed', 'brainrot', 'brainrotcore', 'jobs']",7,2025-05-19 16:43:24,16,19,5,2025,0,0,afternoon,28400,0.07390059849076243,39430,0.10260213374967474,0.0008170699973978662,0.0028259172521467603,0.023746552172781682,8.291810477065086,0,0,28400.0,0.07390059849076243,153,23,66.63594202898551,0.0,0.0,0,1,1,0,0,0,0,0,0,0,0,0,0
7507788318613179694,8514,105,969,187200.0,this is unreal newjersey dts,"['newjersey', 'dts']",2,2025-05-23 23:33:44,23,23,5,2025,4,0,night,9588,0.05121794871794872,18729,0.10004807692307692,0.0005608974358974359,0.0051762820512820515,0.01806570512820513,6.283332852490088,0,0,9588.0,0.05121794871794872,31,5,66.40000000000003,0.0,0.0,0,0,0,0,0,0,0,0,0,0,0,0,0
7507689177824218398,397200,8187,5352,1000000.0,a slow start but we got there  thanksmom trending glowup,"['thanksmom', 'trending', 'glowup']",3,2025-05-23 17:08:52,17,23,5,2025,4,0,evening,410739,0.410739,491655,0.491655,0.008187,0.005352,0.1275351,44.98651011646337,0,1,410739.0,0.29827418750907736,61,10,103.625,-0.30000000000000004,0.39999999999999997,0,0,0,0,0,0,0,0,1,0,0,0,0
7507772623531625758,93100,153,1678,401100.0,finallyyyy,[],0,2025-05-23 22:32:29,22,23,5,2025,4,0,night,94931,0.23667663924208426,110645,0.27585390177013214,0.00038145100972326103,0.004183495387683869,0.07317102966841185,25.765957620501,0,0,94931.0,0.23667663924208426,10,1,-47.97999999999996,0.0,0.0,0,0,0,0,0,0,0,0,0,0,0,0,0
7505544514023525663,68800,262,11600,374500.0,no excuses  i love this woman man fypシ fyp bestfriend fypppppppppppppp,"['fypシ', 'fyp', 'bestfriend', 'fypppppppppppppp']",4,2025-05-17 22:26:19,22,17,5,2025,5,1,night,80662,0.21538584779706274,186110,0.4969559412550067,0.0006995994659546061,0.030974632843791722,0.0802429906542056,28.266267044496914,0,0,80662.0,0.21538584779706274,78,11,80.30636363636367,0.5,0.6,0,0,0,1,0,1,0,0,0,0,0,0,0
7507705845594066206,121700,302,5161,1500000.0,no description,[],0,2025-05-23 18:13:32,18,23,5,2025,4,0,evening,127163,0.08477533333333333,174820,0.11654666666666667,0.00020133333333333334,0.0034406666666666665,0.027193199999999997,9.510381402569386,0,0,127163.0,0.08477533333333333,14,2,35.60500000000002,0.0,0.0,0,0,0,0,0,0,0,0,0,0,0,0,0
7506294340864658734,111000,944,1739,790600.0,no description,[],0,2025-05-19 22:56:19,22,19,5,2025,0,0,night,113683,0.14379332152795346,133110,0.16836579812800403,0.0011940298507462687,0.0021995952441183912,0.044476600050594485,15.620970546372838,0,0,113683.0,0.14379332152795346,14,2,35.60500000000002,0.0,0.0,0,0,0,0,0,0,0,0,0,0,0,0,0
7505521026206420254,105500,345,1203,530300.0,no description,[],0,2025-05-17 20:55:10,20,17,5,2025,5,1,evening,107048,0.20186309636055064,119255,0.22488214218366961,0.0006505751461436922,0.0022685272487271355,0.06182330756175749,21.75394220057004,0,0,107048.0,0.20186309636055064,14,2,35.60500000000002,0.0,0.0,0,0,0,0,0,0,0,0,0,0,0,0,0
7507482491259817258,146900,718,24200,1200000.0,i got soss from the brits dachshund,['dachshund'],1,2025-05-23 03:47:04,3,23,5,2025,4,0,night,171818,0.14318166666666668,392490,0.327075,0.0005983333333333333,0.020166666666666666,0.053157499999999996,18.690124349096784,0,0,171818.0,0.14318166666666668,40,7,103.04428571428575,0.0,0.0,0,0,0,0,0,0,0,0,0,0,0,0,0
7506256302348176647,100900,417,13400,949600.0,no description,[],0,2025-05-19 20:28:15,20,19,5,2025,0,0,evening,114717,0.12080560235888796,236985,0.24956297388374052,0.0004391322662173547,0.014111204717775905,0.043385109519797814,15.23507135011944,0,0,114717.0,0.12080560235888796,14,2,35.60500000000002,0.0,0.0,0,0,0,0,0,0,0,0,0,0,0,0,0
7505992119819980039,711100,2776,10800,6600000.0,tiktok who is she she is on fire  hope it reaches her this pov  lady gaga in singapore night one   national stadium singapore                    capcut singapore singaporetiktok visitsingapore stanlig likesforlikе likeslike fypシ fyp foryou travelasia exploresg foryousingapore nationalstadium concert ladygaga ladygagainsingapore,"['capcut', 'singapore', 'singaporetiktok', 'visitsingapore', 'stanlig', 'likesforlikе', 'likes4like', 'fypシ', 'fyp', 'foryou', 'travelasia', 'exploresg', 'foryousingapore', 'nationalstadium', 'concert', 'ladygaga', 'ladygagainsingapore']",17,2025-05-19 03:23:01,3,19,5,2025,0,0,night,724676,0.10979939393939393,832980,0.1262090909090909,0.0004206060606060606,0.0016363636363636363,0.033842121212121205,11.861124060718693,0,0,724676.0,0.10979939393939393,370,40,9.29666666666671,0.0,0.0,1,0,0,1,0,1,0,1,0,0,0,0,0
7507276054155873566,75300,6337,1247,1200000.0,jollyrancher  fyp lebronjames blue raz on top,"['jollyrancher', '5', 'fyp', 'lebronjames']",4,2025-05-22 14:25:27,14,22,5,2025,3,0,afternoon,82884,0.06907,119455,0.09954583333333333,0.0052808333333333336,0.0010391666666666668,0.02229675,7.779229307172089,0,0,82884.0,0.06907,52,7,71.81500000000001,0.25,0.3,0,0,0,1,0,0,0,0,0,0,0,0,0
