video_id,likes,comments,shares,plays,clean_description,hashtag_list,hashtag_count,create_time,create_hour,create_day,create_month,create_year,day_of_week,is_weekend,time_period,total_engagement,engagement_rate_per_play,weighted_engagement,weighted_engagement_rate,commenting_rate,sharing_rate,viral_coefficient,viral_coefficient_norm,is_viral_plays,is_highly_engaging,total_engagement_capped,engagement_rate_per_play_capped,description_length,word_count,readability_score,sentiment_polarity,sentiment_subjectivity,has_question,has_exclamation,exclamation_count,has_tag_fyp,has_tag_viral,has_tag_fypシ,has_tag_foryoupage,has_tag_foryou,has_tag_trending,has_tag_relatable,has_tag_funny,has_tag_tiktok,has_tag_fypシviral
7507417850189974827,20400,45,259,273300.0,viral streameruniversity fyp rakai trending star kaicenat teamwork fypppppppppppppppppppp,"['viral', 'streameruniversity', 'fyp', 'rakai', 'trending', '5star', 'kaicenat', 'teamwork', 'fypppppppppppppppppppp']",9,2025-05-22 23:35:59,23,22,5,2025,3,0,night,20704,0.07575557994877424,23215,0.0849432857665569,0.00016465422612513722,0.0009476765459202342,0.023233443102817414,8.110399487136464,0,0,20704.0,0.07575557994877424,100,9,37.900000000000034,0.0,0.0,0,0,0,1,1,0,0,0,1,0,0,0,0
7505259249530883370,136500,747,3137,2900000.0,adinross lacy silky bendadonnn yourrage clipfarm fyp viral,"['adinross', 'lacy', 'silky', 'bendadonnn', 'yourrage', 'clipfarm', 'fyp', 'viral']",8,2025-05-17 03:59:42,3,17,5,2025,5,1,night,140384,0.048408275862068965,171605,0.05917413793103448,0.0002575862068965517,0.0010817241379310345,0.015114862068965515,5.240054937839427,0,0,140384.0,0.048408275862068965,67,8,29.515000000000015,0.0,0.0,0,0,0,1,1,0,0,0,0,0,0,0,0
7507431233698581806,92400,811,43900,600300.0,atticus gonzalez tortapounderslife,['tortapounders4life'],1,2025-05-23 00:28:07,0,23,5,2025,4,0,night,137111,0.22840413126769948,535455,0.8919790104947526,0.001350991171081126,0.07313010161585874,0.10535648842245543,37.14520674249466,0,0,137111.0,0.22840413126769948,38,3,-78.20999999999998,0.0,0.0,0,0,0,0,0,0,0,0,0,0,0,0,0
7507329810725850414,13300,27,622,172600.0,he is a menace thats how i ended up with the complete tmnt series on dvd and a bill cipher tattoo fyp transformers mallhaul shopping optimusprime converse tmnt gravityfalls,"['fyp', 'transformers', 'mallhaul', 'shopping', 'optimusprime', 'converse', 'tmnt', 'gravityfalls']",8,2025-05-22 17:54:07,17,22,5,2025,3,0,evening,13949,0.08081691772885284,19655,0.11387601390498261,0.00015643105446118194,0.003603707995365006,0.02607821552723059,9.116175864604083,0,0,13949.0,0.08081691772885284,184,29,51.16126436781613,0.1,0.4,0,0,0,1,0,0,0,0,0,0,0,0,0
7506193864647003435,77600,703,9088,722200.0,no description,[],0,2025-05-19 16:26:41,16,19,5,2025,0,0,afternoon,87391,0.12100664635834948,171995,0.2381542509000277,0.0009734145666020493,0.012583771808363333,0.04278856272500692,15.02416074472067,0,0,87391.0,0.12100664635834948,14,2,35.60500000000002,0.0,0.0,0,0,0,0,0,0,0,0,0,0,0,0,0
7507607137644809479,75900,233,7026,792800.0,в губке бобе нашли русский мат спанчбоб nerds рекомендации,"['спанчбоб', 'nerds', 'рекомендации']",3,2025-05-23 11:50:08,11,23,5,2025,4,0,morning,83159,0.10489278506559031,147325,0.1858287083753784,0.0002938950554994955,0.00886226034308779,0.03595774470232089,12.609108016059997,0,0,83159.0,0.10489278506559031,62,9,113.10000000000002,0.0,0.0,0,0,0,0,0,0,0,0,0,0,0,0,0
7506524076274355487,59100,115,281,327900.0,fakeperson,['fakeperson'],1,2025-05-20 13:47:40,13,20,5,2025,1,0,afternoon,59496,0.1814455626715462,62485,0.19056114669106436,0.0003507166819152181,0.0008569685879841415,0.05493229643183898,19.317608048895963,0,0,59496.0,0.1814455626715462,12,1,36.62000000000003,0.0,0.0,0,0,0,0,0,0,0,0,0,0,0,0,0
7507727233943948574,53200,254,400,543000.0,twitch  coreyu kaicenat streamerunivesity streameruniversityclips clips star clipfarm fypシ xyzcba foryou fy twitch fyp clips clip viral dukedennis basketball,"['kaicenat', 'streamerunivesity', 'streameruniversityclips', 'clips', '5star', 'clipfarm', 'fypシ', 'xyzcba', 'foryou', 'fy', 'twitch', 'fyp', 'clip', 'viral', 'dukedennis', 'basketball']",16,2025-05-23 19:36:31,19,23,5,2025,4,0,evening,53854,0.09917863720073665,58470,0.10767955801104973,0.0004677716390423573,0.0007366482504604051,0.030215469613259664,10.578912353329642,0,0,53854.0,0.09917863720073665,178,19,31.70789473684212,0.0,0.0,0,0,0,1,1,1,0,1,0,0,0,0,0
7507346254452591880,173500,801,6886,1900000.0,тгк teronlyone   плейлист,[],0,2025-05-22 18:57:45,18,22,5,2025,3,0,evening,181187,0.09536157894736842,246365,0.1296657894736842,0.00042157894736842105,0.0036242105263157897,0.030504894736842106,10.681239326779869,0,0,181187.0,0.09536157894736842,30,3,62.79000000000002,0.0,0.0,0,0,0,0,0,0,0,0,0,0,0,0,0
7506049576210615570,210400,1179,92100,1600000.0,no description,[],0,2025-05-19 07:06:00,7,19,5,2025,0,0,morning,303679,0.189799375,1137295,0.710809375,0.000736875,0.0575625,0.0858684375,30.255157790781077,0,0,303679.0,0.189799375,14,2,35.60500000000002,0.0,0.0,0,0,0,0,0,0,0,0,0,0,0,0,0
7506579873276644639,132200,180,7941,557600.0,fyp foryoupage fypシ,"['fyp', 'foryoupage', 'fypシ']",3,2025-05-20 17:24:15,17,20,5,2025,1,0,evening,140321,0.25165172166427546,212510,0.3811154949784792,0.00032281205164992827,0.01424139167862267,0.08268077474892396,29.12815168412315,0,0,140321.0,0.25165172166427546,23,3,90.99000000000004,0.0,0.0,0,0,0,1,0,1,1,0,0,0,0,0,0
7507325898379562271,31600,271,4571,335900.0,name worse duo,[],0,2025-05-22 17:38:51,17,22,5,2025,3,0,evening,36442,0.10849062220899078,78665,0.2341917237272998,0.0008067877344447752,0.01360821673116999,0.03951265257517118,13.865954550391836,0,0,36442.0,0.10849062220899078,16,3,90.99000000000004,-0.4,0.6,0,0,0,0,0,0,0,0,0,0,0,0,0
7505088501587774738,369800,2250,4455,1400000.0,the future is looking bright marvel dc supermanlegacy supergirlwomanoftomorrow fantasticfourfirststeps thunderbolts florencepugh millyalcock mcu dcu foryoupagе fypp,"['marvel', 'dc', 'supermanlegacy', 'supergirlwomanoftomorrow', 'fantasticfourfirststeps', 'thunderbolts', 'florencepugh', 'millyalcock', 'mcu', 'dcu', 'foryoupagе', 'fypp']",12,2025-05-16 16:56:32,16,16,5,2025,4,0,afternoon,376505,0.26893214285714284,425600,0.304,0.0016071428571428571,0.0031821428571428573,0.08259214285714285,29.096815657986685,0,0,376505.0,0.26893214285714284,177,17,-24.408235294117617,0.35000000000000003,0.46249999999999997,0,0,0,0,0,0,0,0,0,0,0,0,0
7505454126881344786,297300,2859,4676,5200000.0,jinx,[],0,2025-05-17 16:35:19,16,17,5,2025,5,1,afternoon,304835,0.058622115384615384,358355,0.06891442307692308,0.0005498076923076923,0.0008992307692307692,0.018146211538461538,6.311796094391526,0,0,304835.0,0.058622115384615384,5,1,49.48000000000002,0.0,0.0,0,0,0,0,0,0,0,0,0,0,0,0,0
7505553517331909931,162100,180,45100,907000.0,anything to get my man to flirt with me,[],0,2025-05-17 23:01:29,23,17,5,2025,5,1,night,207380,0.2286438809261301,614000,0.6769570011025359,0.00019845644983461963,0.04972436604189636,0.09349503858875413,32.951561604882315,0,0,207380.0,0.2286438809261301,40,9,94.30000000000001,0.0,0.0,0,0,0,0,0,0,0,0,0,0,0,0,0
7506183342421806378,50900,385,2965,456200.0,lil haqq motivating super bowl champ best wr in the nfl aj brown of the philadelphia eagles  haqqymuufitnesscertified,['haqqymuufitnesscertified'],1,2025-05-19 15:46:12,15,19,5,2025,0,0,afternoon,54250,0.1189171416045594,82475,0.18078693555458134,0.0008439281017097764,0.00649934239368698,0.039093599298553265,13.717797220509942,0,0,54250.0,0.1189171416045594,124,18,24.064999999999998,0.6666666666666666,0.4833333333333333,0,0,0,0,0,0,0,0,0,0,0,0,0
7506529968466218245,145900,428,7876,1200000.0,no description,[],0,2025-05-20 14:10:09,14,20,5,2025,1,0,afternoon,154204,0.12850333333333333,226800,0.189,0.00035666666666666664,0.006563333333333333,0.041904,14.711421389696913,0,0,154204.0,0.12850333333333333,14,2,35.60500000000002,0.0,0.0,0,0,0,0,0,0,0,0,0,0,0,0,0
7505174922470231338,199000,1992,12100,1100000.0,bibleverseoftheday scriptureoftheday christiantok scriptureclips foryoupage epicgospelz bibleverse shortstory,"['bibleverseoftheday', 'scriptureoftheday', 'christiantok', 'scriptureclips', 'foryoupage', 'epicgospelz', 'bibleverse', 'shortstory']",8,2025-05-16 22:32:01,22,16,5,2025,4,0,night,213092,0.19372,329960,0.2999636363636364,0.0018109090909090909,0.011,0.06397818181818182,22.515803362090463,0,0,213092.0,0.19372,118,8,-33.934999999999974,0.0,0.0,0,0,0,0,0,0,1,0,0,0,0,0,0
7507316351350983966,99700,206,839,624500.0,bc i said so,[],0,2025-05-22 17:01:51,17,22,5,2025,3,0,evening,100745,0.16132105684547637,109120,0.17473178542834267,0.0003298638911128903,0.001343474779823859,0.04913402722177742,17.267615525194977,0,0,100745.0,0.16132105684547637,13,4,97.025,0.0,0.0,0,0,0,0,0,0,0,0,0,0,0,0,0
7506053613802884383,47700,123,651,286300.0,smh jus fast    fyp,['fyp'],1,2025-05-19 07:22:37,7,19,5,2025,0,0,morning,48474,0.16931191058330422,54825,0.19149493538246595,0.0004296192804750262,0.002273838630806846,0.052016416346489694,18.286691380763,0,0,48474.0,0.16931191058330422,23,4,118.17500000000001,0.2,0.6,0,0,0,1,0,0,0,0,0,0,0,0,0
7507663918408518968,722600,1708,25500,3300000.0,gumball gumballwatterson gumballandpenny gumballxpenny penny tawog twwog theweirdworldofgumball theamazingworldofgumball fyyyyyyyyyyyyyyyy makemeviral fyyyyyppppp viral dontflop,"['gumball', 'gumballwatterson', 'gumballandpenny', 'gumballxpenny', 'penny', 'tawog', 'twwog', 'theweirdworldofgumball', 'theamazingworldofgumball', 'fyyyyyyyyyyyyyyyy', 'makemeviral', 'fyyyyyppppp', 'viral', 'dontflop']",14,2025-05-23 15:30:28,15,23,5,2025,4,0,afternoon,749808,0.22721454545454545,986140,0.29883030303030306,0.0005175757575757576,0.007727272727272728,0.07213151515151514,25.3984346734431,0,0,749808.0,0.22721454545454545,197,14,-49.089285714285694,0.0,0.0,0,0,0,0,1,0,0,0,0,0,0,0,0
7505908770221034798,29600,1894,10300,894300.0,if your visiting atlanta dont go to lake lanier you may not make it back foryoupage fyp foryou explore explorepage viralvideo blackcontentcreator southernaccent blackcommunity blacktiktok blacktiktok viral atl explore lakelanier fypage viral viraltiktok atlanta atl,"['foryoupage', 'fyp', 'foryou', 'explore', 'explorepage', 'viralvideo', 'blackcontentcreator', 'southernaccent', 'blackcommunity', 'blacktiktok', 'viral', 'atl', 'lakelanier', 'fypage', 'viraltiktok', 'atlanta']",16,2025-05-18 22:00:13,22,18,5,2025,6,1,night,41794,0.046733758246673376,142070,0.15886167952588617,0.002117857542211786,0.011517387901151739,0.02020239293302024,7.038764148738499,0,0,41794.0,0.046733758246673376,290,35,24.706785714285758,0.0,0.0,0,1,3,1,1,0,1,1,0,0,0,0,0
7497808490572893470,88800,4801,2927,3500000.0,we were out for lunch at texas roadhousea simple outing like so many others but for those living with fnd theres no such thing as simple marci had just stepped out of the truck and taken a few steps toward the restaurant i looked back and immediately noticed something wasnt rightshe wasnt responding as i walked over to her her legs buckled beneath her i stepped in caught her and helped guide her safely to a nearby bench before she could fall others around us asked if we needed helpand i truly appreciated their concern i let them know we had it under control this is part of our life with functional neurological disorder episodes like these are unpredictable they happen without warning but with care awareness and support we keep moving forward we share these moments not for sympathybut to help others understand what life with fnd really looks like  fyp fypシ  fndjourney pnes caregiverstrong invisibleillnessawareness awarenessmatters functionalneurologicaldisorder seizureawareness pnesawareness disabilityawareness chronicillnesswarrior chronicillnesssupport chronicillnesslife invisibleillnesscommunity rarediseaseawareness caregiversupport caregiverlife loveandstrength thisisfnd unseenstruggles awarenessiskey neurologicaldisorder spoonielife  fightfnd reallifewithfnd notjustinmyhead  lifewithfnd supportnotstigma strongforher friday,"['fyp', 'fypシ', 'fndjourney', 'pnes', 'caregiverstrong', 'invisibleillnessawareness', 'awarenessmatters', 'functionalneurologicaldisorder', 'seizureawareness', 'pnesawareness', 'disabilityawareness', 'chronicillnesswarrior', 'chronicillnesssupport', 'chronicillnesslife', 'invisibleillnesscommunity', 'rarediseaseawareness', 'caregiversupport', 'caregiverlife', 'loveandstrength', 'thisisfnd', 'unseenstruggles', 'awarenessiskey', 'neurologicaldisorder', 'spoonielife', 'fightfnd', 'reallifewithfnd', 'notjustinmyhead', 'lifewithfnd', 'supportnotstigma', 'strongforher', 'friday']",31,2025-04-27 02:06:34,2,27,4,2025,6,1,night,96528,0.02757942857142857,142075,0.040592857142857146,0.0013717142857142858,0.0008362857142857143,0.008966314285714285,3.0662205519831884,0,0,96528.0,0.02757942857142857,1411,182,36.06087912087915,0.10333333333333335,0.3614285714285715,0,0,0,1,0,1,0,0,0,0,0,0,0
7507028299026140447,58300,318,7412,391300.0,mmm yea,[],0,2025-05-21 22:24:02,22,21,5,2025,2,0,night,66030,0.168745208280092,134010,0.34247380526450294,0.0008126756963966267,0.018941988244313826,0.060257091745463835,21.200202697007022,0,0,66030.0,0.168745208280092,10,2,49.48000000000002,0.0,0.0,0,0,0,0,0,0,0,0,0,0,0,0,0
7505478104148708639,63700,513,5564,322100.0,ivan dathlete real blowthisupforme,"['d1athlete', 'real', 'blowthisupforme']",3,2025-05-17 18:08:35,18,17,5,2025,5,1,evening,69777,0.21663148090655077,121905,0.3784694194349581,0.0015926730828935112,0.017274138466314808,0.07394504812170133,26.039613772874297,0,0,69777.0,0.21663148090655077,40,4,54.72500000000002,0.2,0.30000000000000004,0,0,0,0,0,0,0,0,0,0,0,0,0
7505897045144718623,80700,352,83,453700.0,omg that is a ton of drinks to leave behind  i hope the next guests enjoy kevin saylor airbnb host fyp,"['airbnb', 'host', 'fyp']",3,2025-05-18 21:14:20,21,18,5,2025,6,1,evening,81135,0.17882962309896408,83290,0.18357945779149218,0.0007758430681066784,0.0001829402689001543,0.05389552567776064,18.951055166017685,0,0,81135.0,0.17882962309896408,110,21,95.4632142857143,0.0,0.39999999999999997,0,1,2,1,0,0,0,0,0,0,0,0,0
7506631120847506719,96600,472,328,906800.0,i was stressing them out,[],0,2025-05-20 20:43:01,20,20,5,2025,1,0,evening,97400,0.10741067490074989,102240,0.11274812527569475,0.0005205116894574327,0.00036171151301279226,0.03250816056462284,11.389498950670735,0,0,97400.0,0.10741067490074989,26,5,100.24000000000002,0.0,0.0,0,0,0,0,0,0,0,0,0,0,0,0,0
7506236970545286430,129600,352,9119,600100.0,so flattering on babydolltops hollister hollisterhaul haul foryoupage hollistersummer,"['babydolltops', 'hollister', 'hollisterhaul', 'haul', 'foryoupage', 'hollistersummer']",6,2025-05-19 19:13:32,19,19,5,2025,0,0,evening,139071,0.231746375604066,222550,0.37085485752374603,0.0005865689051824695,0.015195800699883353,0.07723912681219797,27.204243500014744,0,0,139071.0,0.231746375604066,93,9,-18.499999999999943,0.0,0.0,0,0,0,0,0,0,1,0,0,0,0,0,0
7506187608632986922,62200,1626,1785,1800000.0,diddy is not impressed with his team  trialwatch liveupdates courtroom diddytrial kerrymorgan diddydoit diddy diddiot shakemyash cassie hotmic,"['trialwatch', 'liveupdates', 'courtroom', 'diddytrial', 'kerrymorgan', 'diddydoit', 'diddy', 'diddiot', 'shakemyash', 'cassie', 'hotmic']",11,2025-05-19 16:02:42,16,19,5,2025,0,0,afternoon,65611,0.036450555555555555,88180,0.04898888888888889,0.0009033333333333334,0.0009916666666666667,0.011611666666666668,4.001491476295691,0,0,65611.0,0.036450555555555555,157,18,19.100000000000023,-0.5,1.0,0,1,3,0,0,0,0,0,0,0,0,0,0
7505136643578400031,93200,173,21500,1100000.0,replying to meeshka dwightschrute theoffice jimhalpert follow for more,"['dwightschrute', 'theoffice', 'jimhalpert']",3,2025-05-16 20:03:28,20,16,5,2025,4,0,evening,114873,0.10443,309065,0.28096818181818184,0.00015727272727272728,0.019545454545454546,0.04113318181818181,14.438896701274711,0,0,114873.0,0.10443,78,9,66.10000000000002,0.5,0.5,0,1,1,0,0,0,0,0,0,0,0,0,0
7507793031056067882,47500,148,124,1200000.0,no description,[],0,2025-05-23 23:51:54,23,23,5,2025,4,0,night,47772,0.03981,49480,0.04123333333333333,0.00012333333333333334,0.00010333333333333333,0.012019333333333332,4.14562304186332,0,0,47772.0,0.03981,14,2,35.60500000000002,0.0,0.0,0,0,0,0,0,0,0,0,0,0,0,0,0
7507385374117825822,112200,2686,4693,729100.0,jeffreydeanmorgan jonbernthal cmpunk normanreedus pedropascal andrewlincoln brianquinn twd oldermen thewalkingdead twdedit twdsurvivalchallenge twdedits edit edits foryoupage fyp fypシ foryoupage foryourpage fypage fypシviral fyppppppppppppppppppppppp rickgrimes daryldixon,"['jeffreydeanmorgan', 'jonbernthal', 'cmpunk', 'normanreedus', 'pedropascal', 'andrewlincoln', 'brianquinn', 'twd', 'oldermen', 'thewalkingdead', 'twdedit', 'TWDSurvivalChallenge', 'twdedits', 'edit', 'edits', 'foryoupage', 'fyp', 'fypシ', 'foryourpage', 'fypage', 'fypシviral', 'fyppppppppppppppppppppppp', 'rickgrimes', 'daryldixon']",24,2025-05-22 21:29:38,21,22,5,2025,3,0,evening,119579,0.1640090522562063,172560,0.23667535317514743,0.0036839939651625293,0.0064367027842545605,0.053157865862021675,18.69025370052597,0,0,119579.0,0.1640090522562063,301,25,-24.96399999999997,0.0,0.0,0,0,0,1,0,1,1,0,0,0,0,0,1
7504859877731208490,20900,22,906,176600.0,yay francisthefish owen_eldridge,['francisthefish'],1,2025-05-16 02:09:42,2,16,5,2025,4,0,night,21828,0.12360135900339751,30070,0.1702718006795017,0.0001245753114382786,0.005130237825594564,0.03967044167610419,13.921741280106431,0,0,21828.0,0.12360135900339751,35,3,34.59000000000003,0.0,0.0,0,0,0,0,0,0,0,0,0,0,0,0,0
7507617510624218376,265500,2151,4375,2600000.0,но самый лучший тгк kirkorovar,[],0,2025-05-23 12:30:21,12,23,5,2025,4,0,afternoon,272026,0.10462538461538462,320005,0.12307884615384615,0.0008273076923076923,0.0016826923076923078,0.03239442307692307,11.349286778554879,0,0,272026.0,0.10462538461538462,32,5,100.24000000000002,0.0,0.0,0,0,0,0,0,0,0,0,0,0,0,0,0
7506339134735142200,142200,1486,52100,1300000.0,fairycomedia deno_crazy,['comedia'],1,2025-05-20 01:49:40,1,20,5,2025,1,0,night,195786,0.1506046153846154,670630,0.5158692307692307,0.001143076923076923,0.04007692307692308,0.06544846153846154,23.035624419914477,0,0,195786.0,0.1506046153846154,31,2,-6.694999999999993,0.0,0.0,0,0,0,0,0,0,0,0,0,0,0,0,0
7507677639918832927,68000,219,632,2300000.0,check out kpop demon hunters on netflix on june th and while youre waiting try the dance challenge netflix twice netflixpartner twice takedownchallenge kpopdemonhunters,"['netflixpartner', 'twice', 'takedownchallenge', 'kpopdemonhunters']",4,2025-05-23 16:24:06,16,23,5,2025,4,0,afternoon,68851,0.029935217391304347,75415,0.032789130434782605,9.521739130434783e-05,0.00027478260869565215,0.009137,3.126566911476311,0,0,68851.0,0.029935217391304347,181,24,64.76500000000001,0.0,0.0,0,1,2,0,0,0,0,0,0,0,0,0,0
7505112661512686890,713600,4977,9450,4000000.0,core memory  pat bev pod viamontgomery m jamie,[],0,2025-05-16 18:30:24,18,16,5,2025,4,0,evening,728027,0.18200675,832985,0.20824625,0.00124425,0.0023625,0.056032125,19.706455179031014,0,0,728027.0,0.18200675,53,8,50.66500000000002,0.0,0.0,0,0,0,0,0,0,0,0,0,0,0,0,0
7506664825532058911,1200000,1293,55400,3800000.0,makes me feel validated in my decision to be lazy fyp college relatable real viral,"['fyp', 'college', 'relatable', 'real', 'viral']",5,2025-05-20 22:53:45,22,20,5,2025,1,0,night,1256693,0.3307086842105263,1760465,0.4632802631578947,0.00034026315789473683,0.014578947368421052,0.10657013157894735,37.574293303865765,0,0,776181.5999999995,0.29827418750907736,89,15,50.610000000000014,-0.024999999999999994,0.65,0,0,0,1,1,0,0,0,0,1,0,0,0
7506447420939636010,34500,76,6501,640100.0,юмор прикол круги,"['юмор', 'прикол', 'круги']",3,2025-05-20 08:52:00,8,20,5,2025,1,0,morning,41077,0.06417278550226527,99890,0.15605374160287455,0.000118731448211217,0.010156225589751601,0.02435369473519762,8.506467242503563,0,0,41077.0,0.06417278550226527,21,3,119.19000000000003,0.0,0.0,0,0,0,0,0,0,0,0,0,0,0,0,0
7507555574414839045,86300,1227,19400,1400000.0,тгк akamest rge глобальныерекомендации реки,"['rge', 'глобальныерекомендации', 'реки']",3,2025-05-23 08:30:06,8,23,5,2025,4,0,morning,106927,0.07637642857142857,286435,0.20459642857142857,0.0008764285714285714,0.013857142857142858,0.030016785714285715,10.50866716589171,0,0,106927.0,0.07637642857142857,49,5,117.16000000000003,0.0,0.0,0,0,0,0,0,0,0,0,0,0,0,0,0
7506247572768460063,110100,769,9321,709800.0,its a  now   drake fyp birthday,"['19', 'drake', 'fyp', 'birthday']",4,2025-05-19 19:54:37,19,19,5,2025,0,0,evening,120190,0.16932938856015778,207155,0.29184981684981687,0.001083403775711468,0.013131868131868132,0.057581431389123694,20.25421631249381,0,0,120190.0,0.16932938856015778,41,6,103.54,0.0,0.0,0,0,0,1,0,0,0,0,0,0,0,0,0
7507046562594589998,42800,212,15600,304400.0,for her hair and nails compa at least parati toxica,"['parati', 'toxica']",2,2025-05-21 23:34:58,23,21,5,2025,2,0,night,58612,0.19254927726675428,199860,0.6565703022339028,0.0006964520367936925,0.051248357424441525,0.08352825229960578,29.427779483378735,0,0,58612.0,0.19254927726675428,54,10,86.70500000000001,-0.3,0.4,0,0,0,0,0,0,0,0,0,0,0,0,0
7507322306595736862,775700,627,37200,3300000.0,cute extroverted baby  baby babiesoftiktok babytok fyp,"['baby', 'babiesoftiktok', 'babytok', 'fyp']",4,2025-05-22 17:24:56,17,22,5,2025,3,0,evening,813527,0.24652333333333334,1150835,0.34873787878787876,0.00019,0.011272727272727273,0.07963136363636363,28.050024788671006,0,0,776181.5999999995,0.24652333333333334,60,7,18.44428571428574,0.5,1.0,0,0,0,1,0,0,0,0,0,0,0,0,0
7506182319233879302,56800,222,3851,3400000.0,gridlock taters bringing nextlevel cubic crunch crispy potato grid crunchy potatoes fries frenchfry fry spuds tater fyp,"['crispy', 'potato', 'grid', 'crunchy', 'potatoes', 'fries', 'frenchfry', 'fry', 'spuds', 'tater', 'fyp']",11,2025-05-19 15:41:06,15,19,5,2025,0,0,afternoon,60873,0.017903823529411764,96420,0.028358823529411766,6.529411764705882e-05,0.0011326470588235295,0.005950529411764706,1.9999822969606125,0,0,60873.0,0.017903823529411764,134,17,48.9133823529412,0.0,0.0,0,1,1,1,0,0,0,0,0,0,0,0,0
7496252054088781098,365900,477,9512,3000000.0,the motivation this gives me gymtok gymtransformation glutes gymmotivation viral discipline foryou gymlife gymgoals,"['gymtok', 'gymtransformation', 'glutes', 'gymmotivation', 'viral', 'discipline', 'foryou', 'gymlife', 'gymgoals']",9,2025-04-22 21:26:46,21,22,4,2025,1,0,evening,375889,0.12529633333333334,463405,0.15446833333333335,0.000159,0.0031706666666666667,0.039206033333333334,13.757548553598912,0,0,375889.0,0.12529633333333334,125,14,-0.7464285714285381,0.0,0.0,0,0,0,0,1,0,0,1,0,0,0,0,0
7500726539328441646,819800,3791,4500,4700000.0,dont take it to heart bruh i really dont care fyp,['fyp'],1,2025-05-04 22:50:22,22,4,5,2025,6,1,night,828091,0.17618957446808511,883755,0.18803297872340424,0.0008065957446808511,0.0009574468085106382,0.05349691489361702,18.81012533027583,0,0,776181.5999999995,0.17618957446808511,53,11,103.37909090909093,0.2,0.2,0,0,0,1,0,0,0,0,0,0,0,0,0
7505462899360435511,135600,711,57000,2200000.0,,[],0,2025-05-17 17:09:24,17,17,5,2025,5,1,evening,193311,0.08786863636363636,709155,0.32234318181818183,0.00032318181818181816,0.02590909090909091,0.03937977272727272,13.81897454914083,0,0,193311.0,0.08786863636363636,1,0,49.48000000000002,0.0,0.0,0,0,0,0,0,0,0,0,0,0,0,0,0
7506201752237133086,217000,659,4563,824500.0,she is the girl shes always been oliviarodrigo charlixcx lorde girlsoconfusing,"['oliviarodrigo', 'charlixcx', 'lorde', 'girlsoconfusing']",4,2025-05-19 16:56:58,16,19,5,2025,0,0,afternoon,222222,0.26952334748332324,265925,0.32252880533656764,0.0007992722862340812,0.0055342631898120075,0.08378399029714978,29.518196289497656,0,0,222222.0,0.26952334748332324,85,11,34.160909090909115,0.0,0.0,0,0,0,0,0,0,0,0,0,0,0,0,0
7501317360607956255,88000,250,4164,1300000.0,i love him and his hardworking butt  bluecollar,['bluecollar'],1,2025-05-06 13:03:15,13,6,5,2025,1,0,afternoon,92414,0.07108769230769231,130890,0.10068461538461539,0.0001923076923076923,0.003203076923076923,0.022966307692307692,8.015953097270598,0,0,92414.0,0.07108769230769231,50,8,71.81500000000001,0.5,0.6,0,0,0,0,0,0,0,0,0,0,0,0,0
7506086957684985134,153800,513,880,2000000.0,tiktok movie fyp foryou cartoon thebadguys,"['tiktok', 'movie', 'fyp', 'foryou', 'cartoon', 'thebadguys']",6,2025-05-19 09:33:49,9,19,5,2025,0,0,morning,155193,0.0775965,165165,0.0825825,0.0002565,0.00044,0.023550250000000002,8.222407354855719,0,0,155193.0,0.0775965,48,6,45.64500000000001,0.0,0.0,0,0,0,1,0,0,0,1,0,0,0,1,0
7507255969714375979,179800,556,3968,2200000.0,what does tyrese always carry with him indiana nba nbaplayoffs pacers tyresehaliburton,"['indiana', 'nba', 'nbaplayoffs', 'pacers', 'tyresehaliburton']",5,2025-05-22 13:07:38,13,22,5,2025,3,0,afternoon,184324,0.08378363636363637,222260,0.10102727272727273,0.00025272727272727274,0.0018036363636363636,0.026087454545454546,9.119442342513143,0,0,184324.0,0.08378363636363637,92,12,18.405,0.0,0.0,0,0,0,0,0,0,0,0,0,0,0,0,0
7505867804063698206,221700,1493,3466,758900.0,no description,[],0,2025-05-18 19:20:46,19,18,5,2025,6,1,evening,226659,0.29866780867044407,263825,0.34764132296745287,0.0019673211226775597,0.004567136645144288,0.09227737514824087,32.52105366208025,0,0,226659.0,0.29827418750907736,14,2,35.60500000000002,0.0,0.0,0,0,0,0,0,0,0,0,0,0,0,0,0
