video_id,author,description,likes,comments,shares,plays,hashtags,music,create_time,video_url
7507753649028844843,_nate_rider,Which one sounds the best? 🏎️💨 #camshaft #carsoftiktok #cartok #tiktokautocampaign #fyp #carreview #cartips #trend #cars ,149600,579,5199,1000000,"camshaft, carsoftiktok, cartok, tiktokautocampaign, fyp, carreview, cartips, trend, cars",original sound,2025-05-23 21:19:16,https://www.tiktok.com/@_nate_rider/video/7507753649028844843
7507456084236356895,lifelately_xo,Lobster mac with a kale caesar has been my lazy meal lately. 🫶🏽 100% ok with admitting that I’m slightly obsessed with this combo!,23000,299,2516,280500,,i am obsessed with this,2025-05-23 02:04:07,https://www.tiktok.com/@lifelately_xo/video/7507456084236356895
7507702550863547694,ave.julianna,Bryan I am so sorry #fyp ,8623,38,774,242000,fyp,original sound,2025-05-23 18:01:03,https://www.tiktok.com/@ave.julianna/video/7507702550863547694
7494897865936866591,redclawscrabshack,that’s hot 🥵 #dallas #fortworthfoodie #dallasfoodie #dallaslovelist #fortworthlovelist #seafood #seafoodlover #seafoodboil #seafood #hotchicken #dfwseafood #dfwcrabshack #dfwhotchicken #happyhour ,241000,588,25200,5100000,"dallas, fortworthfoodie, dallasfoodie, dallaslovelist, fortworthlovelist, seafood, seafoodlover, seafoodboil, hotchicken, dfwseafood, dfwcrabshack, dfwhotchicken, happyhour",donk,2025-04-19 05:52:00,https://www.tiktok.com/@redclawscrabshack/video/7494897865936866591
7506720965041179947,btsslump,#thickshit😉 #fyp #visuallearner ,62300,2722,3691,791100,"thickshit😉, fyp, visuallearner",original sound,2025-05-21 02:31:28,https://www.tiktok.com/@btsslump/video/7506720965041179947
7507086470109318418,evgen020305,#бег  #пиво,133400,557,92400,1400000,"бег, пиво",оригинальный звук,2025-05-22 02:09:42,https://www.tiktok.com/@evgen020305/video/7507086470109318418
7505882444826955039,girlypopplaytime,@majinwill92 #girlypop #fyp ,429600,1603,34800,3800000,"girlypop, fyp",original sound,2025-05-18 20:17:40,https://www.tiktok.com/@girlypopplaytime/video/7505882444826955039
7508005683825085714,like.meli,Не парик ,120200,598,533,1900000,,оригинальный звук,2025-05-24 13:36:39,https://www.tiktok.com/@like.meli/video/7508005683825085714
7507260428574117150,chacondeeznutterz,,95900,1678,7633,453600,,original sound,2025-05-22 13:24:52,https://www.tiktok.com/@chacondeeznutterz/video/7507260428574117150
7507064836451323182,officialrayphillips,,150800,441,11500,681200,,original sound,2025-05-22 00:45:50,https://www.tiktok.com/@officialrayphillips/video/7507064836451323182
7506633043105533230,thelailacamillee,MHMMM 😭🔥@I3 ✨ dc:@Eŵay♠️🕸️ #foryoupage #fypシ #fypage #foryou #makemefamous #dance #funny #sinners #sisters #newtrend #blowthisup ,73300,250,1711,543800,"foryoupage, fypシ, fypage, foryou, makemefamous, dance, funny, sinners, sisters, newtrend, blowthisup",Pale Pale Moon Sinners Nola Bounce Mix,2025-05-20 20:50:46,https://www.tiktok.com/@thelailacamillee/video/7506633043105533230
7506719202456358190,daydrianharding,New hairdo 🔥🔥🔥,107300,1312,1095,622100,,original sound,2025-05-21 02:24:36,https://www.tiktok.com/@daydrianharding/video/7506719202456358190
7505444594327244075,pinkytoebigtoe_,#bestfriendlist #snapchat #fyp #xyzbc #4u #viral #girlfriend💗💕❤️ ,118300,837,21200,738600,"bestfriendlist, snapchat, fyp, xyzbc, 4u, viral, girlfriend💗💕❤️",20 bands,2025-05-17 15:58:52,https://www.tiktok.com/@pinkytoebigtoe_/video/7505444594327244075
7507279881068121387,iamranah,maybe i was born to just eat #fyp #fypシ #fypage #fypageシ #trending #viral #viralvideo #viraltiktok #egypt #مصر  #اكسبلور ,267600,505,91100,2200000,"fyp, fypシ, fypage, fypageシ, trending, viral, viralvideo, viraltiktok, egypt, مصر, اكسبلور",The Winner Is... - DeVotchKa Version,2025-05-22 14:40:19,https://www.tiktok.com/@iamranah/video/7507279881068121387
7507043702787902751,thecrazyhillbillygaming,What did he say? 🤣 #couplescomedy #soundproof #couplestiktok #husbandprank #relationships #prank #prankwars #fyp ,30700,389,3099,631000,"couplescomedy, soundproof, couplestiktok, husbandprank, relationships, prank, prankwars, fyp",original sound,2025-05-21 23:23:46,https://www.tiktok.com/@thecrazyhillbillygaming/video/7507043702787902751
7507315468244356370,bibik_alex,"Артикул на Яндекс Маркете: 51094387303 Давно искал именно его, но в России их почему-то почти не делают На практике оказалось, что он: -супер удобный для маленькой комнаты; -легкий, его просто двигать и менять конфигурации для разных ситуаций; -раскладывается в двуспальную кровать (у нас размер 200 на 200); -имеет съемные чехлы, можно их докупить и сменить цвет или просто постирать ткань в машинке; -очень круто выглядит; -в подарок положили две подушки)",220900,523,34300,2900000,,оригинальный звук,2025-05-22 16:58:16,https://www.tiktok.com/@bibik_alex/video/7507315468244356370
7507447449888296235,supercoolmathteacher,It’s ruthless out here sorry not sorry  #fyp #blooket #teacher #teaching #funny #viral #blowthisup #comedy #foryoupage #student ,28200,149,918,252100,"fyp, blooket, teacher, teaching, funny, viral, blowthisup, comedy, foryoupage, student",original sound,2025-05-23 01:31:00,https://www.tiktok.com/@supercoolmathteacher/video/7507447449888296235
7507713224733707551,brandon.r.food.re,Ice Cream Bar ASMR 🍦🎧 #fypシ #icecream #mukbang #oreo #dessert #afters #nestle #foodie ,150100,1210,8544,1600000,"fypシ, icecream, mukbang, oreo, dessert, afters, nestle, foodie",original sound,2025-05-23 18:42:13,https://www.tiktok.com/@brandon.r.food.re/video/7507713224733707551
7507778573869108510,sophiecham,not sure these lyrics are accurate but we will take it #fyp #wnba #fever ,40100,802,851,377900,"fyp, wnba, fever",Big Energy,2025-05-23 22:55:37,https://www.tiktok.com/@sophiecham/video/7507778573869108510
7507463003240123694,tylersports,NEVER MENTION ANGEL REESE IN THE SAME SENTENCE AS CAITLIN CLARK AGAIN!!! #nba #nbabasketball #basketball #wnba #trending ,65000,1888,1941,737400,"nba, nbabasketball, basketball, wnba, trending",original sound,2025-05-23 02:31:14,https://www.tiktok.com/@tylersports/video/7507463003240123694
7505819232530140462,kerclarke,not that kind of runner 🤠,53400,379,1753,664400,runtok,ECE Marketing Airball,2025-05-18 16:12:45,https://www.tiktok.com/@kerclarke/video/7505819232530140462
7507106319715896607,lafamosaserena,#lafamosaserena paratii ,96000,537,8684,492200,lafamosaserena,sonido original,2025-05-22 03:27:05,https://www.tiktok.com/@lafamosaserena/video/7507106319715896607
7507490042785434922,cariiimuneyyy_,best believe it😂😂#xyzbca #foryourpage #viralvideo #relatable #summer #outside #foryoupage ,114300,300,7077,432100,"xyzbca, foryourpage, viralvideo, relatable, summer, outside, foryoupage",Shake Dat Ass,2025-05-23 04:16:28,https://www.tiktok.com/@cariiimuneyyy_/video/7507490042785434922
7507313025049840927,foodwithbearhands,"Korean BBQ Shotgun Shells 😮‍💨 Recipe ⤵️⤵️⤵️ Before we dive into the recipe, I’ve got to give a shoutout to @Bearmountain BBQ —I’ve been using their pellets for the past five years, and there is a reason I do! Their smoke pellets add incredible depth and flavor to everything I cook. For this one, I’m using one of my NEW go-to blends: Old Fashioned Pellets! Shotgun Shell Ingredients: 1 Pack Manicotti (14 Shells) 1 Pack Bacon 1 lb Ground Beef 1 lb Ground Pork 1 Bunch Green Onions 1/4 Cup Canned Carrots 4 Tbsp Soy Sauce 1 Tbsp Sesame Oil 1 Tbsp Chili Oil 2 Tbsp Gochujang 2 Garlic Cloves 1 Tbsp Ginger 3 Tbsp BBQ Rub (Grilling with Dad-All Purpose) 4 Tbsp BBQ Sauce How to: 1. Add Ground Beef, Pork, Green Onions, Carrots, Soy Sauce, Sesame Oil, Chili Oil, Gochujang, Garlic, Ginger in a bowl and mix well 2. Add Mixture to a ziplock piping bag 3. Add mixture in Manicotti Shells and wrap with regular bacon (NOT THICK) 4. Refrigerate overnight or for 3-4 hours 5. Add your favorite BBQ rub  6. In the Smoker at 325 degrees for 45 min 7. Then add bbq sauce and let that set for 10-15 minutes or until bacon is cooked 8. Garnish with Spicy Korean Mayo, Green Onions, and Sesame Seeds Spicy Korean Mayo Ingredients: 1/2 Cup Mayo 2 Tbsp Gochujang 2 Tbsp Honey 1 Lemon How to ➡️ add ingredients in a bowl and whisk it’s that easy 😮‍💨 Smoker: @Weber Grills SearWood BBQ Rub: @Grillin With Dad  Knife: Bear Hands Cleaver @THE COOKING GUILD  Shirt: @Poncho  #korean #bbq #shotgun #shells #recipe ",97800,247,25600,1900000,"korean, bbq, shotgun, shells, recipe",original sound,2025-05-22 16:48:54,https://www.tiktok.com/@foodwithbearhands/video/7507313025049840927
7506530152780713221,indie.044,We did titration in chem today 👩‍🔬🧪.                                                                             .                                                                      .                                                                          .                                                                  .  #chrmistry #titration #school #lifeishard #matric #viral #fyp ,604900,2003,122400,2800000,"chrmistry, titration, school, lifeishard, matric, viral, fyp",original sound,2025-05-20 14:10:53,https://www.tiktok.com/@indie.044/video/7506530152780713221
7504700407403351342,prsprwellness,,91300,281,328,1000000,,original sound,2025-05-15 15:50:43,https://www.tiktok.com/@prsprwellness/video/7504700407403351342
7507045641667775786,lalaa.babbyy,ayyy 🔥🔥 #fypシ #trending #dance #prettygirl #wigstyling #lululemon #prettygirls ,89000,391,1461,450500,"fypシ, trending, dance, prettygirl, wigstyling, lululemon, prettygirls",original sound,2025-05-21 23:31:21,https://www.tiktok.com/@lalaa.babbyy/video/7507045641667775786
7507381954518584598,th.asanova,И почему второй вариант даже выглядит лучше?)      #мужчины #мужчинаиженщина #отношения ,285500,750,28800,1900000,"мужчины, мужчинаиженщина, отношения",оригинальный звук,2025-05-22 21:16:17,https://www.tiktok.com/@th.asanova/video/7507381954518584598
7503577702230756630,emmasliverpoolhome,#houserules #20something #house #rules #boyfriend #livingwithboyfriend #funny #houseoftiktok #homeowner #nonenegotiable #firsttimebuyer #essential ,281300,3833,16900,3800000,"houserules, 20something, house, rules, boyfriend, livingwithboyfriend, funny, houseoftiktok, homeowner, nonenegotiable, firsttimebuyer, essential",original sound,2025-05-12 15:13:51,https://www.tiktok.com/@emmasliverpoolhome/video/7503577702230756630
7501041410984987935,jankyybaee,obsessed ain’t the word 😭 #fy #fyp #babygirl #babytok ,491000,2202,33200,2700000,"fy, fyp, babygirl, babytok",papas freezeria sounds,2025-05-05 19:12:20,https://www.tiktok.com/@jankyybaee/video/7501041410984987935
7507111920659467528,loovmj,,164600,467,7390,623700,,original sound - polina,2025-05-22 03:48:25,https://www.tiktok.com/@loovmj/video/7507111920659467528
7507417204003015967,keemokazi,I’m always down to hear the tea 😂,113300,666,6092,1600000,,suara asli - 911,2025-05-22 23:33:12,https://www.tiktok.com/@keemokazi/video/7507417204003015967
7507593379883109639,officialgpakorea,프랭클린 윌리엄스 (Franklyn Williams) #analoghorror #horrortok #fyp #foryou #trending #viral #creepy #creepypasta #추천 #추천떠라 #공포 #무서운이야기 #미스터리 #미스터리사건 #괴담 #공포툰 #恐怖 #鬼神 #court #courtroom #franklynwilliams #crime ,694600,3160,7841,8400000,"analoghorror, horrortok, fyp, foryou, trending, viral, creepy, creepypasta, 추천, 추천떠라, 공포, 무서운이야기, 미스터리, 미스터리사건, 괴담, 공포툰, 恐怖, 鬼神, court, courtroom, franklynwilliams, crime",I Feel Fantastic,2025-05-23 10:56:44,https://www.tiktok.com/@officialgpakorea/video/7507593379883109639
7507546500814195976,sibikik,типичный день московской бальницы💃🏻 артикул протеиновых батончиков без сахара от @fitness_shock на озон - 273458144,166700,292,457,1400000,,оригінальний звук,2025-05-23 07:54:50,https://www.tiktok.com/@sibikik/video/7507546500814195976
7507745491350801695,theunprofessionalteacher,“It’s just a joke”.  It isn’t though. Attendance rates are awful and it shows. This is why kids aren’t prepared for the real world.  #highschoolteacher ,21800,1403,120,316800,highschoolteacher,original sound,2025-05-23 20:47:14,https://www.tiktok.com/@theunprofessionalteacher/video/7507745491350801695
7506626684737703211,aiyoungmoney,#tiktokfilter #tiktokgames #tiktokgamefilter #profile #stalk ,16900,226,703,929700,"tiktokfilter, tiktokgames, tiktokgamefilter, profile, stalk",original sound,2025-05-20 20:26:16,https://www.tiktok.com/@aiyoungmoney/video/7506626684737703211
7507660406354169118,jessmwelsh,I need the girlies to weigh in on this one #traveloutfit ,17800,1712,143,689400,traveloutfit,7 heures du matin,2025-05-23 15:17:13,https://www.tiktok.com/@jessmwelsh/video/7507660406354169118
7507791162325912875,lifewithgabo,#liloandstitch #stitchpostcredit #FYP #lilo #disney #stitch2025 ,19800,109,1623,690600,"liloandstitch, stitchpostcredit, fyp, lilo, disney, stitch2025",Hawaiian Roller Coaster Ride,2025-05-23 23:44:40,https://www.tiktok.com/@lifewithgabo/video/7507791162325912875
7507608722181524754,ya.ksenyaa,Да я и что Inst ya.ksenyaa,221000,364,36100,1300000,,оригинальный звук,2025-05-23 11:56:14,https://www.tiktok.com/@ya.ksenyaa/video/7507608722181524754
7507187549106982149,_mlecomeda_,огонь по тгк #огоньпохутору #хутор #танки #скуф #ипучий,109300,749,33700,1200000,"огоньпохутору, хутор, танки, скуф, ипучий",оригинальный звук - _mlecomeda_,2025-05-22 08:41:57,https://www.tiktok.com/@_mlecomeda_/video/7507187549106982149
7507846419957730606,mireyadelatorrefan,Cancelaron el concierto 🎶 #julionalvarez #viraltiktok #fyp #mireyadelatorre ,24400,308,466,626100,"julionalvarez, viraltiktok, fyp, mireyadelatorre",Las Mulas De Moreno,2025-05-24 03:19:11,https://www.tiktok.com/@mireyadelatorrefan/video/7507846419957730606
7507665304873405727,themakeshiftproject,Your Phone Hates Dave & Busters! Try It Out! #fyp #iphone #daveandbusters #message #text #hack #glitch ,85800,942,18400,2100000,"fyp, iphone, daveandbusters, message, text, hack, glitch",original sound,2025-05-23 15:36:11,https://www.tiktok.com/@themakeshiftproject/video/7507665304873405727
7507431476619791647,cajunfootrub,idk girl ,67500,387,764,297200,,original sound,2025-05-23 00:28:41,https://www.tiktok.com/@cajunfootrub/video/7507431476619791647
7507510991580564778,5.7hemisexual,Bout to buy me a boat #foryoupage #foryou #fyp #taxedovertime ,71500,249,28500,356600,"foryoupage, foryou, fyp, taxedovertime",original sound,2025-05-23 05:37:56,https://www.tiktok.com/@5.7hemisexual/video/7507510991580564778
7506674649493753119,happyemjo,"I think this is it, guys! If she doesn’t announce Rep TV soon you’ll find me crying in the corner. I can’t take these mind games no more #reptv #taylorswift #taylornation #ididsomethingbad ",28100,237,2765,656500,"reptv, taylorswift, taylornation, ididsomethingbad",I Did Something Bad,2025-05-20 23:31:45,https://www.tiktok.com/@happyemjo/video/7506674649493753119
7507333581648268549,derkachgym8,,180900,3089,89900,1900000,,оригинальный звук,2025-05-22 18:08:36,https://www.tiktok.com/@derkachgym8/video/7507333581648268549
7501126058356346158,user121234567893397,,475200,1592,32100,2000000,,original sound,2025-05-06 00:40:41,https://www.tiktok.com/@user121234567893397/video/7501126058356346158
7500188223910563079,warachan,คนที่สาม น่ารักสุดค่า 😚#ชีวืตในญี่ปุ่น #ครอบครัวตลก #ลูกครึ่งญี่ปุ่นไทย🇯🇵🇹🇭 #สามีญี่ปุ่น #รีวิวแฟนญี่ปุ่น #ชีวืตในต่างแดน🇹🇭 ,4300000,17000,195000,23900000,"ชีวืตในญี่ปุ่น, ครอบครัวตลก, ลูกครึ่งญี่ปุ่นไทย🇯🇵🇹🇭, สามีญี่ปุ่น, รีวิวแฟนญี่ปุ่น, ชีวืตในต่างแดน🇹🇭",愛♡スクリ～ム！,2025-05-03 12:00:56,https://www.tiktok.com/@warachan/video/7500188223910563079
7506906441622523154,seactyn,тгк: яна солях это я #fyp #recommendations ,142800,240,36500,1100000,"fyp, recommendations",оригинальный звук,2025-05-21 14:31:02,https://www.tiktok.com/@seactyn/video/7506906441622523154
7507666800004369695,strutnova,"“They're both disrespectful, but only one gets called out” #wendyortiz #indialove #evelynortiz ",25600,151,84,291400,"wendyortiz, indialove, evelynortiz",vertigo,2025-05-23 15:41:57,https://www.tiktok.com/@strutnova/video/7507666800004369695
7504898277335256350,olivialouisephoto,He gets a reallly funny grumpy face every time and it never gets old ,149400,198,13900,812100,,"Welp, Didn't Expect That",2025-05-16 04:38:44,https://www.tiktok.com/@olivialouisephoto/video/7504898277335256350
7506780804975185182,brin1eyyy,lowkey can’t even notice it lol😛👎,128800,936,4932,1400000,,suara asli - Alunaa💓,2025-05-21 06:23:45,https://www.tiktok.com/@brin1eyyy/video/7506780804975185182
7505525001903328558,user1826473021,#tanlines #fypp #viral #meninwomanfields ,92000,3597,6463,676000,"tanlines, fypp, viral, meninwomanfields",original sound,2025-05-17 21:10:46,https://www.tiktok.com/@user1826473021/video/7505525001903328558
7507754803158715679,thinkyoungdodgelayton,Like why is it always so awkward when service and sales interact with eachother🤣😭 #service #techtok #servicedepartment #fixingcars #carguys #pov #sales #salestips #salesman #mechanic #cartok #memes #funnyvideos #fypシ #foryoupage ,45200,434,4571,512700,"service, techtok, servicedepartment, fixingcars, carguys, pov, sales, salestips, salesman, mechanic, cartok, memes, funnyvideos, fypシ, foryoupage",lmk ꨄ,2025-05-23 21:23:29,https://www.tiktok.com/@thinkyoungdodgelayton/video/7507754803158715679
7497694489490754838,tim.geerts99,Which muscle is being used? 🤔 #calisthenics #pushups #bulking ,176900,2790,9980,3200000,"calisthenics, pushups, bulking",Kingslayer (Eliot's Version),2025-04-26 18:43:56,https://www.tiktok.com/@tim.geerts99/video/7497694489490754838
7507387317305347359,camfant,,127000,252,12000,540300,,I Exist I Exist I Exist,2025-05-22 21:37:11,https://www.tiktok.com/@camfant/video/7507387317305347359
7507526000809479467,hi70879,this lizard stole ur ho buy ur life #foryoupage ,126600,1407,1443,734200,foryoupage,original sound,2025-05-23 06:37:25,https://www.tiktok.com/@hi70879/video/7507526000809479467
7507786875235732782,mp4sauce,Oh,13400,18,36,469100,,original sound,2025-05-23 23:28:18,https://www.tiktok.com/@mp4sauce/video/7507786875235732782
7503680092799782152,janeduggan_,Day 1: DIY a pearl masterpiece with me #fyp #foryou #relatable #diy #2025bride #wedding #pearls #jewellery ,103700,445,204,2400000,"fyp, foryou, relatable, diy, 2025bride, wedding, pearls, jewellery",Better,2025-05-12 21:51:15,https://www.tiktok.com/@janeduggan_/video/7503680092799782152
7507077671445187886,elainarip,Anyone else’s husbands?? #trending #foryou #secretlivesofmormonwiveshulu #fypシ゚viral #tiktoktrend #viral #slomw ,71600,954,13500,505000,"trending, foryou, secretlivesofmormonwiveshulu, fypシ゚viral, tiktoktrend, viral, slomw",The Secret Lives of Mormon Wives. 9.6 on Hulu.,2025-05-22 01:36:04,https://www.tiktok.com/@elainarip/video/7507077671445187886
7505547076873358614,edit_ss.33,t-shirts #fyp #thriftorpass #shirt #forupage #foruyou ,939300,7741,17200,6800000,"fyp, thriftorpass, shirt, forupage, foruyou",sonido original,2025-05-17 22:36:04,https://www.tiktok.com/@edit_ss.33/video/7505547076873358614
7507759415936748842,juicy.jacobb,Let it grow @The Home Depot #Hashtag #Hashtags #AnotherHashtag #OneMoreHashtag #thelorax #lorax #ohare #thneedville #thneed #letitgrow #drseuss #prank #pranks #troll #trolling #trolls #jokes #joke #funny #cosplay #thehomedepot #homedepot #fyp @LoRaX ,289800,1583,57300,1800000,"hashtag, hashtags, anotherhashtag, onemorehashtag, thelorax, lorax, ohare, thneedville, thneed, letitgrow, drseuss, prank, pranks, troll, trolling, trolls, jokes, joke, funny, cosplay, thehomedepot, homedepot, fyp",Original Sound,2025-05-23 21:41:41,https://www.tiktok.com/@juicy.jacobb/video/7507759415936748842
7506684181582482734,nicollefigueroaa,Extrañaba estos videos 🥹💖,1200000,2234,2605,7300000,,sonido original,2025-05-21 00:08:43,https://www.tiktok.com/@nicollefigueroaa/video/7506684181582482734
7505226088474266910,carsandkeys,#Trucks #Pickup #Cartok #CarReview #CarsandKeys #TiktokAutoCampaign #Ford #Ram #Chevy #GMC ,61900,986,447,1000000,"trucks, pickup, cartok, carreview, carsandkeys, tiktokautocampaign, ford, ram, chevy, gmc",original sound,2025-05-17 01:50:38,https://www.tiktok.com/@carsandkeys/video/7505226088474266910
7505049524981746966,ymdy918,#movie #film This boy actually got this disease ,64100,72,919,1700000,"movie, film",Mysterious and sad BGM(1120058),2025-05-16 14:25:15,https://www.tiktok.com/@ymdy918/video/7505049524981746966
7507417414829722902,knucklessbts,#rakai #2xrakai #fyp #rakaiclips #2xrakaiclips #jamal #streameruniversity #viral @2xRakai ,59200,217,612,953300,"rakai, 2xrakai, fyp, rakaiclips, 2xrakaiclips, jamal, streameruniversity, viral",original sound,2025-05-22 23:33:58,https://www.tiktok.com/@knucklessbts/video/7507417414829722902
7506966364561624363,lizbezler,😭😭😭 I’ve served people like this! Haha #comedy #difficultcustomersbelike #karensgoingwild #crazycustomersbelike #customersbelike ,46300,117,223,521900,"comedy, difficultcustomersbelike, karensgoingwild, crazycustomersbelike, customersbelike",Monkeys Spinning Monkeys,2025-05-21 18:23:45,https://www.tiktok.com/@lizbezler/video/7506966364561624363
7506876477988818218,rexilexi_2,"A very unnecessary experience, but why not 🙂 @4DX @Final Destination Bloodlines #finaldestinationbloodlinesmovie #4dx #atlanticstation #fyp ",34500,133,7085,852500,"finaldestinationbloodlinesmovie, 4dx, atlanticstation, fyp",original sound,2025-05-21 12:35:00,https://www.tiktok.com/@rexilexi_2/video/7506876477988818218
7505563481681284359,helpfamily20,Late but ya Chelsea will be the best aunt out there #chelsealascher #jax #fypシ゚viral #fopシfop#fyp #fypage #viral #viraltiktok #makemefamouse #foryourpage #makemeviral #fy #trend #slideshow #maybe #madeofhonor #jaxandchelsea #cute #fyppppppppppppppppppppppp #foryou #fyppppppppppppppppppppppp ,245800,9388,13700,1800000,"chelsealascher, jax, fypシ゚viral, fopシfop, fyp, fypage, viral, viraltiktok, makemefamouse, foryourpage, makemeviral, fy, trend, slideshow, maybe, madeofhonor, jaxandchelsea, cute, fyppppppppppppppppppppppp, foryou",MAYBE,2025-05-17 23:39:47,https://www.tiktok.com/@helpfamily20/video/7505563481681284359
7507366572286086418,wh0arefaraday,,313100,1319,55500,2900000,,оригинальный звук,2025-05-22 20:16:37,https://www.tiktok.com/@wh0arefaraday/video/7507366572286086418
7507223839244340523,bhanlon29,#fyp #school #leavingbsf #sad ,368700,4522,106300,1600000,"fyp, school, leavingbsf, sad",I Exist I Exist I Exist,2025-05-22 11:02:56,https://www.tiktok.com/@bhanlon29/video/7507223839244340523
7501985333429538079,lctenny2,#usa🇺🇸 #fyp #viralvideo ,32600,190,604,755700,"usa🇺🇸, fyp, viralvideo",Void（Original ）,2025-05-08 08:16:18,https://www.tiktok.com/@lctenny2/video/7501985333429538079
7507497212016905502,ashleylisette__,time went by soooo fast 😭💞 #fistbirthday #fyp ,77200,73,685,472100,"fistbirthday, fyp",INTRO,2025-05-23 04:44:02,https://www.tiktok.com/@ashleylisette__/video/7507497212016905502
7505264607389306143,yafavglizzzz,,108900,9152,1985,514900,,New Flame (but I promise you) (feat. Usher & Rick Ross),2025-05-17 04:20:09,https://www.tiktok.com/@yafavglizzzz/video/7505264607389306143
7507955427582217478,ma_hhrt,,284200,1733,94900,2200000,,оригинальный звук,2025-05-24 10:21:43,https://www.tiktok.com/@ma_hhrt/video/7507955427582217478
7507427548146437406,larobenz,He just didn’t understand why I was there 😅 #babies ,604100,3145,5068,3900000,babies,original sound,2025-05-23 00:13:27,https://www.tiktok.com/@larobenz/video/7507427548146437406
7506894413122063658,otakua16,Luffy’s fist vs Naruto Kurama mode #anime #shonen #onepiece #naruto #fypシ゚viral #luffy #gear5 #goku #dragonball ,74300,13400,3089,1100000,"anime, shonen, onepiece, naruto, fypシ゚viral, luffy, gear5, goku, dragonball",MONTAGEM TOMADA (Slowed),2025-05-21 13:44:35,https://www.tiktok.com/@otakua16/video/7506894413122063658
7507268546041220383,jijijuice66,#friends #baby #fyp ,111300,696,22000,1500000,"friends, baby, fyp",original sound,2025-05-22 13:56:17,https://www.tiktok.com/@jijijuice66/video/7507268546041220383
7505429506128203051,_yunglimabean_,#real #relatable #haunted #house #fyp #foryou #foryoupage ,246400,1522,31300,1400000,"real, relatable, haunted, house, fyp, foryou, foryoupage",оригинальный звук,2025-05-17 15:00:28,https://www.tiktok.com/@_yunglimabean_/video/7505429506128203051
