video_id,author,description,likes,comments,shares,plays,hashtags,music,create_time,video_url
7506850648072178986,joslum.fan_58,11 Real life temple run‍♂️ #couplegoals #couplelove #couple #couplechallege #challengue #templerun #fyp,12300,45,555,386200,"couplegoals, couplelove, couple, couplechallege, challengue, templerun, fyp",original sound - joslum.fan_58,2025-05-21 10:54:45,https://www.tiktok.com/@joslum.fan_58/video/7506850648072178986
7505251165463006495,notluckinlife,no longer hurts #relateable #xyzbca #viral #goviral #foru #ex #august #may ,458700,1371,18500,1700000,"relateable, xyzbca, viral, goviral, foru, ex, august, may",original sound,2025-05-17 03:28:01,https://www.tiktok.com/@notluckinlife/video/7505251165463006495
7506193942573010198,daigiaste,Volo in sicurezza😂😂 IG: daigiaste,768100,2948,137900,10400000,,suono originale,2025-05-19 16:26:11,https://www.tiktok.com/@daigiaste/video/7506193942573010198
7506999685651893546,rhiyafia,"I know yall have it rough out here, I’m standing with you #olivetone #undertone #oliveundertone #makeup #foundation #shadematch ",254000,1565,2047,1000000,"olivetone, undertone, oliveundertone, makeup, foundation, shadematch",suara asli - favmusicvibes,2025-05-21 20:33:00,https://www.tiktok.com/@rhiyafia/video/7506999685651893546
7505316466418257183,owen0806449,No boy would refuse such a cool Harry Potter wand~,39700,446,13500,757600,,原聲 - Owen,2025-05-17 21:00:00,https://www.tiktok.com/@owen0806449/video/7505316466418257183
7507319568881274155,streamerclipperrr,Deshae and cinco are excited to go to streamer university they all got backpacks on 😭❤️‍🩹#jaycincoo #deshaefrost #kaicenat #streameruniversity ,31400,82,568,357700,"jaycincoo, deshaefrost, kaicenat, streameruniversity",Beanie,2025-05-22 17:14:25,https://www.tiktok.com/@streamerclipperrr/video/7507319568881274155
7506869231032536342,eriseart,Odysseus as dad Odysseus would've been a great dad — baby Telemachus is way too cute #epicthemusical #ody #odysseus #odyssey #telemachus #athena #penelope #dad #cute #greekmithology @Jorge Rivera-Herrans ,117900,378,8400,423800,"epicthemusical, ody, odysseus, odyssey, telemachus, athena, penelope, dad, cute, greekmithology",sonido original,2025-05-21 12:06:40,https://www.tiktok.com/@eriseart/video/7506869231032536342
7507125252237872427,user383844872,oh did i mention that everyone is actually fake #fyp #real #freshman #2029 #2028 #highschool #fypシ゚viral #relatable #school ,161100,875,3943,552800,"fyp, real, freshman, 2029, 2028, highschool, fypシ゚viral, relatable, school",original sound,2025-05-22 04:40:59,https://www.tiktok.com/@user383844872/video/7507125252237872427
7505550531318811950,rihnely,Ariana grande has never done what she’s accused of. #arianagrande #arianagrandeedit #arianagrandefan ,56700,1708,2275,238600,"arianagrande, arianagrandeedit, arianagrandefan",original sound,2025-05-17 22:49:56,https://www.tiktok.com/@rihnely/video/7505550531318811950
7506018872831544618,_cebarrr,#cebarr #xyzbca #viral #fyp #poptarts ,71000,1378,9879,807300,"cebarr, xyzbca, viral, fyp, poptarts",Thinkin,2025-05-19 05:07:31,https://www.tiktok.com/@_cebarrr/video/7506018872831544618
7506327609718869279,andrew_trs,We all have the same items in our house😭 #fyp #foryou #mexican #viral ,21900,229,1672,264000,"fyp, foryou, mexican, viral",original sound,2025-05-20 01:05:06,https://www.tiktok.com/@andrew_trs/video/7506327609718869279
7505800856768498966,blackkidgid,That’s the way I see it fr #fyp #viral #blackkidgid ,114900,102,3637,715400,"fyp, viral, blackkidgid",original sound,2025-05-18 15:00:50,https://www.tiktok.com/@blackkidgid/video/7505800856768498966
7506944587018292502,ethan.stee1e,They’d do all this before 7am 😂 #fyp #relatable ,392700,2345,86000,5400000,"fyp, relatable",original sound,2025-05-21 16:59:05,https://www.tiktok.com/@ethan.stee1e/video/7506944587018292502
7505595729931554078,luke737560,Going to state #bluelock #soccer #ego @Brian🇲🇽🌮 @Poppop679 @kobii315  ,38600,433,5201,222400,,original sound,2025-05-18 01:45:00,https://www.tiktok.com/@luke737560/video/7505595729931554078
7498823695700446471,444__1111,Peinado loco #peinadoloco #diadelniño ,95900,624,49400,2700000,"peinadoloco, diadelniño",El Troquero Locochon,2025-04-29 19:45:53,https://www.tiktok.com/@444__1111/video/7498823695700446471
7506277247955766571,kanebizzell,#kanebizzell #fyp ,16900,1158,4314,347300,"kanebizzell, fyp",original sound,2025-05-19 21:50:01,https://www.tiktok.com/@kanebizzell/video/7506277247955766571
7506372511794318622,rosiecheeks_irl,Butterfly effect is crazy because I’m glad I said yes to that date. #fiance #butterflyeffect #cholo ,12200,45,243,457900,"fiance, butterflyeffect, cholo",ALL I CAN SAY KALI UCHIS,2025-05-20 03:59:31,https://www.tiktok.com/@rosiecheeks_irl/video/7506372511794318622
7505951411256020254,user1839372019733,basically a millionaire 🤷🏻‍♀️ #fyp #graduation #offers #firstgen #trend,140400,632,743,553100,"fyp, graduation, offers, firstgen, trend",original sound,2025-05-19 00:45:17,https://www.tiktok.com/@user1839372019733/video/7505951411256020254
7504750074690407710,kahleilude,psa to all those who know me,49000,143,1531,244300,,Throw Sum Mo,2025-05-15 19:03:22,https://www.tiktok.com/@kahleilude/video/7504750074690407710
7506646137558895903,dallascowboys,"sup, george 👀 #DallasCowboys #GeorgePickens #NFL #football ",67700,1142,4416,460800,"dallascowboys, georgepickens, nfl, football",original sound,2025-05-20 21:41:12,https://www.tiktok.com/@dallascowboys/video/7506646137558895903
7506302176881364266,annab3thduupe,#ayoedebiri anyway new youtube video channel: kelsey lelei,58800,62,106,252100,ayoedebiri,original sound,2025-05-19 23:26:39,https://www.tiktok.com/@annab3thduupe/video/7506302176881364266
7506621757370027294,voycebutler2,I got a call from my daughter’s school saying she was never picked up… but she was sitting right next to me. I still don’t know who I brought home. #FYP #StorytimeTikTok #DaughterStory #SchoolCall #RealLifeTwist #TrueStory #TikTokStory #ParentingMoment #EmotionalStory #ConfusingDay #SomethingWasOff #storytime ,259000,7417,31800,6100000,"fyp, storytimetiktok, daughterstory, schoolcall, reallifetwist, truestory, tiktokstory, parentingmoment, emotionalstory, confusingday, somethingwasoff, storytime",original sound,2025-05-20 20:06:44,https://www.tiktok.com/@voycebutler2/video/7506621757370027294
7507197550512917777,hvostonosikii,"Я и сама не знала, что это возможно, но у кошек тоже бывает астма.",356500,1508,38100,4300000,,оригинальный звук - hvostonosikii,2025-05-22 09:20:53,https://www.tiktok.com/@hvostonosikii/video/7507197550512917777
7496734006042545451,_mikesonpluto,✨Daily motivation✨ #crashout #fyp #crashoutcore ,287100,2463,61400,1500000,"crashout, fyp, crashoutcore",original sound,2025-04-24 04:37:33,https://www.tiktok.com/@_mikesonpluto/video/7496734006042545451
7507341490209688863,devotedly.yours,"Diddy’s Trial Day 9: General manager to Beverly Hills hotel, Frederic Zemmour takes the stand ",32200,467,1112,435200,,original sound,2025-05-22 18:39:23,https://www.tiktok.com/@devotedly.yours/video/7507341490209688863
7505997813273120042,ethan.j.murray,#tennesseepaintball #univeristyoftennessee #paintball #bestintheworld ,70600,493,3072,545600,"tennesseepaintball, univeristyoftennessee, paintball, bestintheworld",ECE Marketing Airball,2025-05-19 03:45:53,https://www.tiktok.com/@ethan.j.murray/video/7505997813273120042
7498311829731544338,josephinehellgren,reminder to self to mute all videos before posting 😭😂 #bestie #traveltiktok ,87600,318,33500,579500,"bestie, traveltiktok",original sound,2025-04-28 10:39:35,https://www.tiktok.com/@josephinehellgren/video/7498311829731544338
7506980817642573098,mellymelberk,,17000,366,442,444200,,original sound,2025-05-21 19:19:50,https://www.tiktok.com/@mellymelberk/video/7506980817642573098
7506623937170672918,monicagartner,Pregnancy perks 101 😂 #fyp #foryou #pregnancy #pregnant #secondtrimester ,127100,375,43200,1200000,"fyp, foryou, pregnancy, pregnant, secondtrimester",Oh waiterrrrr,2025-05-20 20:14:48,https://www.tiktok.com/@monicagartner/video/7506623937170672918
7507335227426049326,becsreview,EDIT: this face cover DOES block view so I DO NOT recommend for drivers. This is for all my passenger princesses!! There are more fitted face covers - downside is they smudge your makeup. And for those that say “just wear sunscreen” you clearly have never had to reapply sunscreen on a super oily face or on top of makeup AND commute 5 hours a day. Since so many of you asked… I’ve updated in my bio. Note I bought them on Taobao - their international shipping site is more $$ given shipping and duty tax!  ,25300,136,532,493200,wearsunprotection,My tummy hurtssss,2025-05-22 18:15:08,https://www.tiktok.com/@becsreview/video/7507335227426049326
7507317216807832863,lilkloan,it was traumatic #animation #stardewvalley #stardewtok #stardewvalleymemes #lilkloan #fyp #stardew ,72600,375,7063,600100,"animation, stardewvalley, stardewtok, stardewvalleymemes, lilkloan, fyp, stardew",original sound,2025-05-22 17:05:12,https://www.tiktok.com/@lilkloan/video/7507317216807832863
7505985068679154950,elprofe_coleccionista,El Tortrix más antiguo de Barbacoa @Pepsi Guate  #elprofecoleccionista #recuerdosdesbloqueados #nostalgia90an #ricitos #escuela #vintage ,128600,1688,8945,2000000,"elprofecoleccionista, recuerdosdesbloqueados, nostalgia90an, ricitos, escuela, vintage",aquatic ambience,2025-05-19 02:55:44,https://www.tiktok.com/@elprofe_coleccionista/video/7505985068679154950
7506551254240333086,nayaloyden4,Mornings before daycare! #girlmom #momlife #mommydaughter ,163200,371,856,495000,"girlmom, momlife, mommydaughter",original sound,2025-05-20 15:33:18,https://www.tiktok.com/@nayaloyden4/video/7506551254240333086
7505176973505744159,wealthycentro,#map #world #japanese #history credit: Vintage Maps on C ,8276,981,151,856600,"map, world, japanese, history",Roi (Instrumental),2025-05-16 22:39:56,https://www.tiktok.com/@wealthycentro/video/7505176973505744159
7507276304618769695,yxlstjkppaa,#help #tiktok #movie #fyp,107800,488,3222,1200000,"help, tiktok, movie, fyp",original sound - yexians,2025-05-22 14:26:29,https://www.tiktok.com/@yxlstjkppaa/video/7507276304618769695
7497682154751642910,heyitsmeagainguys,Summer is returning. My brother fans baby Hanan because she’s overheating.,290700,9521,34200,1300000,,original sound,2025-04-26 17:56:34,https://www.tiktok.com/@heyitsmeagainguys/video/7497682154751642910
7506559877343464746,joey.foo,My wife went to work so I stayed home to take care of the kids  #fatherhood#dadof3#parenthood,100700,1467,811,680300,"fatherhood, dadof3, parenthood",original sound,2025-05-20 16:07:23,https://www.tiktok.com/@joey.foo/video/7506559877343464746
7502216216098934046,intamarcuswetrust,??? #real #intamarcuswetrust #fyp #foru #fypp #quotes #viral #yourpage #fyy #foru #fyppage #righttime #tiktok #instagram ,92100,419,6807,463100,"real, intamarcuswetrust, fyp, foru, fypp, quotes, viral, yourpage, fyy, fyppage, righttime, tiktok, instagram",don't hide,2025-05-08 23:10:41,https://www.tiktok.com/@intamarcuswetrust/video/7502216216098934046
7507098325984775446,_gianniadinna_,#fypシ゚ #trending #gianniadinna ,230200,32500,101400,2500000,"fypシ゚, trending, gianniadinna",original sound - ✿,2025-05-22 02:56:15,https://www.tiktok.com/@_gianniadinna_/video/7507098325984775446
7502973361866263863,yanbra299,Ni ganas de viajar #desparchados #paratii ,565600,5026,402700,9000000,"desparchados, paratii",sonido original,2025-05-11 00:08:44,https://www.tiktok.com/@yanbra299/video/7502973361866263863
7506688968113802542,kimmszn,guys i swear my collection growing.@TORY BURCH  #fyp #toryburch #sandals #foryoupage ,92300,338,10600,521000,"fyp, toryburch, sandals, foryoupage",New Flame (but I promise you) (feat. Usher & Rick Ross),2025-05-21 00:27:19,https://www.tiktok.com/@kimmszn/video/7506688968113802542
7507569442700807466,ovie2x,i miss you #ovie2x ,1500000,7280,18600,5700000,ovie2x,think of me every once in a while,2025-05-23 09:25:53,https://www.tiktok.com/@ovie2x/video/7507569442700807466
7507346951432719646,haley0kay,Need’s to be assigned to all states. #fyp #newlaw #marriage #teamwork ,10600,1391,707,513300,"fyp, newlaw, marriage, teamwork",original sound,2025-05-22 19:00:35,https://www.tiktok.com/@haley0kay/video/7507346951432719646
7505471580752104750,domnnii,GNARLY at the end I kinda made a ponytail with the costume I didn’t even notice 😭 #gnarly #daniela #sophia #lara #yoonchae manon #megan #kpop #kpopfyp #fyp #kpopforyoupage #eyekons ,497800,3310,55000,2300000,"gnarly, daniela, sophia, lara, yoonchae, megan, kpop, kpopfyp, fyp, kpopforyoupage, eyekons",Gnarly,2025-05-17 17:43:36,https://www.tiktok.com/@domnnii/video/7505471580752104750
7506432739558657323,quuk66588,#fyp #fyppppppppppppppppppppppp #dharmann #dharmannfam #movie,14300,38,31,399700,"fyp, fyppppppppppppppppppppppp, dharmann, dharmannfam, movie",original sound - quuk66588,2025-05-20 07:55:11,https://www.tiktok.com/@quuk66588/video/7506432739558657323
7506255716278078750,sportscenternext,🎯🏈 #lamarjackson #NFL #Ravens #highschoolfootball  (via samantha_roseff_photography/IG),30400,208,190,791300,"lamarjackson, nfl, ravens, highschoolfootball",GTA,2025-05-19 20:26:07,https://www.tiktok.com/@sportscenternext/video/7506255716278078750
7505143137895976238,dailymail,"During a standard police stop in Tatarstan, Russia, a pulled over vehicle decided to ignore the approaching cop and take off... Only thing though was that the car split in half and began to speed away like a scene straight out of a comedy movie! #car #police #funny #comedy #russia ",143400,1570,27900,2400000,"car, police, funny, comedy, russia",original sound,2025-05-16 20:28:38,https://www.tiktok.com/@dailymail/video/7505143137895976238
7507260035437776171,_jen_hamilton_,I know my mama had to learn this from somewhere,57700,8730,4813,1900000,,original sound,2025-05-22 13:23:24,https://www.tiktok.com/@_jen_hamilton_/video/7507260035437776171
7505327160542973239,gotovka_2011,ингредиенты: сыр-250-300гр яйца-2-3шт мука-90-100гр соль щепотка #шарики #сыр #сырныешарики #нямням ,583200,3735,55800,6700000,"шарики, сыр, сырныешарики, нямням",оригинальный звук,2025-05-17 08:22:42,https://www.tiktok.com/@gotovka_2011/video/7505327160542973239
7506287801722277142,davidyrodriguez,,248200,722,41200,1500000,,original sound,2025-05-19 22:30:31,https://www.tiktok.com/@davidyrodriguez/video/7506287801722277142
7507268107824631086,colebarkley22,Mhmmm,44400,658,835,479700,,original sound,2025-05-22 13:54:43,https://www.tiktok.com/@colebarkley22/video/7507268107824631086
7505478104148708639,era1john_,@Ivan #d1athlete #real #blowthisupforme ,63700,513,5564,322100,"d1athlete, real, blowthisupforme",original sound,2025-05-17 18:08:35,https://www.tiktok.com/@era1john_/video/7505478104148708639
7505074834301357358,jessenew20,I still got it #fyp #clogging #dance ,70600,318,4876,270500,"fyp, clogging, dance",original sound,2025-05-16 16:03:40,https://www.tiktok.com/@jessenew20/video/7505074834301357358
7506146188022795566,thewashfam,One thing I’m going to do is support my baby 😂😂 #tuba #bandkid #fy #dougie ,259000,1714,24200,1200000,"tuba, bandkid, fy, dougie",original sound,2025-05-19 13:21:49,https://www.tiktok.com/@thewashfam/video/7506146188022795566
7506614411889626398,candh_,"apology accepted, mood still loading... #couple #real #viral #candh #xyzbca #couplecomedy #jokes #attitude #relationship #gf #foryoupage ",105800,102,31700,599400,"couple, real, viral, candh, xyzbca, couplecomedy, jokes, attitude, relationship, gf, foryoupage",original sound,2025-05-20 19:38:15,https://www.tiktok.com/@candh_/video/7506614411889626398
7505121486403931422,therelatablebarbie,#fyp #relatable #real #humor #blowup #xyzbca #foryoupage #viral #mood #funny #trip #vacation  #barbie #meme ,410100,722,75600,1900000,"fyp, relatable, real, humor, blowup, xyzbca, foryoupage, viral, mood, funny, trip, vacation, barbie, meme",In your eyes Remix Prod. Kayarchon,2025-05-16 19:04:38,https://www.tiktok.com/@therelatablebarbie/video/7505121486403931422
7506523282041081119,raeonartez,99% accuracy ,114200,3220,10300,568100,,Assumptions (slowed down version),2025-05-20 13:44:51,https://www.tiktok.com/@raeonartez/video/7506523282041081119
7506727780143336710,auztin__,,201800,932,13700,1700000,,original sound,2025-05-21 02:57:48,https://www.tiktok.com/@auztin__/video/7506727780143336710
7507161501531131154,malinyaay,,74400,227,12300,592100,,оригинальный звук,2025-05-22 07:00:49,https://www.tiktok.com/@malinyaay/video/7507161501531131154
7505945090313964830,sc5tt,#viral #fypシ ,29600,489,1347,270000,"viral, fypシ",original sound,2025-05-19 00:20:39,https://www.tiktok.com/@sc5tt/video/7505945090313964830
7506361451041344773,chesme133,De donde son #humor #parati #divercion #fyp #guayaquil #comedia #viral #Ecuador @Lady García TV🚀 ,104200,3672,56200,2900000,"humor, parati, divercion, fyp, guayaquil, comedia, viral, ecuador",sonido original,2025-05-20 03:16:19,https://www.tiktok.com/@chesme133/video/7506361451041344773
7505026324210191647,gymcat_01,wake up #fyp #gymcat1 #gymtok #motivational ,415100,1767,200300,2000000,"fyp, gymcat1, gymtok, motivational",original sound,2025-05-16 12:55:22,https://www.tiktok.com/@gymcat_01/video/7505026324210191647
7506680671453072683,thedeandacurtisfamily,#fypシ #fypシ #fyppppppppppppppppppppppp #husbandandwife #couplestiktok #couples ,22000,230,5944,319700,"fypシ, fyppppppppppppppppppppppp, husbandandwife, couplestiktok, couples",original sound,2025-05-20 23:55:03,https://www.tiktok.com/@thedeandacurtisfamily/video/7506680671453072683
7506297933852101918,nypost,"This one's for you, new grads. 🎓 The best cities to start your career have been ranked by WalletHub, using over two dozen metrics ranging from job growth rate and starting salary averages to average commute and housing affordability. “The best cities for starting a career not only have a lot of job opportunities but also provide substantial income growth potential and satisfying work conditions,” WalletHub analyst Chip Lupo said. “It’s also important to consider factors such as how fun a city is to live in or how good of a place it is for raising a family, to ensure life satisfaction outside of your career.” The release of the report comes as graduation season is in full swing – a time when many people are figuring out where in the country they want to kick off their professional lives. The five cities that WalletHub found to be most favorable for beginning a career were located in three different states. The cities of Charleston, South Carolina; Richmond, Virginia; Salt Lake City, Utah; Columbia, South Carolina; and Pittsburgh, Pennsylvania, are ranked No. 6 through 10, respectively. Of the 182 locales included in WalletHub’s report, the ones with the lowest overall scores for beginning a career were Detroit, Michigan; New York, New York; Oxnard, California; Bridgeport, Connecticut; and Pearl City, Hawaii.  📸: Getty; AP; Kevin Ruck - stock.adobe.com",34000,869,5651,764800,,original sound - New York Post | News,2025-05-19 23:10:00,https://www.tiktok.com/@nypost/video/7506297933852101918
7506919756545461526,bbcmaestro,Evy Poumpouras reveals the three types of people you should avoid #evypoumpouras #relationships #selfawareness #growth #fyp ,131700,2299,32200,2700000,"evypoumpouras, relationships, selfawareness, growth, fyp",original sound,2025-05-21 15:22:43,https://www.tiktok.com/@bbcmaestro/video/7506919756545461526
7506958776818289950,brett_neustty,,264400,506,54100,1500000,,original sound,2025-05-21 17:54:15,https://www.tiktok.com/@brett_neustty/video/7506958776818289950
7496707191139814699,siyalopez,The Holy Spirit always clocks us 😭  @GTWY Church @GTWY STUDENTS #jesus #relatable #christiantiktok #fyp #godisgood #worship #God ,397700,722,15900,2000000,"jesus, relatable, christiantiktok, fyp, godisgood, worship, god",original sound,2025-04-24 02:53:12,https://www.tiktok.com/@siyalopez/video/7496707191139814699
7506726101197065528,ba_xon,Прикольно придумала,210900,1724,1795,2100000,,оригинальный звук,2025-05-21 02:51:16,https://www.tiktok.com/@ba_xon/video/7506726101197065528
7506633584548039966,booklovinrockstar,calling all crafty and creative girly i’m in desperate need idk what to do😭🙏🙏🙏 #graduation #gradcap #gradcapideas #craft #creative #highschool ,20300,114,62,212900,"graduation, gradcap, gradcapideas, craft, creative, highschool",Glitter on my eyes,2025-05-20 20:52:31,https://www.tiktok.com/@booklovinrockstar/video/7506633584548039966
7505865074561617174,whoiskkyle,Did I get it? #backwards #singing #barbiegirl ,75200,962,10900,2200000,"backwards, singing, barbiegirl",original sound,2025-05-18 19:10:00,https://www.tiktok.com/@whoiskkyle/video/7505865074561617174
7506551712820284703,theaquariusloner,Not even hungry just greedy😭,49200,562,7451,260000,,"Jaws Main Theme (From ""Jaws"")",2025-05-20 15:34:58,https://www.tiktok.com/@theaquariusloner/video/7506551712820284703
7505117014973779231,lexii.g326,#fypシ ,142000,3855,4190,681900,fypシ,Party,2025-05-16 18:47:17,https://www.tiktok.com/@lexii.g326/video/7505117014973779231
7501092842010430762,keycourage,I Indeed Was Cooked 🤦🏾😭 YT : KeyCourage 🎥 OUT NOW! #funny #fyp #prank #kaicenat #adinross #keycourage #viral #trending ,250100,2260,24600,2900000,"funny, fyp, prank, kaicenat, adinross, keycourage, viral, trending",original sound,2025-05-05 22:31:56,https://www.tiktok.com/@keycourage/video/7501092842010430762
7506344623472643371,broadwaysingsforpride,#Repost @gaiamusiccollective ... This mirror-room at SUMMIT is truly SO WILD y’all 🪩 Singing here was such an incredible experience ✨  More to come from this amazing day at @summitov soon!!  “Unwritten” One-Day Choir Originally by @natashabedingfield  Led & arranged by @heartofgoldstein  📍SUMMIT One Vanderbilt #singing #harmony #acapella #vocals #choir #community #nyc #music #choir #voices #newyork #newyorkcity #chorus ,363000,1300,25200,3100000,"repost, singing, harmony, acapella, vocals, choir, community, nyc, music, voices, newyork, newyorkcity, chorus",original sound,2025-05-20 02:11:21,https://www.tiktok.com/@broadwaysingsforpride/video/7506344623472643371
7507048506830638382,emerii_leak,ootd @. ,57700,191,950,275200,,original sound,2025-05-21 23:42:30,https://www.tiktok.com/@emerii_leak/video/7507048506830638382
7505526974182477102,seanschutt69,#foryou ,423100,1643,99100,2400000,foryou,original sound,2025-05-17 21:18:37,https://www.tiktok.com/@seanschutt69/video/7505526974182477102
7506888819338120470,janelthebear,this glam on brown eyes >> #makeup #diormakeup #diorbackstage  @Diorbeauty  On stage brown and black waterproof eyeliner forever skin contour stick shade medium dior show eye shadow palette brown cachemire  diorshow liquid liner  forever skin glow foundation  skin perfect stick foundation backstage rosy glow stick shade rosewood  rouge dior contour lip liner shade 300 lip glow oil shade splash @YSL Beauty lash clash waterproof mascara + translucent powder  @L'Oréal Paris UK true match concealer ,448700,1334,21100,4700000,"makeup, diormakeup, diorbackstage",Shake It To The Max (FLY) (Remix),2025-05-21 13:22:39,https://www.tiktok.com/@janelthebear/video/7506888819338120470
7507675574140259606,williamhansonetiquette,Here’s the British way to eat rice. I’m sure it makes sense to someone. #dining #etiquette #williamhanson ,292100,26200,74500,5500000,"dining, etiquette, williamhanson",original sound,2025-05-23 16:15:42,https://www.tiktok.com/@williamhansonetiquette/video/7507675574140259606
7507431998777003294,stephencullen08,This will do for opening weekend @noah bridges #bananaball #fypシ #savannahbananas ,55400,606,1699,386600,"bananaball, fypシ, savannahbananas",Western Music: Arizona Dreaming,2025-05-23 00:30:45,https://www.tiktok.com/@stephencullen08/video/7507431998777003294
7505200824566451498,sophia_1658,"Overall not as scary as I thought it would be!! If you have taken many practice exams, treat it just like that. And if you didn’t have time to reschedule your exam or something goes wrong you can VOID at the end. Getting through it and understanding the process was a good feeling, even if you think/know you need to retake.",215100,623,5575,2300000,,original sound,2025-05-17 00:12:42,https://www.tiktok.com/@sophia_1658/video/7505200824566451498
7506934318711901486,shwaggyyalliee,,145400,475,18400,450900,,original sound,2025-05-21 16:19:25,https://www.tiktok.com/@shwaggyyalliee/video/7506934318711901486
7507056950480243999,ricotaquito,@Disney Studios #liloandstitch ,105600,153,6389,361800,liloandstitch,original sound,2025-05-22 00:15:12,https://www.tiktok.com/@ricotaquito/video/7507056950480243999
7504487827472682245,noanalah,Mas respeto con la gorda 🙄 #pitbull #mascotas #pitbulllover #amorporlosanimales #petsoftiktok #love #diversion #viral #fypppppppppppppp ,608500,1527,171900,4300000,"pitbull, mascotas, pitbulllover, amorporlosanimales, petsoftiktok, love, diversion, viral, fypppppppppppppp",som original,2025-05-15 02:05:38,https://www.tiktok.com/@noanalah/video/7504487827472682245
7505928835662236934,r3nbenber,Mask killa training 🎭#maskkilla #maskkiller #deestroying1v1 #deestroying #futbolamericano🏈 #futbolista #fyp ,137800,246,1366,2300000,"maskkilla, maskkiller, deestroying1v1, deestroying, futbolamericano🏈, futbolista, fyp",sonido original,2025-05-18 23:17:30,https://www.tiktok.com/@r3nbenber/video/7505928835662236934
