video_id,author,description,likes,comments,shares,plays,hashtags,music,create_time,video_url
7507727233943948574,corey2uncensored,Twitch : corey2u #kaicenat #streamerunivesity #streameruniversityclips #clips #5star #clipfarm #fypシ #xyzcba #foryou #fy #twitch #fyp #clips #clip #viral #dukedennis #basketball ,53200,254,400,543000,"kaicenat, streamerunivesity, streameruniversityclips, clips, 5star, clipfarm, fypシ, xyzcba, foryou, fy, twitch, fyp, clip, viral, dukedennis, basketball",original sound,2025-05-23 19:36:31,https://www.tiktok.com/@corey2uncensored/video/7507727233943948574
7507383365943692574,kentiktalks,,32100,11100,4155,823300,,original sound,2025-05-22 21:21:50,https://www.tiktok.com/@kentiktalks/video/7507383365943692574
7507747624200555781,bakedbyalyssa._,stay tuned for @iampresleefaith review!!! she’s literally the sweetest! 💗 #smallbusiness #iampressleefaith #presleefaith #glowhouse #packanorder #diml #viral #blowthisup #influencers ,126100,329,299,1300000,"smallbusiness, iampressleefaith, presleefaith, glowhouse, packanorder, diml, viral, blowthisup, influencers",original sound,2025-05-23 20:55:21,https://www.tiktok.com/@bakedbyalyssa._/video/7507747624200555781
7504778983804849438,adijean06,I was looking in the mirror and I turned around and she was just standing in my door staring at me I literally started crying #dog #love #soulmate #austrailianshepherd #dogs #puppylove #grad #senior #classof25 #classof2025 ,231500,1399,5854,659900,"dog, love, soulmate, austrailianshepherd, dogs, puppylove, grad, senior, classof25, classof2025",The Winner Is... - DeVotchKa Version,2025-05-15 20:55:29,https://www.tiktok.com/@adijean06/video/7504778983804849438
7507741429968440607,grijo.ceo,Bro was working at chick f a like an NPC 😭 now his the main character 💰💰 . . . #explore #viral #motivation #entrepreneur #transformation,56900,223,809,402400,"explore, viral, motivation, entrepreneur, transformation",sonido original,2025-05-23 20:31:29,https://www.tiktok.com/@grijo.ceo/video/7507741429968440607
7507801834464103711,briialexia1,It’s snowy in here @caassiemarrufo ,38600,134,580,325300,,original sound,2025-05-24 00:25:55,https://www.tiktok.com/@briialexia1/video/7507801834464103711
7505124804807134495,jesstoshi,Ariana?? What are you doing here?  #usc #graduation #wicked #jonchu #arianagrande #creatorsearchinsights ,105400,241,11800,744300,"usc, graduation, wicked, jonchu, arianagrande, creatorsearchinsights",original sound,2025-05-16 19:17:28,https://www.tiktok.com/@jesstoshi/video/7505124804807134495
7506375032017259783,baebae_gurume,だし割烹屋が作る真っ白いだし巻き卵🍳 こちらのお店では、お米を食べて育った鶏から産まれた黄身まで真っ白い特別な卵を使っただし巻き卵が食べられる！ 卵自体は少し淡白だけど、真っ白くてプルプルな食感だった！ 📍居酒屋おだし / 大阪 ￥1000～/人 ⏰営業時間：17:00〜23:00 💤定休日：なし 🏠住所：〒542-0083 大阪府大阪市中央区東心斎橋１丁目１５−２ 松村ビル 1階 #東京グルメ #大阪グルメ#tiktokfood ,1600000,25500,362800,28000000,"東京グルメ, 大阪グルメ, tiktokfood",Mori no chiisana restaurant,2025-05-20 04:08:54,https://www.tiktok.com/@baebae_gurume/video/7506375032017259783
7507230390742945046,pvltim,Дед плохому не научит #скуф #юмор #дочь #дед #деревня #лето ,97300,319,21500,1200000,"скуф, юмор, дочь, дед, деревня, лето",оригинальный звук,2025-05-22 11:28:08,https://www.tiktok.com/@pvltim/video/7507230390742945046
7506560664555490568,antoniovelazquezoficial,Concierto de Macario Martínez cancelado: Alfredo Adame reacciona 😱‼️#sueñalindocorazon #macariomartinez #alfredoadame #sueñalindocorazonmacariomartinez #macariomartinez ,325100,1909,61800,3700000,"sueñalindocorazon, macariomartinez, alfredoadame, sueñalindocorazonmacariomartinez","sueña lindo, corazón",2025-05-20 16:09:13,https://www.tiktok.com/@antoniovelazquezoficial/video/7506560664555490568
7507155410235690282,chloee86234531,“i locked up your mothhherrrfuckinnnn phonessss”  #fypシ #makemefamous #brunomars #vegas #lasvegasconcert #brunomarslasvegas #outfitinspo ,152600,526,1836,451500,"fypシ, makemefamous, brunomars, vegas, lasvegasconcert, brunomarslasvegas, outfitinspo",original sound,2025-05-22 06:38:47,https://www.tiktok.com/@chloee86234531/video/7507155410235690282
7507347919553514795,iamarilane,,93500,86,446,429900,,original sound,2025-05-22 19:04:23,https://www.tiktok.com/@iamarilane/video/7507347919553514795
7507773763413363998,tanyaagamez,"🤣 damn little lady you sure can put it away! No fr tho, it blows my mind how much this girl eats lol @Outback Steakhouse  #whitechicks #perhapsnot #fyp #funny #babiesoftiktok #toddlersoftiktok #comedia #foryoupage  And for the lady perhaps a salad perhaps not Netflix white chicks sound  White chicks sound ",132900,215,14600,524600,"whitechicks, perhapsnot, fyp, funny, babiesoftiktok, toddlersoftiktok, comedia, foryoupage",original sound - Netflix Philippines,2025-05-23 22:36:58,https://www.tiktok.com/@tanyaagamez/video/7507773763413363998
7507538231953575190,1oktrend,#zahide #colors #motivation #international #fyp ,38000,30900,20900,887100,"zahide, colors, motivation, international, fyp",original sound,2025-05-23 07:22:49,https://www.tiktok.com/@1oktrend/video/7507538231953575190
7507536898349354247,seksi_gerl06,#турция #начай #чай #отель #турция🇹🇷 #2025 #отпуск ,57600,146,249,1300000,"турция, начай, чай, отель, турция🇹🇷, 2025, отпуск",lizka kosmatenko,2025-05-23 07:17:34,https://www.tiktok.com/@seksi_gerl06/video/7507536898349354247
7506906513676750126,supmynameslex,working on it 😤,130800,714,52900,977900,,original sound,2025-05-21 14:31:31,https://www.tiktok.com/@supmynameslex/video/7506906513676750126
7507763029937818910,kindergartenwithmrs.c,Say a prayer for the little ones who will miss their safe place. #teachertip #teachertok #momtok #parentsoftiktok #summerbreak #kindergarten #teachersoftiktok #elementaryteacher #publicschool #fyp #teacherproblems ,48500,119,161,353700,"teachertip, teachertok, momtok, parentsoftiktok, summerbreak, kindergarten, teachersoftiktok, elementaryteacher, publicschool, fyp, teacherproblems",Take My Hand,2025-05-23 21:55:20,https://www.tiktok.com/@kindergartenwithmrs.c/video/7507763029937818910
7505825270419557675,cinthia_liz13,🇲🇽 #paratii #paratipage #comidamexicana #mexicana #ricacomida #infancia #fyp #foryoupage #mexicocheck #gorditas #tortilla ,75400,4807,1416,1300000,"paratii, paratipage, comidamexicana, mexicana, ricacomida, infancia, fyp, foryoupage, mexicocheck, gorditas, tortilla",original sound,2025-05-18 16:36:17,https://www.tiktok.com/@cinthia_liz13/video/7505825270419557675
7507085266297965866,danrue,ON MY WAY!!! lol #fyp #carsontiktok #comedy ,98000,1697,3512,1100000,"fyp, carsontiktok, comedy",Assumptions (slowed down version),2025-05-22 02:05:27,https://www.tiktok.com/@danrue/video/7507085266297965866
7501111084326374702,ikennadii.xx,@Kalbe bros cooked in 3 months ,546000,9,62000,3200000,,original sound,2025-05-05 23:42:42,https://www.tiktok.com/@ikennadii.xx/video/7501111084326374702
7507771543561243947,joe.felixx,Did you get all of them? 🔥 #NBA #trivia #fyp #viralvideo #okc,46500,113,291,1200000,"nba, trivia, fyp, viralvideo, okc",original sound - Joe Felix,2025-05-23 23:00:00,https://www.tiktok.com/@joe.felixx/video/7507771543561243947
7500771012955426079,ericatthedisco,the spit looks great from up here 😀 #hamilton #hamiltonmusical #hamiltontiktok #hamiltonedit #hamiltonthemusical #linmanuelmiranda #alexanderhamilton #leslieodomjr #aaronburr #musicals #musical #musicaltheatre #nationaltour #broadway #offbroadway  ,217700,287,4258,939100,"hamilton, hamiltonmusical, hamiltontiktok, hamiltonedit, hamiltonthemusical, linmanuelmiranda, alexanderhamilton, leslieodomjr, aaronburr, musicals, musical, musicaltheatre, nationaltour, broadway, offbroadway",original sound,2025-05-05 01:42:45,https://www.tiktok.com/@ericatthedisco/video/7500771012955426079
7501613306164088119,los_chicaneros93,Hoy sorprendimos a mis papás  !,639100,2260,2040,10700000,,original sound - Los_chicaneros,2025-05-16 14:30:00,https://www.tiktok.com/@los_chicaneros93/video/7501613306164088119
7499555282926816543,alexis.t___,forever grateful for him ❤️,575900,323,1526,3000000,,original sound,2025-05-01 19:05:20,https://www.tiktok.com/@alexis.t___/video/7499555282926816543
7507303223154298134,grandadjoe1933,"I remember having this pudding every week when I was a lad growing up during WW2 and food rationing times, it really unlocks some memories for me ☺️ #vintagecooking #semolina #comfortfood #easyrecipe #grandpa ",143100,5832,5737,2100000,"vintagecooking, semolina, comfortfood, easyrecipe, grandpa",Ballerina,2025-05-22 16:10:46,https://www.tiktok.com/@grandadjoe1933/video/7507303223154298134
7506036841183776030,mia13445,Heheh ,87000,110,244,644800,,original sound,2025-05-19 06:17:22,https://www.tiktok.com/@mia13445/video/7506036841183776030
7502845824456510763,c5farm,Hold up…. 🧐 #c5farm #lol #relatable #dad ,59600,502,8220,516000,"c5farm, lol, relatable, dad",What's Up?,2025-05-10 15:54:23,https://www.tiktok.com/@c5farm/video/7502845824456510763
7507304198434868523,kingcharlesdog,He is the king👑 #kingcharles #dog #fyp #viral #kingcharlesdog ,1300000,3426,115900,8300000,"kingcharles, dog, fyp, viral, kingcharlesdog",sonido original,2025-05-22 16:14:46,https://www.tiktok.com/@kingcharlesdog/video/7507304198434868523
7507424084968492318,hahamadeyoufuh,yeah i know😂😂😂😂😂 #fyp #myboo #gloss #baddies ,104400,137,23100,313700,"fyp, myboo, gloss, baddies",Gloss Baddies gone wild,2025-05-23 00:00:05,https://www.tiktok.com/@hahamadeyoufuh/video/7507424084968492318
7505313170274192671,gm440wt,#warthunder #fup #like #su34 #pe8 ,61900,1114,7644,756900,"warthunder, fup, like, su34, pe8",оригинальный звук,2025-05-17 07:29:15,https://www.tiktok.com/@gm440wt/video/7505313170274192671
7507648745274674454,golubki1,Тгк: Семейство голубков🕊️,193700,771,33100,2400000,,оригинальный звук,2025-05-23 14:31:33,https://www.tiktok.com/@golubki1/video/7507648745274674454
7507574450238360875,quynhgiang.songhu,#movie #tiktok #fypシ ,7787,16,20,478800,"movie, tiktok, fypシ",original sound,2025-05-23 09:45:46,https://www.tiktok.com/@quynhgiang.songhu/video/7507574450238360875
7506879630570196280,evgeni3483,@fiker_di #motosport #motorcycle #moto #progasi #мотоспорт #мотоциклы #мотоцикл #мото #прогаси ,140800,4825,213200,2400000,"motosport, motorcycle, moto, progasi, мотоспорт, мотоциклы, мотоцикл, мото, прогаси",оригинальный звук,2025-05-21 12:47:02,https://www.tiktok.com/@evgeni3483/video/7506879630570196280
7500416377585405226,nniido,My allergies are killing me,558000,347,55200,1900000,,original sound,2025-05-04 02:46:37,https://www.tiktok.com/@nniido/video/7500416377585405226
7507008569255021866,kevin.lawson,I’ll take care of it 😉😂 #girldad P.S. what was the dog doing 👀🤦‍♂️😂,49200,746,7062,398000,girldad,original sound,2025-05-21 21:07:31,https://www.tiktok.com/@kevin.lawson/video/7507008569255021866
7507808862339157279,maddie.mjs,whoever this is come back💔 #fineshyt #wemissyou #fyp #foryou #foryoupage #truck #truckboy #needthat ,144500,221,4700,624900,"fineshyt, wemissyou, fyp, foryou, foryoupage, truck, truckboy, needthat",Bunna Summa,2025-05-24 00:53:05,https://www.tiktok.com/@maddie.mjs/video/7507808862339157279
7501469407500094762,sassykassy107,Ya ya 🧚🏽 #fairy #shewasafairy ,123100,377,2580,945600,"fairy, shewasafairy",Fairy,2025-05-06 22:52:45,https://www.tiktok.com/@sassykassy107/video/7501469407500094762
7507500402800151851,houseofhighlights,Lil bro really did it 🤣🤣 (@Josh W) #dad #son #prank #fail ,107800,264,1193,963800,"dad, son, prank, fail",original sound,2025-05-23 04:56:44,https://www.tiktok.com/@houseofhighlights/video/7507500402800151851
7507027695193181471,kaliuchis,when they keep tryna add more tour dates everyone be calmmmm ,125800,1209,1768,516200,,All I Can Say,2025-05-21 22:21:42,https://www.tiktok.com/@kaliuchis/video/7507027695193181471
7507514034376183070,alexivgonzalez,@ayzjiahna ,133700,122,1239,518800,,I Aint Got No Panties on on the Dance Flooo,2025-05-23 05:49:24,https://www.tiktok.com/@alexivgonzalez/video/7507514034376183070
7507389508497935646,diamonds_and_baguettes,#planetfitness #summer #summerbodyloading #fypシ #summer2025 #real #viral #fyp #realatable #xyvbca ,223100,753,14900,801400,"planetfitness, summer, summerbodyloading, fypシ, summer2025, real, viral, fyp, realatable, xyvbca",is it love this time slowed,2025-05-22 21:45:38,https://www.tiktok.com/@diamonds_and_baguettes/video/7507389508497935646
7500752134401510702,pince.nick,Hollywood Studios May 4th Lightsaber Meetup but I with my Disney pin for Star Wars day #maythe4th #disneyworld #lightsabermeetup ,360400,380,8585,4000000,"maythe4th, disneyworld, lightsabermeetup",original sound,2025-05-05 00:29:43,https://www.tiktok.com/@pince.nick/video/7500752134401510702
7507431263398153480,melissamuroo,,684900,2005,157200,6400000,,sonido original,2025-05-23 00:27:44,https://www.tiktok.com/@melissamuroo/video/7507431263398153480
7506949363134958878,thatdriptho6,Good girls watch. Bad girls wear it. #jewelry #necklace #alt #brat #alternative #darkromance #punk #choker #leathercraft #couple #goth #alttiktok #BookTok #smallbusiness #TikTokShopMemorialDay,11400,2540,35700,884200,"jewelry, necklace, alt, brat, alternative, darkromance, punk, choker, leathercraft, couple, goth, alttiktok, booktok, smallbusiness, tiktokshopmemorialday",original sound,2025-05-21 17:17:42,https://www.tiktok.com/@thatdriptho6/video/7506949363134958878
7507637841862675743,realmadwolf475,POV: You go to Western Pennsylvania #pennsylvania #usa #travel #pittsburgh ,66000,973,14200,787600,"pennsylvania, usa, travel, pittsburgh",original sound,2025-05-23 13:49:48,https://www.tiktok.com/@realmadwolf475/video/7507637841862675743
7504740686403505438,t.i.beyer9,#holyairball ,101600,268,12100,1200000,holyairball,ECE Marketing Airball,2025-05-15 18:26:57,https://www.tiktok.com/@t.i.beyer9/video/7504740686403505438
7507156417577504007,stvchvchb257,Хаххахахаха,172500,1302,21300,1200000,,оригинальный звук,2025-05-22 06:41:05,https://www.tiktok.com/@stvchvchb257/video/7507156417577504007
7506370513741319470,user90125374,#foodtiktok #relatable #fyp #trending #viral  ,100700,4920,3974,804800,"foodtiktok, relatable, fyp, trending, viral",Ms Jackson,2025-05-20 03:52:06,https://www.tiktok.com/@user90125374/video/7506370513741319470
7507711012154592558,gigglysquad,post baby clarity @hannah_berner @paige_desorbo #comedy #podcast,60000,1368,5163,781600,podcast,original sound - GIGGLY SQUAD,2025-05-23 18:34:01,https://www.tiktok.com/@gigglysquad/video/7507711012154592558
7506924504568974635,aj_ranch_odessa_tx,"THIS INCIDENT HAPPENED TODAY AT MURRY FLY ELEMENTARY SCHOOL IN ODESSA TX.  WERE THE SCHOOL PRINCIPAL AND A MOTHER OF A PRE-K STUDENT HAVE HAD PROBLEMS IN THE PAST . AND THE SCHOOL PRINCIPAL THOUGHT IT WAS A GOOD MOMENT TO TAKE ADVANTAGE AND ABUSE OF HER AUTHORITY AGAINST THIS MOTHER , WE ALL AS PARENTS WITNESS THAT THE MOTHER DIDN'T BREAK NO LAW FOR THIS TO GO THIS WAY , WE ALL SAW AS THE PRINCIPAL ADMITTED ON THE VIDEO THAT THEY HAD PROBLEMS IN THE PAST , BUT AT THE MOMENT THE MOTHER WAS NOT VIOLATING NO LAW, WE ALL WITNESS TODAY ABUSE OF AUTHORITY , ALL PARENTS THAT WITNESS THIS WERE MAD TO SEE HOW THIS PUBLIC SERVANTS ACTED ABUSING OF THERE AUTHORITY.  #authorityabuse  #lawenforcementcommunity ",95600,6743,9045,1200000,"authorityabuse, lawenforcementcommunity",original sound,2025-05-21 15:41:19,https://www.tiktok.com/@aj_ranch_odessa_tx/video/7506924504568974635
7505311406166658335,ironclips44,Lacy almost CRIES after catching  McKinley kissing Oblivion in front of him 🥺❤️‍🩹 | #lacy #mckinley #julia #ironclips ,36900,203,303,1500000,"lacy, mckinley, julia, ironclips",nostalgia,2025-05-17 07:22:36,https://www.tiktok.com/@ironclips44/video/7505311406166658335
7507313001108819246,the_arts_apprentice_2.0,"What freaks me out the most is that I see myself in her, I even look like her 2019 self. ",88200,1150,178,782300,,som original,2025-05-22 16:48:54,https://www.tiktok.com/@the_arts_apprentice_2.0/video/7507313001108819246
7507613981431926034,darybannova,"Меня просто от этого трясет🤬😤 Пришло тепло и мы все больше времени проводим на детской площадке. Чего там только не увидишь.. бываешь свидетелем каких-то ситуаций, но сегодня мы стали участниками одного прикола.  Песочница. Моя дочь играет с другой девочкой с лопаткой и машинкой, все хорошо. Вокруг много детей и все друг с другом общаются, играют и тд. Тут прибывает в это заведение еще один ребенок с мамой и идет в сторону, где играет моя дочь. Этот мальчик еще не разговаривает, за него все говорит мама. В общем он очень хотел подружиться с моей дочкой, подошел к ней и сел рядом, моя дочь помахала ему рукой и сказала: «привет, мальчик». Так как он пока не говорит, его мама сказала ему: «сынок, девочка говорит привет, помаши ей». Мальчик помахал дочке рукой, все улыбнулись, и, КАЗАЛОСЬ БЫ, ЧТО НЕ ТАК???  А дело в том, что мамочка этого мальчика решила, что этого не достаточно, и сказала своему сыну: «иди скорее, ПОЦЕЛУЙ девочку». Мальчик послушно встал и начал пытаться поцеловать мою дочь!!! Совершенно чужие для нас люди! Мне в эту же секунду стало плохо и я вежливо попросила этого не делать.  Зачем??? Для чего вы учите ребенка подходить к незнакомым детям и ЦЕЛОВАТЬ ИХ??? Не просто поздороваться, помахать, не обнять в конце концов, а ПОЦЕЛОВАТЬ!!!  Блин, ну это же нарушение всего вообще!! От гигиены до личного пространства. Неужели это кому-то нужно объяснять??  Пожалуйста, скажите, что я не одна такая, кто считает это дикостью… #дети #жизнь #семья #дочь #треш #площадка #мамскийблог #мама #мамаидочь #история #истории #лето",45400,1331,367,1500000,"дети, жизнь, семья, дочь, треш, площадка, мамскийблог, мама, мамаидочь, история, истории, лето",Shake It To The Max (FLY) (Remix),2025-05-23 12:16:40,https://www.tiktok.com/@darybannova/video/7507613981431926034
7507676849435151658,obc.clips,#dannybans #kaicenat #streameruniversity #fypシ ,100100,263,1254,513900,"dannybans, kaicenat, streameruniversity, fypシ",original sound,2025-05-23 16:21:19,https://www.tiktok.com/@obc.clips/video/7507676849435151658
7507733843915312430,horrorofyouth,WHO is eating Gas Station wings and taquitos😭💔 satire/ all jokes #gasstation #711 #comedian #comedy #funny ,139100,1246,16600,1100000,"gasstation, 711, comedian, comedy, funny",Classic classical gymnopedie solo piano(1034554),2025-05-23 20:02:28,https://www.tiktok.com/@horrorofyouth/video/7507733843915312430
7504038718177611050,tessau69,so this just happened she begged me to film i literally have no idea anyone know what this is about #dia ,283400,7616,63300,1600000,dia,original sound,2025-05-13 21:03:20,https://www.tiktok.com/@tessau69/video/7504038718177611050
7507264014410468638,the_theme_team,"Toad is acting up again 💀 📍Toadstool Café  | super Nintendo world | epic universe | Orlando, Florida #epicuniverse #supernintendoworld #mario ",29400,89,2862,218500,"epicuniverse, supernintendoworld, mario",Super Mario 64 Slider Racing Song,2025-05-22 13:38:48,https://www.tiktok.com/@the_theme_team/video/7507264014410468638
7505040835457600798,blueeyes8333,My first born on his way to the Air Force ❤️❤️❤️,48700,150,70,1600000,,som original,2025-05-16 13:51:38,https://www.tiktok.com/@blueeyes8333/video/7505040835457600798
7507425049679334698,theclip.provider,streamer university off to a crazy start😭 @Kai Cenat #fyp #viral #trend #xyzbca #foryoupage #streamer #streameruniversity #kaicenat #tim2tact #clip,23400,291,372,787400,"fyp, viral, trend, xyzbca, foryoupage, streamer, streameruniversity, kaicenat, tim2tact, clip",TRANSGENDER (PEARL WHITE VIP),2025-05-23 00:04:10,https://www.tiktok.com/@theclip.provider/video/7507425049679334698
7507050886191926571,texastomofficial,Why is this generation like this🤔 #genz  #genx,42900,2623,16400,410000,"genz, genx",NO SOUND,2025-05-21 23:51:41,https://www.tiktok.com/@texastomofficial/video/7507050886191926571
7500793242967985454,candikitty,couldn’t drink fast enough :’) #renfaire ,253400,1560,21600,2900000,renfaire,original sound,2025-05-05 03:09:12,https://www.tiktok.com/@candikitty/video/7500793242967985454
7507705751419407662,apollyonsteel,#fyp #fypシ #gojo #geto #jjk #anime #joke #meme #jokes #memes ,82000,322,6158,356600,"fyp, fypシ, gojo, geto, jjk, anime, joke, meme, jokes, memes",original sound,2025-05-23 18:13:19,https://www.tiktok.com/@apollyonsteel/video/7507705751419407662
7506684564824198443,aj.chambers03,#soad #ranking  #fypシ゚viral #best,79400,6022,2625,839200,"soad, ranking, fypシ゚viral, best",TBF,2025-05-21 00:10:12,https://www.tiktok.com/@aj.chambers03/video/7506684564824198443
7507275463769804063,callierrose,I hope I did this trend correctly🦋✨  #imnotfallingfor #propagenda #trend #trending #liberal #liberaltiktok ,40000,550,459,240000,"imnotfallingfor, propagenda, trend, trending, liberal, liberaltiktok",PARTY 4 U x NEVER BE LIKE YOU,2025-05-22 14:23:12,https://www.tiktok.com/@callierrose/video/7507275463769804063
7507524818972036383,alexandjessicaa,late night ramen at streamers university ,65300,76,174,462700,,original sound,2025-05-23 06:31:28,https://www.tiktok.com/@alexandjessicaa/video/7507524818972036383
7507073752560094494,achs.beta.club,#teachertok #betaclub #nationalbetaclub #inspirationalteacher @daynechester1 @ur mom ,161300,355,775,958900,"teachertok, betaclub, nationalbetaclub, inspirationalteacher",original sound,2025-05-22 01:20:20,https://www.tiktok.com/@achs.beta.club/video/7507073752560094494
7507838569759722795,225zyyclips,,28100,443,2487,408400,,original sound,2025-05-24 02:48:39,https://www.tiktok.com/@225zyyclips/video/7507838569759722795
7507790423071444267,theclipstudiox,N3on did NOT expect this former NBA all star to be THIS bad 😯😭 #nba #n3on #ashtonhall ,50200,185,1944,1700000,"nba, n3on, ashtonhall",Circadian Rhythm,2025-05-23 23:41:51,https://www.tiktok.com/@theclipstudiox/video/7507790423071444267
7507030870985887007,reilly_murphy3,Ice cream delivery day! 🍦 #michigancheck #michigan #montaguemichigan #icecream #minigolf #summer #icecreamshop #cleantok #restock ,98100,237,392,915200,"michigancheck, michigan, montaguemichigan, icecream, minigolf, summer, icecreamshop, cleantok, restock",original sound,2025-05-21 22:33:58,https://www.tiktok.com/@reilly_murphy3/video/7507030870985887007
7504837363449826606,cutieejos,and also saying ily in a platonic way,384600,3040,34300,1600000,,Staying,2025-05-16 00:42:30,https://www.tiktok.com/@cutieejos/video/7504837363449826606
7505960177347169541,xplainedalgebra,You can’t solve this #math #mathematics #algebra #mathtok #harvard ,67900,7545,2005,1800000,"math, mathematics, algebra, mathtok, harvard",smezir_2 (Slowed),2025-05-19 01:19:09,https://www.tiktok.com/@xplainedalgebra/video/7505960177347169541
7505331914966879518,60_second_lego,Random Lego Easter Eggs Pt.7 #lego ,195200,425,12300,1500000,lego,original sound,2025-05-17 08:42:28,https://www.tiktok.com/@60_second_lego/video/7505331914966879518
7505859493985570056,ssabiinxxx,#дэнсдэнс ,284900,900,16800,2100000,дэнсдэнс,оригинальный звук,2025-05-18 18:48:23,https://www.tiktok.com/@ssabiinxxx/video/7505859493985570056
7504879792932588830,abbyspitz0720,Horizontal vs vertical worship!!! #worship #christian #christianmusic #jesuslovesyou #fyp ,165600,1185,2029,800800,"worship, christian, christianmusic, jesuslovesyou, fyp",original sound,2025-05-16 03:26:50,https://www.tiktok.com/@abbyspitz0720/video/7504879792932588830
7505979794580868398,mauihill01,Shouldn’t no child be so scared like this 🤦🏽‍♂️ Grown ssa men asking a 10 year old “what’s her panties size” and “if she’s a virgin” #keepthekidssafe #lockhimup  #iowa ,108700,1874,2652,713400,"keepthekidssafe, lockhimup, iowa",original sound,2025-05-19 02:35:40,https://www.tiktok.com/@mauihill01/video/7505979794580868398
