video_id,author,description,likes,comments,shares,plays,hashtags,music,create_time,video_url
7507040798450486571,txunamydiamond,Late to the trend😔,86000,417,305,724000,,Shake It To The Max (FLY) (Remix),2025-05-21 23:12:37,https://www.tiktok.com/@txunamydiamond/video/7507040798450486571
7500774301881158942,jackieotero_,#pov #bf #gf ,393200,353,64000,3500000,"pov, bf, gf",original sound,2025-05-05 01:55:26,https://www.tiktok.com/@jackieotero_/video/7500774301881158942
7507700935448218911,thetylilshowplug,😂😂 #fyp #foryou #foryoupage #viral #trending #thetylilshow #tylil #chicklet #tommyhilfiger #billnyethescienceguy #funny #xyzbca,114800,232,637,953000,"fyp, foryou, foryoupage, viral, trending, thetylilshow, tylil, chicklet, tommyhilfiger, billnyethescienceguy, funny, xyzbca",Classic classical gymnopedie solo piano(1034554),2025-05-23 17:54:28,https://www.tiktok.com/@thetylilshowplug/video/7507700935448218911
7507347330471824670,lifeandlindsey,These little vintage ballet spectacles might be the best purchase I have ever made #fyp #paris ,80600,193,2119,434000,"fyp, paris",sonido original,2025-05-22 19:02:02,https://www.tiktok.com/@lifeandlindsey/video/7507347330471824670
7507618154919546154,sharayataylor,Because the first ponytail after a fresh install is a sacred moment 🔥 lightweight ✅ tension-less ✅ #braids #putitinabun #fyp ,28600,60,295,412000,"braids, putitinabun, fyp",original sound,2025-05-23 12:33:56,https://www.tiktok.com/@sharayataylor/video/7507618154919546154
7507737297673096479,incubatorttv,The Poly Crosshair is the BEST crosshair… or is it? #marvel #marvelrivals #marvelrivalsgameplay #crosshair ,124100,419,3063,1100000,"marvel, marvelrivals, marvelrivalsgameplay, crosshair",original sound,2025-05-23 20:15:31,https://www.tiktok.com/@incubatorttv/video/7507737297673096479
7507329194347515166,solanoimmigrationlawfirm,“tHEy nEEd tO Do iT The RIghT Way” well… 👩🏽‍⚖️🇺🇸 #immigration #greencard #uscis #immigrationlawfirm #undocumented #immigrant ,186800,927,1351,778700,"immigration, greencard, uscis, immigrationlawfirm, undocumented, immigrant",ECE Marketing Airball,2025-05-22 17:51:40,https://www.tiktok.com/@solanoimmigrationlawfirm/video/7507329194347515166
7507066976712314118,jordaniscool554,#fyp #xyzcba #viral #fypシ #blowthisup #xybca #bf #deriod ,98900,1134,21500,530800,"fyp, xyzcba, viral, fypシ, blowthisup, xybca, bf, deriod",original sound,2025-05-22 00:54:01,https://www.tiktok.com/@jordaniscool554/video/7507066976712314118
7507322306595736862,babyusa66,Cute extroverted baby 😍 #baby #babiesoftiktok #babytok #fyp ,775700,627,37200,3300000,"baby, babiesoftiktok, babytok, fyp",original sound,2025-05-22 17:24:56,https://www.tiktok.com/@babyusa66/video/7507322306595736862
7507430137688837407,camfant,,126300,436,9141,517900,,original sound,2025-05-23 00:23:28,https://www.tiktok.com/@camfant/video/7507430137688837407
7504337327464910126,itsseanbankhead,move bitch get out the way,71600,1164,1255,605400,,original sound,2025-05-14 16:21:43,https://www.tiktok.com/@itsseanbankhead/video/7504337327464910126
7505184756041141535,daylean12,i might be blind but he’s deaf💀#fypシ #couplescomedy #bfgf ,158700,203,48000,654800,"fypシ, couplescomedy, bfgf",original sound,2025-05-16 23:10:11,https://www.tiktok.com/@daylean12/video/7505184756041141535
7507734533979049258,wlkynews,"How bad was the flooding at Buffalo Trace in Kentucky? They mark the walls at the Frankfort distillery after a flood, and April's flood is now marked all the way at the top. 😮",24000,109,4626,464400,,original sound - WLKY News,2025-05-23 20:05:09,https://www.tiktok.com/@wlkynews/video/7507734533979049258
7507369265889070367,evanescencesgf,"i am a strong fiona defender, you can’t say anything bad about her near me #fionagallagher #emmyrossum #shameless #foryoupage #foryou #fyp #viral #xyzbca ",122900,196,390,834000,"fionagallagher, emmyrossum, shameless, foryoupage, foryou, fyp, viral, xyzbca",original sound,2025-05-22 20:27:10,https://www.tiktok.com/@evanescencesgf/video/7507369265889070367
7503327477033405726,gsxrginger,Keep those eyes 👀👀👀 • • • #moto #motorcycle #ride #biker #bikergirl #gsxrginger #gsxr1000r #motorcyclecontent #gixxer #biketok #girlrider #ginger ,30700,146,159,618700,"moto, motorcycle, ride, biker, bikergirl, gsxrginger, gsxr1000r, motorcyclecontent, gixxer, biketok, girlrider, ginger",original sound,2025-05-11 23:03:05,https://www.tiktok.com/@gsxrginger/video/7503327477033405726
7507824764501757190,manelyk_oficial,Team chihuahua #manelyk ,137500,4038,1076,1000000,manelyk,sonido original,2025-05-24 01:54:38,https://www.tiktok.com/@manelyk_oficial/video/7507824764501757190
7507740880279817518,alexsandra_madonia,JK! I say she’s a good mix between us both 😉 #allthatshewants #aceofbase #motherdaughter #fyp #over40 ,116400,141,369,828500,"allthatshewants, aceofbase, motherdaughter, fyp, over40",оригинальный звук,2025-05-23 20:29:28,https://www.tiktok.com/@alexsandra_madonia/video/7507740880279817518
7497308687568997663,edixa999,#LIVEIncentiveProgram #LIVEInteraction #PaidPartnership ,123600,1215,1491,2900000,"liveincentiveprogram, liveinteraction, paidpartnership",sonido original,2025-04-25 17:47:01,https://www.tiktok.com/@edixa999/video/7497308687568997663
7507652187170934046,cookinwitkyalt,Kya getting ready for a fun-filled day of parties! #cookingwithkya #cookinwitkya #PartyPrep #PajamaLife #CollegeVibes #ChatOnScreen #WeekendPlans ,33500,52,121,562200,"cookingwithkya, cookinwitkya, partyprep, pajamalife, collegevibes, chatonscreen, weekendplans",original sound,2025-05-23 14:45:18,https://www.tiktok.com/@cookinwitkyalt/video/7507652187170934046
7507392148182961415,ahinesana,УРАААААААААААА  #mzlff #саша #тикток #радость ,193400,4238,29900,1400000,"mzlff, саша, тикток, радость",оригинальный звук,2025-05-22 21:55:54,https://www.tiktok.com/@ahinesana/video/7507392148182961415
7506786571660807470,allskjoo,26yo woman takes her own life after battling SEVERE Hyperemesis Gravidarum 🥺 #jesscronshaw #hyperemesisgravidarum #greenscreen,409400,4528,18000,4800000,"jesscronshaw, hyperemesisgravidarum, greenscreen",original sound,2025-05-21 06:46:12,https://www.tiktok.com/@allskjoo/video/7506786571660807470
7507039779792440618,freemack2207,,113300,1598,1216,1600000,,Bunna Summa,2025-05-21 23:08:37,https://www.tiktok.com/@freemack2207/video/7507039779792440618
7506371176025935160,aitanax.montse,Todas son lindas muchachitas 🩷,785900,9341,22700,5200000,,sonido original,2025-05-20 03:54:03,https://www.tiktok.com/@aitanax.montse/video/7506371176025935160
7504699129386241322,halfasiansensation,Thank you for the cute photo op @Southwest Airlines #aapiheritagemonth #asianhistory #southwestairlines ,237900,369,10900,1200000,"aapiheritagemonth, asianhistory, southwestairlines",original sound,2025-05-15 15:45:41,https://www.tiktok.com/@halfasiansensation/video/7504699129386241322
7501720698063179039,pink.popsicles,grow up! frick! #jokes #unpopularopinion #texting #senioryear ,656500,2412,18200,3800000,"jokes, unpopularopinion, texting, senioryear",original sound,2025-05-07 15:08:14,https://www.tiktok.com/@pink.popsicles/video/7501720698063179039
7507762014819798318,philadelphiaeagles,THE OOP!!! THE DUNK!!! #eagles #nfl #cooperdejean #saquonbarkley ,75700,485,6420,626200,"eagles, nfl, cooperdejean, saquonbarkley",original sound,2025-05-23 21:51:34,https://www.tiktok.com/@philadelphiaeagles/video/7507762014819798318
7507481109999947038,1k.trenton,#fyp#viral#canam#renegade#1000#xmr,54400,1682,10800,1100000,"fyp, viral, canam, renegade, 1000, xmr",original sound,2025-05-23 03:41:19,https://www.tiktok.com/@1k.trenton/video/7507481109999947038
7500044411007438111,foberet,body rock #2013 #justinbieber #fyp #believetour #concert,2700000,8969,292500,11700000,"2013, justinbieber, fyp, believetour, concert",som original,2025-05-03 02:43:05,https://www.tiktok.com/@foberet/video/7500044411007438111
7506290302093643016,zethsowavy,,147400,3334,41600,921300,,original sound,2025-05-19 22:40:14,https://www.tiktok.com/@zethsowavy/video/7506290302093643016
7504766525132344606,gsd.dexter,I’m scared of bloat so no thank you #bloat #dogbloat #dogcommunity #fyp #germanshepherd #fyppppppppppppppppppppppp #dogtraining #ecollartechnologies #gsd ,85100,777,1068,810400,"bloat, dogbloat, dogcommunity, fyp, germanshepherd, fyppppppppppppppppppppppp, dogtraining, ecollartechnologies, gsd",GADAMN!,2025-05-15 20:07:12,https://www.tiktok.com/@gsd.dexter/video/7504766525132344606
7505253757039545607,ferduranc,@Alaan es broma ,1100000,1782,28900,7700000,,original sound,2025-05-17 03:37:48,https://www.tiktok.com/@ferduranc/video/7505253757039545607
7505918196004703494,mutboo,,85700,280,2453,869300,,Nuthin but a G Thang x Without me,2025-05-18 22:36:12,https://www.tiktok.com/@mutboo/video/7505918196004703494
7502102221698501910,_v4mpd0ll__,can I live 🙏🏻 #fyp #altgirl #emo #alt #alternative #berlin #alttiktok #viral ,1300000,9604,59500,12200000,"fyp, altgirl, emo, alt, alternative, berlin, alttiktok, viral",original sound,2025-05-08 15:48:13,https://www.tiktok.com/@_v4mpd0ll__/video/7502102221698501910
7507373637184326954,nicollefigueroaa,No me digan suegra ok ,793100,1361,2378,5000000,,san blaS,2025-05-22 20:44:08,https://www.tiktok.com/@nicollefigueroaa/video/7507373637184326954
7507326907541736735,galloboxing21,,18300,587,577,391700,,Humilde por Herencia,2025-05-22 17:42:47,https://www.tiktok.com/@galloboxing21/video/7507326907541736735
7501946706762796319,natalientheaguilars,jk @DENTIFY mx fixed her shark teeth 🤭😂 #theaguilars #sister #joke ,354100,859,6064,2400000,"theaguilars, sister, joke",Monkeyshine-JP,2025-05-08 05:45:39,https://www.tiktok.com/@natalientheaguilars/video/7501946706762796319
7507292677046570258,fedoratwh86,#fyp ну и ладно надо будет измениться,264700,4079,46900,1300000,fyp,Ам ням,2025-05-22 15:29:48,https://www.tiktok.com/@fedoratwh86/video/7507292677046570258
7506728761639947550,harrietbyrd19675,Her small toes omg! 🥹 #charlesandalyssa #charlesandalyssaforever #couples ,47800,650,827,673500,"charlesandalyssa, charlesandalyssaforever, couples",original sound,2025-05-21 03:01:40,https://www.tiktok.com/@harrietbyrd19675/video/7506728761639947550
7507617510624218376,notallaig,Но самый лучший Тгк: kirkorovar ,267200,2173,4404,2600000,,som original,2025-05-23 12:30:21,https://www.tiktok.com/@notallaig/video/7507617510624218376
7507813038196657451,ericplaytoomuch_,Going to school with the worst student😭🙏,255700,1112,31400,1700000,,original sound,2025-05-24 01:09:37,https://www.tiktok.com/@ericplaytoomuch_/video/7507813038196657451
7506942479799749934,goodmovies649,#fyp #foryou,29600,22,72,394500,"fyp, foryou",original sound - goodmovies6,2025-05-21 16:51:02,https://www.tiktok.com/@goodmovies649/video/7506942479799749934
7504774252868963606,nathans.mp4,love u sister @😘🙈☺️ #pinkpantheress #fancythat #music #meetandgreet #signing ,271700,222,1786,889900,"pinkpantheress, fancythat, music, meetandgreet, signing",Father Figure (Featured in 'Babygirl'),2025-05-15 20:37:04,https://www.tiktok.com/@nathans.mp4/video/7504774252868963606
7505475547896597790,espn,She means BUSINESS 💼 (via @WNBA) #caitlinclark #indianafever #wnba #wbb ,39600,456,532,1100000,"caitlinclark, indianafever, wnba, wbb",NOKIA,2025-05-17 17:58:45,https://www.tiktok.com/@espn/video/7505475547896597790
7499476040008469790,torimarlow1,Think smarter not harder #fyp #hardwoodflooring #hardwood #leafblower #sweeping #cleanfloors #cleaningtiktok ,136000,1224,17000,2800000,"fyp, hardwoodflooring, hardwood, leafblower, sweeping, cleanfloors, cleaningtiktok",original sound,2025-05-01 13:57:55,https://www.tiktok.com/@torimarlow1/video/7499476040008469790
7507058233119345966,leahhess10,New Jellycats from the summer collection! #jellycat #fyp #jellycatcollection #jellycats #jellycatcollector #jellycatlondon #surfsup #codymaverick #chickenjoe #bigz ,672200,1868,52900,2600000,"jellycat, fyp, jellycatcollection, jellycats, jellycatcollector, jellycatlondon, surfsup, codymaverick, chickenjoe, bigz",.,2025-05-22 00:20:11,https://www.tiktok.com/@leahhess10/video/7507058233119345966
7505895571698339102,sirifunny_,Real Sassy Babies Around Here 😂 #funny #kids #hilarious #humor #trynottolaugh #lol #fyp ,182800,561,14700,1600000,"funny, kids, hilarious, humor, trynottolaugh, lol, fyp",original sound,2025-05-18 21:08:46,https://www.tiktok.com/@sirifunny_/video/7505895571698339102
7506957029517430058,fritochips,so groggy the next day though (but worth it ofc) #yosemite #hiking #summer #daytrip #roadtrip ,83800,271,9022,431200,"yosemite, hiking, summer, daytrip, roadtrip",original sound,2025-05-21 17:47:36,https://www.tiktok.com/@fritochips/video/7506957029517430058
7499619148700519726,polidore303,Bro dropped a diss track on his own team😳😭😭😭😭😭#saints #rapping #diss #nfldraft #fypシ゚viral #tiktoklive #livehighlights ,342800,2600,67400,2700000,"saints, rapping, diss, nfldraft, fypシ゚viral, tiktoklive, livehighlights",original sound,2025-05-01 23:13:15,https://www.tiktok.com/@polidore303/video/7499619148700519726
7499822868373572869,enerjade,#fy #fyp #relate #relateable #bsf #friendgroup ,281700,1112,33500,1300000,"fy, fyp, relate, relateable, bsf, friendgroup",original sound,2025-05-02 12:23:13,https://www.tiktok.com/@enerjade/video/7499822868373572869
7508042455435070762,toptierlives,#viral #streameruniversity #fyp #rakai #trending #5star #kaicenat #teamwork #fypppppppppppppppppppp ,63100,213,368,941800,"viral, streameruniversity, fyp, rakai, trending, 5star, kaicenat, teamwork, fypppppppppppppppppppp","it hurts, now that you're gone",2025-05-24 16:00:13,https://www.tiktok.com/@toptierlives/video/7508042455435070762
7507600249024728342,ceciarmy,Esto me ha alegrado el día By / @Chandler Durango ,3000000,12100,135200,17700000,,sonido original,2025-05-23 11:23:24,https://www.tiktok.com/@ceciarmy/video/7507600249024728342
7507800620024335646,alphaqsports,Angel Reese has missed as many layups (229) as Shaq missed freethrows (229) in his 1999 NBA regular season... She is on pace to miss over 200 layups this WNBA season as well 🤯 #angelreese #shaq #lakers #sky #nba #wnba ,106600,1120,10600,1100000,"angelreese, shaq, lakers, sky, nba, wnba",Soul Survivor - Instrumental,2025-05-24 00:21:14,https://www.tiktok.com/@alphaqsports/video/7507800620024335646
7507687467869293854,blake_speaks_fire,#greenscreensticker ,171600,12200,27300,1400000,greenscreensticker,original sound,2025-05-23 17:02:13,https://www.tiktok.com/@blake_speaks_fire/video/7507687467869293854
7506969155107704080,vxsterq,тгк: опять лукин,113800,680,16400,912600,,cat kitty cat cat,2025-05-21 18:34:39,https://www.tiktok.com/@vxsterq/video/7506969155107704080
7508035420911963423,only_robbiee,2k’s and 3 HBP’S rough day at the plate 😅 buy the bg’s @The Unwritten Brand to wear pitches for u team #fyp #baseballtok ,61200,153,191,2600000,"fyp, baseballtok",original sound,2025-05-24 15:32:19,https://www.tiktok.com/@only_robbiee/video/7508035420911963423
7507427802589711658,ayodimples,Now this is a lot #InRealLife  she #FAFO real quick ,51000,5457,9857,481100,"inreallife, fafo",original sound,2025-05-23 00:14:35,https://www.tiktok.com/@ayodimples/video/7507427802589711658
7507528594445421831,rubys.lifestyle5,red gazelles… #shoes #relatable #shoecheck #shoestyle  ,991400,2170,64700,4000000,"shoes, relatable, shoecheck, shoestyle",take my breath away by berlin,2025-05-23 06:45:20,https://www.tiktok.com/@rubys.lifestyle5/video/7507528594445421831
7501727494551129374,sharpclipper,#fyp #foryoupage #ashleytrevino ,686900,1567,20600,8500000,"fyp, foryoupage, ashleytrevino",original sound,2025-05-07 15:34:31,https://www.tiktok.com/@sharpclipper/video/7501727494551129374
7507779384028187950,theclipstudiox,Ashton hall felt DISRESPECTED after Adin thought he was BROKE and offered to take him shopping  😭👀 #ashtonhall #adinross ,61800,316,463,1100000,"ashtonhall, adinross",Night Trouble,2025-05-23 22:58:54,https://www.tiktok.com/@theclipstudiox/video/7507779384028187950
7507150712468524306,0999a01,@arina о ну мы моя любимая #гуляем #6 #утра #пробежка #вдвоем ,477000,7594,186400,4500000,"гуляем, 6, утра, пробежка, вдвоем",In your eyes Remix Prod. Kayarchon,2025-05-22 06:18:57,https://www.tiktok.com/@0999a01/video/7507150712468524306
7507516136670465322,oliviayocum,"Yet another reason to love sweet ol’ FCI 🖤 The buses are located right along the parking lot of the building, where guests can see and take photographs with them.  Have you seen the Twisty Buses here? 🤡  #ohio #fairfieldcountyinfirmary #fci #americanhorrorstory #twistytheclown #clown #bus #paranormal #paranormaltiktok #paranormalinvestigator #paranormalinvestigation #ghost #ghosthunting #hauntedohio #ghosthunt #hauntedohio #haunted #spooky #creepy #travel #spookytok #fyp #foryoupage ",49100,168,3774,414300,"ohio, fairfieldcountyinfirmary, fci, americanhorrorstory, twistytheclown, clown, bus, paranormal, paranormaltiktok, paranormalinvestigator, paranormalinvestigation, ghost, ghosthunting, hauntedohio, ghosthunt, haunted, spooky, creepy, travel, spookytok, fyp, foryoupage","American Horror Story Theme (Tv Version) [From ""American Horror Story""]",2025-05-23 05:58:22,https://www.tiktok.com/@oliviayocum/video/7507516136670465322
7507053361590570271,pelicanssnoballs_lexsc,Come and see us!!!!!! #pelicans #snoballs #fyp #trending ,31000,1225,3420,616700,"pelicans, snoballs, fyp, trending",New Flame (but I promise you) (feat. Usher & Rick Ross),2025-05-22 00:01:15,https://www.tiktok.com/@pelicanssnoballs_lexsc/video/7507053361590570271
7506218768029256982,__destinyalexis,,100400,266,790,641500,,I think about it all the time featuring bon iver,2025-05-19 18:02:31,https://www.tiktok.com/@__destinyalexis/video/7506218768029256982
7507678656982961439,darienrinn,i’m freaking out ,64400,106,78,613800,,original sound,2025-05-23 16:27:56,https://www.tiktok.com/@darienrinn/video/7507678656982961439
7501845294343310638,jana.craig,Can you tell who the pros are 😂,1500000,2178,14300,8200000,,luther,2025-05-07 23:11:56,https://www.tiktok.com/@jana.craig/video/7501845294343310638
7507935024642002218,darielaems,youre welcome 😋 #nursingtiktok #nursingtips #nurse #ernurse ,64900,154,16900,933400,"nursingtiktok, nursingtips, nurse, ernurse",original sound,2025-05-24 09:05:39,https://www.tiktok.com/@darielaems/video/7507935024642002218
7507116458690792735,estellelebourgeois_,you already know its about to be the worse sleep of ur life #earrings #girls  #piercings #piercingtok ,67800,53,1374,389700,"earrings, girls, piercings, piercingtok",regina george,2025-05-22 04:06:17,https://www.tiktok.com/@estellelebourgeois_/video/7507116458690792735
7507398048784403742,ryanhatesranch,summer 2023 peak? #fyp #ranchryan #lalo #itzmegab3 #murdaricky #lilpeep ,201200,310,2669,1300000,"fyp, ranchryan, lalo, itzmegab3, murdaricky, lilpeep",original sound,2025-05-22 22:18:50,https://www.tiktok.com/@ryanhatesranch/video/7507398048784403742
7506596618053913899,brooklynsuebyers,How could you…? 🥺🥺 @okpetcollectivesociety #brooklynsuebyers #fosterpuppymom #dogs #baitdog #JusticeForRocky #dogobsessed #rescue #viraldogs #dogsoftiktok #adoptadamndog #fosterdog #rescuedogs #followus #dogmom #shelterdogs #fostermama ,117700,2760,2409,1000000,"brooklynsuebyers, fosterpuppymom, dogs, baitdog, justiceforrocky, dogobsessed, rescue, viraldogs, dogsoftiktok, adoptadamndog, fosterdog, rescuedogs, followus, dogmom, shelterdogs, fostermama",How could you,2025-05-20 18:29:34,https://www.tiktok.com/@brooklynsuebyers/video/7506596618053913899
7504417869397003550,kaitlynkiedrowski,Loved my morning spent at the @Georgia Aquarium — our God is so creative! 🤍✨🐠 #georgiaaquarium #whaleshark #christiantiktok #ourgod #creative #creativecreator #atlanta #gaaquarium #aquarium ,645600,996,13000,1900000,"georgiaaquarium, whaleshark, christiantiktok, ourgod, creative, creativecreator, atlanta, gaaquarium, aquarium",original sound,2025-05-14 21:34:13,https://www.tiktok.com/@kaitlynkiedrowski/video/7504417869397003550
7504755802314509614,lindacoleman2,,123700,3803,29100,931100,,original sound,2025-05-15 19:25:39,https://www.tiktok.com/@lindacoleman2/video/7504755802314509614
7507376711516884266,meyers.samantha,yay for softball 🥰🥰,19900,551,726,473300,,Bunna Summa,2025-05-22 20:56:04,https://www.tiktok.com/@meyers.samantha/video/7507376711516884266
7507769805043387653,maligoshik,SINGLE ERA 🌟🌟,61800,417,431,661300,,original sound,2025-05-23 22:21:23,https://www.tiktok.com/@maligoshik/video/7507769805043387653
7506951846481743126,sofiee_vv,,16700,154,312,423500,"intrusivethoughtswon, lastdays, bettertieyourpjs, fyp",someone to stay,2025-05-21 17:27:15,https://www.tiktok.com/@sofiee_vv/video/7506951846481743126
7507798451787402542,maggiepinedaa,Felicidades #maggiepineda #fyp ,176300,534,520,2000000,"maggiepineda, fyp",sonido original,2025-05-24 00:13:12,https://www.tiktok.com/@maggiepinedaa/video/7507798451787402542
7506992386778860846,illuminatigam3s,I know I missed a few but this 5/5🥱,74600,2795,2756,957500,,original sound,2025-05-21 20:04:43,https://www.tiktok.com/@illuminatigam3s/video/7506992386778860846
7505469256138706222,daus_mendoza,Cook for my man with me🤭 today on the menu we got an aguacate omelette🎀 ,316300,300,1141,1600000,,original sound,2025-05-17 17:34:38,https://www.tiktok.com/@daus_mendoza/video/7505469256138706222
7507299372678319406,jack__mcgrath,#cigarettes ,29400,668,6944,346900,cigarettes,original sound,2025-05-22 15:56:00,https://www.tiktok.com/@jack__mcgrath/video/7507299372678319406
7507772466568121630,luke.brockk,#tiktok #viral #tropicalsmoothie #constipation ,47000,154,3196,290900,"tiktok, viral, tropicalsmoothie, constipation",original sound,2025-05-23 22:31:55,https://www.tiktok.com/@luke.brockk/video/7507772466568121630
7506481849749867798,sephmayela,lol now i look like i actually sleep😭 (mini vlog coming x) #fyp #forupage #dermalfiller #filler #teartroughfiller #vira #eyebags ,92000,613,2964,572200,"fyp, forupage, dermalfiller, filler, teartroughfiller, vira, eyebags",original sound,2025-05-20 11:03:28,https://www.tiktok.com/@sephmayela/video/7506481849749867798
7501776477994749214,sabzkp,Cryinggggffff #realid #california #psa ,450600,4084,6340,5700000,"realid, california, psa",original sound,2025-05-07 18:44:52,https://www.tiktok.com/@sabzkp/video/7501776477994749214
7507499009548799263,irmaclipss,😭😭😭 #fyp #cookingwithkya #deshaefrost #streameruniversity ,22500,225,687,584800,"fyp, cookingwithkya, deshaefrost, streameruniversity",Lil Phoebe x Melodica,2025-05-23 04:50:56,https://www.tiktok.com/@irmaclipss/video/7507499009548799263
7507251008884559160,zerobrainer0,African Messi 😂😂 @YoungMessi  #AfricanSports  #KnowAfrica #AfricaMonth #SportsOnTikTok #AfricanFootball #zerobrainer0 ,893800,20600,107000,40500000,"africansports, knowafrica, africamonth, sportsontiktok, africanfootball, zerobrainer0",original sound,2025-05-22 12:48:09,https://www.tiktok.com/@zerobrainer0/video/7507251008884559160
7507802598481693994,secretaccount_tuffboi0,#mIm #dih #visuallearner ,133900,12200,15500,1700000,"mim, dih, visuallearner",original sound,2025-05-24 00:28:58,https://www.tiktok.com/@secretaccount_tuffboi0/video/7507802598481693994
7505332001478593799,rinusya0510,"мне стыдно всех отмечать, пусть сами додумаются🌚🌚🌚🌚#липсинг #пв #рэк #рекомендации ",426800,2956,46500,2500000,"липсинг, пв, рэк, рекомендации",оригинальный звук,2025-05-17 08:41:26,https://www.tiktok.com/@rinusya0510/video/7505332001478593799
7507484142414744862,indiegothrockpunk,don’t know this guy HAHA,237200,263,7279,922300,,original sound,2025-05-23 03:53:22,https://www.tiktok.com/@indiegothrockpunk/video/7507484142414744862
7507833177189256478,thecareyfamil,If you ever need your child to listen immediately 😂 just put screen time on there phone 📱 🤣 #familyfun #screentime #iphone ,59600,114,319,473700,"familyfun, screentime, iphone",original sound,2025-05-24 02:27:32,https://www.tiktok.com/@thecareyfamil/video/7507833177189256478
7507783497797471518,cristiandrive424,😂,91600,80,893,428200,,original sound,2025-05-23 23:14:42,https://www.tiktok.com/@cristiandrive424/video/7507783497797471518
7507069041824009478,raratingwhatieat,@T&T Supermarket #strawberryicecream #Viral #trending #foodreview #foodie #foru #fyp #paratii #abcxyz #xybca ,59500,86,3573,1700000,"strawberryicecream, viral, trending, foodreview, foodie, foru, fyp, paratii, abcxyz, xybca",rewind,2025-05-22 01:02:02,https://www.tiktok.com/@raratingwhatieat/video/7507069041824009478
7507357349766548744,denyalopez,Ocupo un paro y que Diosito te lo pague 🙏🏻🤌🏻✨  #ex #prestamo #humor #comedia #feria #dinero  Igdenyalopezca fb Denya Lopez ,174800,1707,27600,1600000,"ex, prestamo, humor, comedia, feria, dinero",sonido original,2025-05-22 19:40:51,https://www.tiktok.com/@denyalopez/video/7507357349766548744
7506767753403993349,peibolsmith,Yo pensé que los crocs eran seguros hasta hoy!!! #destinofinal #destinofinal5 ,214500,307,7078,2300000,"destinofinal, destinofinal5",som original,2025-05-21 05:32:56,https://www.tiktok.com/@peibolsmith/video/7506767753403993349
7507463338540993822,boredhumanbeing33,#foryoupage #viral #funny #relatable ,262400,933,51100,1100000,"foryoupage, viral, funny, relatable",original sound,2025-05-23 02:32:23,https://www.tiktok.com/@boredhumanbeing33/video/7507463338540993822
