video_id,author,description,likes,comments,shares,plays,hashtags,music,create_time,video_url
7505624166385634606,dontgetmadeasily,i hate this is happening all over again.. smh 😔 #caitlinclark #angelreese #fyp #foryoupage #foryou #viral #WNBA #wbb #wnba #chicagosky #indianafever #iowawbb ,81800,623,516,728900,"caitlinclark, angelreese, fyp, foryoupage, foryou, viral, wnba, wbb, chicagosky, indianafever, iowawbb",original sound,2025-05-18 03:35:39,https://www.tiktok.com/@dontgetmadeasily/video/7505624166385634606
7497322065620372766,piperaverymaia,@maia 🙊 @averydayimshuffling @piper giles #fyp #fypppppp #fyppppppppppppppppppppppp #viralvideo #trio #highschool #viraltiktok #fypシ゚viral #fypシ #freshman #friends #relatable #sophmore #junior #senior #prom #promdress #funny ,521400,12000,64400,3300000,"fyp, fypppppp, fyppppppppppppppppppppppp, viralvideo, trio, highschool, viraltiktok, fypシ゚viral, fypシ, freshman, friends, relatable, sophmore, junior, senior, prom, promdress, funny",original sound,2025-04-25 18:38:54,https://www.tiktok.com/@piperaverymaia/video/7497322065620372766
7505123184576924971,finneashogan,What is said in the stretch lines stays in the stretch lines,168200,1268,25300,747100,,original sound,2025-05-16 19:11:15,https://www.tiktok.com/@finneashogan/video/7505123184576924971
7506986519299657003,charlygaro,Call me the blue scrubs guy #blueshirtguy #fyp #dance ,73600,2593,3835,600600,"blueshirtguy, fyp, dance",Assumptions (slowed down version),2025-05-21 19:42:00,https://www.tiktok.com/@charlygaro/video/7506986519299657003
7507650207556095278,bruna.conce,The day my life changed forever #proposal ,1000000,1495,42500,3900000,proposal,original sound,2025-05-23 14:38:12,https://www.tiktok.com/@bruna.conce/video/7507650207556095278
7507367790572096784,emekaajr,@Mousmine☔️ w duo,271500,1813,25900,2000000,,original sound,2025-05-22 20:21:29,https://www.tiktok.com/@emekaajr/video/7507367790572096784
7501419509513735454,reaganssmithh,,536700,1661,125800,3600000,,Ribs,2025-05-06 19:39:17,https://www.tiktok.com/@reaganssmithh/video/7501419509513735454
7507749325649530158,tahaniariel,Replying to @Jasmine here go the og dance w my flava on it 🌝 #dance #tahaniariel ,98600,317,484,571800,"dance, tahaniariel",I Aint Got No Panties on on the Dance Flooo,2025-05-23 21:02:31,https://www.tiktok.com/@tahaniariel/video/7507749325649530158
7505411264252824837,clik.daniel,Descansa en Paz #valeriamarquez #viral_video #fvypシviral #paratiiiiiiiiiiiiiiiiiiiiiiiiiiiiiii #fvvpppppppppp #falso #viral #triste #tik_tok #,193100,976,1445,4800000,"valeriamarquez, viral_video, fvypシviral, paratiiiiiiiiiiiiiiiiiiiiiiiiiiiiiii, fvvpppppppppp, falso, viral, triste, tik_tok",i was only temporary,2025-05-17 13:49:02,https://www.tiktok.com/@clik.daniel/video/7505411264252824837
7506260154988383530,kyanevergoesoutside,the dior lip oil is so scary and pricey 😔 #dior #diorlipoil #makeup #trending #grwm #foryou #relatable #beauty #skincare #fyp #makeup ,237500,511,2189,1700000,"dior, diorlipoil, makeup, trending, grwm, foryou, relatable, beauty, skincare, fyp",original sound,2025-05-19 20:43:47,https://www.tiktok.com/@kyanevergoesoutside/video/7506260154988383530
7507093698253950238,ileaveuonread,"i have natural wavy hair (not sure which pattern 😭) since i’ve bleached it, i wanna revive my hair but not sure what products to use n such",48600,530,241,607700,,pyramids instrumental,2025-05-22 02:37:54,https://www.tiktok.com/@ileaveuonread/video/7507093698253950238
7507392725763820830,ollie.jimenez,Last lift as a sophmore #315 ,19900,111,408,207100,315,original sound,2025-05-22 21:58:11,https://www.tiktok.com/@ollie.jimenez/video/7507392725763820830
7507416250394447147,pepinosthrift,The baldbandit tried cooking me😂😂bros too slow #y2k #grunge #skate #skulls #tapout #mmaelite #depop #depopseller #depophaul #vintageclothes #raybansmeta #metaglasses #raybans  #tiktokindia #baggyjeans #baggypants #jessepinkman #jessepinkmanedit #fyp #funny #pov #depopseller #dayinlife #goodwillfinds #goodwillbins #vintage #reseller #goodwillbins #goodwillbinsfinds ,100200,397,5572,572200,"y2k, grunge, skate, skulls, tapout, mmaelite, depop, depopseller, depophaul, vintageclothes, raybansmeta, metaglasses, raybans, tiktokindia, baggyjeans, baggypants, jessepinkman, jessepinkmanedit, fyp, funny, pov, dayinlife, goodwillfinds, goodwillbins, vintage, reseller, goodwillbinsfinds",original sound,2025-05-22 23:29:32,https://www.tiktok.com/@pepinosthrift/video/7507416250394447147
7507010463708777771,gigiifiji,I knew better 😭 they can’t take nothing serious ,277000,777,58400,1100000,,original sound,2025-05-21 21:14:50,https://www.tiktok.com/@gigiifiji/video/7507010463708777771
7507035087465221406,tylerstevenson._,#collegelife #college #frat ,122400,145,8003,661800,"collegelife, college, frat",original sound,2025-05-21 22:50:24,https://www.tiktok.com/@tylerstevenson._/video/7507035087465221406
7507346892045454635,chompyscastle,#stitch with @chompyscastle the top comment?! OMG you guys #bigandscary #chompy ,103400,1400,6050,561200,"stitch, bigandscary, chompy",original sound,2025-05-22 19:00:22,https://www.tiktok.com/@chompyscastle/video/7507346892045454635
7506279659974249771,khisaidtostepup,#wockst★rz🦇 #foryourpage #trending ,155000,1282,11600,799900,"wockst★rz🦇, foryourpage, trending",stay,2025-05-19 21:59:30,https://www.tiktok.com/@khisaidtostepup/video/7506279659974249771
7498688351923342614,alex_jesse1,The Secret Technique to Make a Watermelon Red!,116400,486,17400,4400000,,original sound,2025-04-29 11:00:40,https://www.tiktok.com/@alex_jesse1/video/7498688351923342614
7507785593783455019,houseofhighlights,🥹. #nba #bball #basketball #hoops #knicks ,35900,190,623,711400,"nba, bball, basketball, hoops, knicks",original sound,2025-05-23 23:23:10,https://www.tiktok.com/@houseofhighlights/video/7507785593783455019
7505902657261882632,nz.cheap.cars,When your boss says pay reviews are based on performance 👀,324000,5725,41800,2300000,,original sound,2025-05-18 21:36:14,https://www.tiktok.com/@nz.cheap.cars/video/7505902657261882632
7501485929643773214,juandchan,I apologize profusely!!!! #juandchan ,494200,2059,3344,7900000,juandchan,original sound,2025-05-06 23:56:49,https://www.tiktok.com/@juandchan/video/7501485929643773214
7507220451513486622,freakymarko,Lady in the middle make it so much better ☺️ #ronisley #kandyisley #fyp #karaoke #singing #ron #isleybrothers #parents #dance #friends #chicago #legend #mariahcarey #beyonce #jayz #movie ,67800,529,4569,769900,"ronisley, kandyisley, fyp, karaoke, singing, ron, isleybrothers, parents, dance, friends, chicago, legend, mariahcarey, beyonce, jayz, movie",Busted,2025-05-22 10:49:48,https://www.tiktok.com/@freakymarko/video/7507220451513486622
7507831959951805752,soyloruga38,Happy 20 birthday to me🥳❤️#parati #cumpleaños #viral ,58600,223,387,877900,"parati, cumpleaños, viral",sonido original,2025-05-24 02:22:32,https://www.tiktok.com/@soyloruga38/video/7507831959951805752
7505005850877086984,duniaikanindonesia,limited edition slekbew #akuarium #akuariumikan #akuariumsetlengkap #aquarium #aquariumfish #ikan #ikanhias #ikanunik #fyp #sumbing ,1300000,6332,462400,12800000,"akuarium, akuariumikan, akuariumsetlengkap, aquarium, aquariumfish, ikan, ikanhias, ikanunik, fyp, sumbing",suara asli - KangSelebew1,2025-05-16 11:35:46,https://www.tiktok.com/@duniaikanindonesia/video/7505005850877086984
7506985883057311032,faceless_65,,1600000,3619,2600000,13000000,,som original,2025-05-21 19:39:20,https://www.tiktok.com/@faceless_65/video/7506985883057311032
7498056280557374763,gabbyranda,I know she was probably mad about her window but baby I can never just see somebody who seems to be unconscious and not do nothing 😭😭😭😭 to whoever this women is im sorry boo I couldn’t wake you up 😫😫😫😫 #chicago #overeast ,94700,2967,2239,1100000,"chicago, overeast",original sound,2025-04-27 18:08:17,https://www.tiktok.com/@gabbyranda/video/7498056280557374763
7506994007772384543,thecolelife,Now all denominations will know my secret … this was COGIC 😂 #couplestiktok #christian #christiantiktok ,71600,598,1819,407800,"couplestiktok, christian, christiantiktok",original sound,2025-05-21 20:11:03,https://www.tiktok.com/@thecolelife/video/7506994007772384543
7506239654165974318,user55553676,yes please #fyp #xyzbca #fy #relateable ,66900,622,5561,331800,"fyp, xyzbca, fy, relateable",original sound,2025-05-19 19:24:24,https://www.tiktok.com/@user55553676/video/7506239654165974318
7507407823370767646,kelleylorraine_,I think he resonated with part of that😂,109500,582,8770,1600000,,original sound,2025-05-22 22:56:45,https://www.tiktok.com/@kelleylorraine_/video/7507407823370767646
7507467735643802911,jermaine2smoove,😂😂😂#fyp #viral #basketball #hooper #drake #slam ,50000,369,1094,299500,"fyp, viral, basketball, hooper, drake, slam",Lose You,2025-05-23 02:49:18,https://www.tiktok.com/@jermaine2smoove/video/7507467735643802911
7505188362370829575,jordananthonnypoole,#jordanpoole #smile #fyp ,244400,765,8561,1700000,"jordanpoole, smile, fyp",original sound,2025-05-16 23:24:04,https://www.tiktok.com/@jordananthonnypoole/video/7505188362370829575
7507404564555959583,sophrodriguez.s,yesss,45000,79,615,315600,,original sound,2025-05-22 22:44:07,https://www.tiktok.com/@sophrodriguez.s/video/7507404564555959583
7506717930650930488,xplainedalgebra,You can’t solve this #math #mathematics #algebra #mathtok #harvard ,48900,2146,1176,1200000,"math, mathematics, algebra, mathtok, harvard",som original - FG MUSIC,2025-05-21 02:19:34,https://www.tiktok.com/@xplainedalgebra/video/7506717930650930488
7508050290822663454,geckbro,"Rules: you have one minute to get the frog to jump. The frog must start completely on the pad. You cannot touch the frog once it leaves the pad. The distance is measured from the pad to the third leap, longest distance wins. Also, If you beat the world record you earn $20k #frog #frogjump",53600,241,3399,1500000,"frog, frogjump",original sound,2025-05-24 16:29:59,https://www.tiktok.com/@geckbro/video/7508050290822663454
7501317360607956255,skate_or_die24,I love him and his hardworking butt 🥰 #bluecollar ,88000,250,4164,1300000,bluecollar,ILBB2 (feat. GloRilla),2025-05-06 13:03:15,https://www.tiktok.com/@skate_or_die24/video/7501317360607956255
7507784180785302815,hiimgeo,Life couldn’t be better ,58600,141,776,708700,,MAKKA,2025-05-23 23:17:22,https://www.tiktok.com/@hiimgeo/video/7507784180785302815
7508061880133373226,barstoolsports,Not the coin 😭 @Lights Camera Pod (via:@kkahgss🌠) ,219600,296,5714,1900000,,original sound,2025-05-24 17:15:22,https://www.tiktok.com/@barstoolsports/video/7508061880133373226
7500946829496945966,_giannalove,he will be getting an emailed photo today 🫶🏻 #fyp #fashioncollege #metgala #relatable ,500200,641,4991,3000000,"fyp, fashioncollege, metgala, relatable",som original - ★𝙈𝙄𝙂𝙐𝙀𝙇★,2025-05-05 13:05:51,https://www.tiktok.com/@_giannalove/video/7500946829496945966
7507431752626113838,viccgotti,#streameruniversity  ,45200,547,3305,452300,streameruniversity,original sound,2025-05-23 00:30:02,https://www.tiktok.com/@viccgotti/video/7507431752626113838
7506990379951066398,evusedtolickthefloor,YOUR DIGITAL FOOTPRINT IS COOKED!!!!!,340800,3015,12600,1200000,,original sound,2025-05-21 19:56:53,https://www.tiktok.com/@evusedtolickthefloor/video/7506990379951066398
7506920960721751301,wwww......_,#якрут #ничего #потпищики ,352800,6870,51800,2100000,"якрут, ничего, потпищики",regretful,2025-05-21 15:27:24,https://www.tiktok.com/@wwww......_/video/7506920960721751301
7507297794504527150,daisydoesmyhair,"I just love a good comb out , u can see the layers real good 😍😍  #atlhairstylist #atlanta ",47400,720,3049,374000,"atlhairstylist, atlanta",I Surrender,2025-05-22 15:49:53,https://www.tiktok.com/@daisydoesmyhair/video/7507297794504527150
7506994807257025838,yourbestiemisha,But like for real I’m a girls girl and wasn’t about to let her walk around like that ,102400,2378,243,784100,,original sound,2025-05-21 20:14:08,https://www.tiktok.com/@yourbestiemisha/video/7506994807257025838
7501428433717710110,squidamii,Replying to @angel🪳 And their name is Tiny and they have a freakishly deep voice,517000,1689,11200,5300000,,original sound,2025-05-06 20:13:59,https://www.tiktok.com/@squidamii/video/7501428433717710110
7507003941285317934,brooklynrreidhead,guest bath restock✨ loooveee a good restock vid😊 #asmrsounds #asmr #restock #restockasmr #guestbathroom #restocking #satisfying #home #organizedhome #organization #aesthetic #asmrrestock #guestbath #organize ,255400,629,3682,2500000,"asmrsounds, asmr, restock, restockasmr, guestbathroom, restocking, satisfying, home, organizedhome, organization, aesthetic, asmrrestock, guestbath, organize",original sound,2025-05-21 20:49:39,https://www.tiktok.com/@brooklynrreidhead/video/7507003941285317934
7507367325260320046,crackedbybryanagain,#griffinmethod #fypシ #yapping #voicechanger ,109300,427,17800,512100,"griffinmethod, fypシ, yapping, voicechanger",Gymnopedie No.1 [Piano famous song](204824),2025-05-22 20:19:43,https://www.tiktok.com/@crackedbybryanagain/video/7507367325260320046
7507267969441991982,babypodcast554,#baby #thebigbangtheory #foryou #fypシ ,84400,210,7603,917600,"baby, thebigbangtheory, foryou, fypシ",original sound,2025-05-22 13:54:09,https://www.tiktok.com/@babypodcast554/video/7507267969441991982
7507073443284700446,katie.org,#onthisday I MISS OLD KATIE #fyp #mascara ,97500,177,1367,845400,"onthisday, fyp, mascara",original sound,2025-05-22 01:19:09,https://www.tiktok.com/@katie.org/video/7507073443284700446
7507232472665574702,theste11amarie,#fyp #foru #grwmroutine #grwm #getreadywithme #grwmforschool #makeup #skincare #funny #late #viral #blowup,301900,3472,4958,3200000,"fyp, foru, grwmroutine, grwm, getreadywithme, grwmforschool, makeup, skincare, funny, late, viral, blowup",original sound,2025-05-22 11:36:24,https://www.tiktok.com/@theste11amarie/video/7507232472665574702
7499913381453827374,dreskii03_,Aint no way she aint see her😭☠️,141800,501,19500,652300,,original sound,2025-05-02 18:15:03,https://www.tiktok.com/@dreskii03_/video/7499913381453827374
7506894663966756098,bansheesia,they are so... tiny 😭😭 @The Hunger Games @Lionsgate #hungergames #hungergamesedit #booktok #booktoker #reading #book #sunriseonthereaping #sotr #haymitch #haymitchabernathy #woodyharrelson #suzannecollins #hungergamescatchingfire #hungergamestheballadofsongbirdsandsnakes #movie #actors #fyp #viral #trend #relatable #reader #bookstagram #loulou #louella #children ,95500,288,1166,970900,"hungergames, hungergamesedit, booktok, booktoker, reading, book, sunriseonthereaping, sotr, haymitch, haymitchabernathy, woodyharrelson, suzannecollins, hungergamescatchingfire, hungergamestheballadofsongbirdsandsnakes, movie, actors, fyp, viral, trend, relatable, reader, bookstagram, loulou, louella, children",Careful What You Wish For,2025-05-21 13:45:22,https://www.tiktok.com/@bansheesia/video/7506894663966756098
7507297013197851947,zzzsrollingpaper,Mary Jane - making the mundane memorable since the beginning of time 🧼 #fyp #skit #mrclean ,101800,1183,36000,1200000,"fyp, skit, mrclean",original sound,2025-05-22 15:46:52,https://www.tiktok.com/@zzzsrollingpaper/video/7507297013197851947
7507044251960610078,fartsnifferxoxo,More gazelle tigers pls #zootopia #zootopia2 #disney ,107800,589,2002,722300,"zootopia, zootopia2, disney",original sound,2025-05-21 23:25:55,https://www.tiktok.com/@fartsnifferxoxo/video/7507044251960610078
7507634095434845482,akillesnyc,#fyp #ddg #indialove #streameruniversity #kaicenat #late #professor #viral #xyzbca #fypシ @DDG @Kai Cenat @Indialove ,40500,215,56,455200,"fyp, ddg, indialove, streameruniversity, kaicenat, late, professor, viral, xyzbca, fypシ",original sound,2025-05-23 13:35:53,https://www.tiktok.com/@akillesnyc/video/7507634095434845482
7507096196771630367,mysolopov,"500,000 Likes and I will ride the drop of doom!! #pov #solo #alone #eating #rollercoaster #fyp ",336700,6547,3832,2900000,"pov, solo, alone, eating, rollercoaster, fyp",New Home,2025-05-22 02:47:39,https://www.tiktok.com/@mysolopov/video/7507096196771630367
7506358598864276767,dayq_iu,it’s okay tho it got better 😍,225600,2604,39200,1200000,,original sound,2025-05-20 03:05:22,https://www.tiktok.com/@dayq_iu/video/7506358598864276767
7507367261527641387,bxby.trappa,#414 #milwaukee #fypage ,28200,1616,6415,403100,"414, milwaukee, fypage",Pale Pale Moon Sinners Nola Bounce Mix,2025-05-22 20:19:23,https://www.tiktok.com/@bxby.trappa/video/7507367261527641387
7504411936445041966,loganscandies,Secret Menu Item?! 🍬🍬🍬,45700,307,207,1000000,,original sound,2025-05-14 21:11:19,https://www.tiktok.com/@loganscandies/video/7504411936445041966
7506541151185390865,raykage.edits,QUALITY AND CC IN BIO 🫨❤️#wednesday #wednesdaynetflix #pugsleyaddams #pugsley #wednesdayaddams #netflix #netflixseries #movie #edit ,789000,4808,18100,5100000,"wednesday, wednesdaynetflix, pugsleyaddams, pugsley, wednesdayaddams, netflix, netflixseries, movie, edit",original sound - Raykage,2025-05-20 14:54:10,https://www.tiktok.com/@raykage.edits/video/7506541151185390865
7507608242365746463,yasmineelgashi,,29200,340,1062,407200,,WTHELLY,2025-05-23 11:55:07,https://www.tiktok.com/@yasmineelgashi/video/7507608242365746463
7502078430754655531,diecastloverr,Is this real? I feel like it's AI.  tempting  #discounted #Kia #kiak5 #warranty  #fypシ #fy #fyp #AI #millionmilewarranty #unbelivable  #shortclips #carlovers #drivingby ,150900,5472,23400,4100000,"discounted, kia, kiak5, warranty, fypシ, fy, fyp, ai, millionmilewarranty, unbelivable, shortclips, carlovers, drivingby",som original - Aesthetic Beats,2025-05-08 14:16:05,https://www.tiktok.com/@diecastloverr/video/7502078430754655531
7507235098148736286,chefboiaudie,Who gave me that DON #justagirl #donjulio #saintlouis #stl ,46700,229,742,388300,"justagirl, donjulio, saintlouis, stl",Don Who Leo,2025-05-22 11:46:31,https://www.tiktok.com/@chefboiaudie/video/7507235098148736286
7505886584617667882,cantguardd5,#fyp #viral #meme #relatable ,63000,7766,6535,876000,"fyp, viral, meme, relatable",original sound,2025-05-18 20:34:06,https://www.tiktok.com/@cantguardd5/video/7505886584617667882
7506718255386463506,dilly.dallywithdaisy,Girls gotta do what a girls gotta do!,301600,8080,131700,1600000,,original sound,2025-05-21 02:20:49,https://www.tiktok.com/@dilly.dallywithdaisy/video/7506718255386463506
7501414222220234026,alecks1220,Mr. Johnson 🐐 #abbottelementary #fyp #wbtour #film #filmset #tvset #warnerbros #mrjohnson @Abbott Elementary ,362600,334,3573,2400000,"abbottelementary, fyp, wbtour, film, filmset, tvset, warnerbros, mrjohnson",original sound,2025-05-06 19:18:57,https://www.tiktok.com/@alecks1220/video/7501414222220234026
7507655035220806943,user8238382492352,,129200,353,29400,509800,,original sound,2025-05-23 14:56:29,https://www.tiktok.com/@user8238382492352/video/7507655035220806943
7507704628453117190,lucaslopezvt,Bro its a monday😭😭 #fyp #foryoupage #comedy ,108000,298,7753,1100000,"fyp, foryoupage, comedy",original sound,2025-05-23 18:08:25,https://www.tiktok.com/@lucaslopezvt/video/7507704628453117190
7505886471253937451,priprilapri0,Like PICK ONE ! #fyp ,60400,1573,11100,254600,fyp,original sound,2025-05-18 20:33:40,https://www.tiktok.com/@priprilapri0/video/7505886471253937451
7507051327508385070,imkbfool,,78900,486,10200,295500,,original sound,2025-05-21 23:53:24,https://www.tiktok.com/@imkbfool/video/7507051327508385070
7507023404982095135,charmasona,This is just a rough draft lol #maidofhonor #wedding @Instagram| @etinosajogbevoen ✨,211300,743,69300,1100000,"maidofhonor, wedding",original sound,2025-05-21 22:05:02,https://www.tiktok.com/@charmasona/video/7507023404982095135
7507997197993020703,wcontentclip,No way Ashton Hall just CALLED OUT Aaron the Plumber to a FIGHT on Adin Ross’ BOXING event 👀😳🥊 | #adinross #ashtonhall #aarontheplumber #boxing ,39200,135,1591,476600,"adinross, ashtonhall, aarontheplumber, boxing",M83 Solitude,2025-05-24 13:04:18,https://www.tiktok.com/@wcontentclip/video/7507997197993020703
7503599618660273431,teacherkingg,Plants be like... #handwriting #satisfyingvideo #deepquotes #motivation #selfimprovement ,64500,480,15200,880300,"handwriting, satisfyingvideo, deepquotes, motivation, selfimprovement",original sound,2025-05-12 16:38:52,https://www.tiktok.com/@teacherkingg/video/7503599618660273431
7506521428234079493,andjilisha,как вам образ?))),517400,1102,6657,3300000,,Stray.wav,2025-05-20 13:37:01,https://www.tiktok.com/@andjilisha/video/7506521428234079493
7504659727431879967,g20.sam,This is not tough 🥀🥀🥀🥀#truck #truckhate #modded#trucklife #fordmaverick ,59600,1948,3190,499000,"truck, truckhate, modded, trucklife, FordMaverick",jshxwty,2025-05-15 13:12:49,https://www.tiktok.com/@g20.sam/video/7504659727431879967
7507503958189968670,cocolocodewestvirginia,#foamparty2,14100,261,3047,1100000,foamparty2,sonido original,2025-05-23 05:10:16,https://www.tiktok.com/@cocolocodewestvirginia/video/7507503958189968670
7507173688739958047,fwlawn,,323200,515,5539,1000000,,Never be like you,2025-05-22 07:49:05,https://www.tiktok.com/@fwlawn/video/7507173688739958047
7507176911509015815,lasmigaresforvr,@Fer😋 @Alaan ,1100000,731,4592,7200000,,sonido original,2025-05-22 08:00:37,https://www.tiktok.com/@lasmigaresforvr/video/7507176911509015815
7501453618835606830,harry.daniels,AHHHHHHHHH THE END OF THE WORLD SINGER #mileycyrus #hannahmontana @Miley Cyrus @Spotify ,1800000,4926,37200,10800000,"mileycyrus, hannahmontana",original sound,2025-05-06 21:51:30,https://www.tiktok.com/@harry.daniels/video/7501453618835606830
7503539272134200593,pointerpatrol,did he get what he deserved? #shorts #carmemes #fyp #funny #pointer #fypage #crash #carcrash ,36500,432,3258,1800000,"shorts, carmemes, fyp, funny, pointer, fypage, crash, carcrash",original sound,2025-05-12 12:44:46,https://www.tiktok.com/@pointerpatrol/video/7503539272134200593
7506903880991624479,iluv_boba_,#colorgame #lastdayofschool #fyp #school #smart,33400,395,3161,531100,"colorgame, lastdayofschool, fyp, school, smart",Running Off,2025-05-21 14:21:17,https://www.tiktok.com/@iluv_boba_/video/7506903880991624479
7505058061397167367,like.meli,Чеэто ,186200,1723,1287,2400000,,original sound,2025-05-16 14:58:21,https://www.tiktok.com/@like.meli/video/7505058061397167367
7507428319080484127,krystianatiana,Let the summer fun begin ☀️ #moms #momlife #pregnant #pregnancy #family ,238200,525,1105,3000000,"moms, momlife, pregnant, pregnancy, family",original sound,2025-05-23 00:16:22,https://www.tiktok.com/@krystianatiana/video/7507428319080484127
7498147605818412319,lovefornenee,just angry & racist LMAOOOO #fyp #fypシ #racism #racist #racialprofiling #fy #fypシ゚viral ,65100,1921,1101,338100,"fyp, fypシ, racism, racist, racialprofiling, fy, fypシ゚viral",original sound,2025-04-28 00:02:39,https://www.tiktok.com/@lovefornenee/video/7498147605818412319
7506121331356863774,iamicenugget,#jollyrancher #jollyrancherrankings #fy #fyp #4u #viral,40100,4388,869,888400,"jollyrancher, jollyrancherrankings, fy, fyp, 4u, viral",I Wish (I wish I was a little bit taller),2025-05-19 11:45:06,https://www.tiktok.com/@iamicenugget/video/7506121331356863774
7501417877937933574,sami28733,#vira #paratiiiiiiiiiiiiiiiiiiiiiiiiiiiiiii @Stiven ,768500,23700,31400,20200000,"vira, paratiiiiiiiiiiiiiiiiiiiiiiiiiiiiiii",sonido original,2025-05-06 19:32:40,https://www.tiktok.com/@sami28733/video/7501417877937933574
7507346856901578030,tlctv,At least she's honest LOL #Polyfamily,26300,73,71,384100,polyfamily,original sound - tlc,2025-05-22 19:00:17,https://www.tiktok.com/@tlctv/video/7507346856901578030
7507246529950895367,medlci13,доживаем в телеге: Записки юного Вовчика #медицинский #студентмедик ,164300,906,72400,1300000,"медицинский, студентмедик",оригинальный звук,2025-05-22 12:30:45,https://www.tiktok.com/@medlci13/video/7507246529950895367
7507716639991794949,larosadeguadalupe.of,En #LaRosa 🌹Dayana se niega a tener a su bebé ❌👶🏻    Las envolturas no importan  Pt. 2  #Originales #LaRosaDeGuadalupe #Drama  #Televisa,668400,4575,6642,10500000,"larosa, originales, larosadeguadalupe, drama, televisa",sonido original - La Rosa de Guadalupe,2025-05-24 00:30:00,https://www.tiktok.com/@larosadeguadalupe.of/video/7507716639991794949
7507779852766858542,burntoutteachers,Bunker’s Allergic Part 2 #bunker #imabunker #dontbeabunker #mrsbunker #burntoutteachers #teacher #teachers #teachersoftiktok #teachersontiktok #teacherlife #teachersbelike #teacherprob #teacherprobs #tiredteacher #teachertired #teacherfunny #teachertok ,58400,345,108,428900,"bunker, imabunker, dontbeabunker, mrsbunker, burntoutteachers, teacher, teachers, teachersoftiktok, teachersontiktok, teacherlife, teachersbelike, teacherprob, teacherprobs, tiredteacher, teachertired, teacherfunny, teachertok",original sound,2025-05-23 23:00:42,https://www.tiktok.com/@burntoutteachers/video/7507779852766858542
7507439701360446762,artnyethescienceguy,had to pull out the old school method 😂. Bet they won’t curse no more. #teachersoftiktok #fy #teachertok ,433000,1110,7115,2700000,"teachersoftiktok, fy, teachertok",original sound,2025-05-23 01:00:55,https://www.tiktok.com/@artnyethescienceguy/video/7507439701360446762
7507336972441095426,streamclipper1612,#marlon #mar3lg #fyp ,110900,975,6353,1000000,"marlon, mar3lg, fyp",Where You Are (Vocals and Daf),2025-05-22 18:21:42,https://www.tiktok.com/@streamclipper1612/video/7507336972441095426
