video_id,author,description,likes,comments,shares,plays,hashtags,music,create_time,video_url
7507366946816544030,vierraqueen,"Yall asked so I delivered !!! 😭😭😭 Part 2 of the funniest intros at Morehouse College’s 2025 commencement.  a big shoutout to these young men, and the “Everlive” class of 2025 !!  #fyp #hbcu #spelman #morehouse #classof2025 #morehousecollege #commencement #everlive2025 #spelman25 #graduation ",158500,1890,10500,796400,"fyp, hbcu, spelman, morehouse, classof2025, morehousecollege, commencement, everlive2025, spelman25, graduation",original sound,2025-05-22 20:18:12,https://www.tiktok.com/@vierraqueen/video/7507366946816544030
7508126180067921182,itscitygirljiya,Love my transitions #itscitygirljiya ,379900,1299,4331,2200000,itscitygirljiya,original sound,2025-05-24 21:24:28,https://www.tiktok.com/@itscitygirljiya/video/7508126180067921182
7507372376674290951,queen_moon_,😈 #реки ,81300,200,4959,603400,реки,оригинальный звук,2025-05-22 20:39:07,https://www.tiktok.com/@queen_moon_/video/7507372376674290951
7507488759928229166,barstoolsports,The replay 🤣 @I Can’t Even (via:@Evalyn) ,265500,2313,114400,1900000,,original sound,2025-05-23 04:11:36,https://www.tiktok.com/@barstoolsports/video/7507488759928229166
7507081916181384478,kelseytrue08,I thought he was a German Shepard but now I’m not so sure 😆 #husband #marriagehumor #dogbreed @The Critter Getter ,26300,4530,600,338400,"husband, marriagehumor, dogbreed",ACDC Beegees mashup,2025-05-22 01:52:10,https://www.tiktok.com/@kelseytrue08/video/7507081916181384478
7507498579519491374,lexie..xoxxo,Insane how similar they are… #unicorn #starbucks #2015 #2025 #charlixcx #lorde #old #nostalgia ,244300,426,14300,916700,"unicorn, starbucks, 2015, 2025, charlixcx, lorde, old, nostalgia",Lean On,2025-05-23 04:49:32,https://www.tiktok.com/@lexie..xoxxo/video/7507498579519491374
7501425393036004650,7qawz,This was so crazy to me 😭 #derealization #delusion #coryxkenshin ,903200,1784,10500,7000000,"derealization, delusion, coryxkenshin",original sound,2025-05-06 20:02:23,https://www.tiktok.com/@7qawz/video/7501425393036004650
7507396590949190942,gangsta_gramps,Year #2011 #fyp #restaurant #manager #foodie #chef #serverlife #bartender ,68500,3958,969,733200,"2011, fyp, restaurant, manager, foodie, chef, serverlife, bartender",оригинальный звук,2025-05-22 22:13:14,https://www.tiktok.com/@gangsta_gramps/video/7507396590949190942
7507246334936763670,minibigl_,my ichigo is sleepy  #cosplay #rukia #bleach #ichigo ,134300,453,8325,767000,"cosplay, rukia, bleach, ichigo",เสียงต้นฉบับ - Am,2025-05-22 12:30:03,https://www.tiktok.com/@minibigl_/video/7507246334936763670
7507237468786281750,europeguy8,4 vs 50 milly 😏 #iceberg #foryou #icebergpie #snozoetok #foryou #europeguy #lippillow #upperdecky ,27300,105,1379,346400,"iceberg, foryou, icebergpie, snozoetok, europeguy, lippillow, upperdecky",LUNA BALA (Slowed),2025-05-22 11:55:37,https://www.tiktok.com/@europeguy8/video/7507237468786281750
7507747980967955743,dustycls,Bro was tripping😭 #cls #cls550 #cls63 #mercedes #mercedesbenz #amg ,65500,142,177,632100,"cls, cls550, cls63, mercedes, mercedesbenz, amg",original sound,2025-05-23 20:56:49,https://www.tiktok.com/@dustycls/video/7507747980967955743
7507274467228257578,eli_tea11,Praying that we don’t have the same luck as last year #sueños #sueños2025 #chicago ,28000,263,3395,287900,"sueños, sueños2025, chicago",sad SpongeBob music,2025-05-22 14:19:19,https://www.tiktok.com/@eli_tea11/video/7507274467228257578
7507659450543574294,odeeclipn,India Love had her whole class full 😳 #indialove #fyp #viral #streameruniversity ,30700,40,88,495400,"indialove, fyp, viral, streameruniversity",Get Streched,2025-05-23 15:13:07,https://www.tiktok.com/@odeeclipn/video/7507659450543574294
7507786492983512350,sleepynfn,#fyp #famous #viral ,62900,7795,12200,1800000,"fyp, famous, viral",Traffic Lil Reese x Chief Keef Mixx,2025-05-23 23:26:25,https://www.tiktok.com/@sleepynfn/video/7507786492983512350
7507718967323135278,ohheyitsbunnie,Just appreciating how hot our girl is 😍 #asktellconfess #ellalangley ,84500,893,1393,1100000,"asktellconfess, ellalangley",original sound,2025-05-23 19:04:35,https://www.tiktok.com/@ohheyitsbunnie/video/7507718967323135278
7507106363156303126,leximaespams,my baby #fyp #foryou #foryoupage ,287600,1139,78700,1300000,"fyp, foryou, foryoupage",original sound,2025-05-22 03:27:32,https://www.tiktok.com/@leximaespams/video/7507106363156303126
7507353427983224071,sam.shan.shops,Snack Pack Restock 🍪🥑🧀 how fun are these containers!? #snackpack #lunchideas #snackideas #amazonfinds #amazonfavorites2025 #amazonfinds2025 #amazonmusthaves #amazonkitchenfinds #mealprepcontainers #snackcontainer #snackpacks #asmrrestock #restockingvideo ,73400,342,3402,1400000,"snackpack, lunchideas, snackideas, amazonfinds, amazonfavorites2025, amazonfinds2025, amazonmusthaves, amazonkitchenfinds, mealprepcontainers, snackcontainer, snackpacks, asmrrestock, restockingvideo",sweet nothing sped up,2025-05-22 19:25:36,https://www.tiktok.com/@sam.shan.shops/video/7507353427983224071
7507630741086407982,thehappinessacademy2.0,I think all husbands become our waterboys like it’s a right of passage.🥰😂 #fyp #foryoupage #adhd #ptsd #cptsd #marriage #couplesoftiktok #relationshipgoals #greenflags #housewife #mentalhealthmatters #anxiety #healing ,38500,292,1446,461300,"fyp, foryoupage, adhd, ptsd, cptsd, marriage, couplesoftiktok, relationshipgoals, greenflags, housewife, mentalhealthmatters, anxiety, healing",McKenzie Sound,2025-05-23 13:22:43,https://www.tiktok.com/@thehappinessacademy2.0/video/7507630741086407982
7507289866997353774,ggthemobilebarber,This young man came in for a cut and this was the result. Located on the corner of bluesprings and Winchester at Swaggerz Signature Cuts. Come see me or any of the other talented barbers/stylist/loctitians today! Walk-ins are more than welcomed. From the hours of 9am to 6pm 7 days a week!  #getgood  #goforgreatness  #GainGod  #transformation  #fypageシ  #barbershop  #barberlife  #feelgood  #dogood #barber  #SwaggersSignatureCuts #GGtheMobileBarber,73200,1012,9545,705400,"getgood, goforgreatness, gaingod, transformation, fypageシ, barbershop, barberlife, feelgood, dogood, barber, swaggerssignaturecuts, ggthemobilebarber",original sound,2025-05-22 15:19:08,https://www.tiktok.com/@ggthemobilebarber/video/7507289866997353774
7507623681582009642,user90043879481880,"Jubalinthemorningradioprogram"" BrookeandJubal""#trending#fyp#fyp シ #dateupdate#brookeandjubal#phon ecall",29400,1909,28700,1600000,"trending, fyp, dateupdate, brookeandjubal, phon",original sound,2025-05-23 12:55:23,https://www.tiktok.com/@user90043879481880/video/7507623681582009642
7507562919056428334,millerfamilyx6,"All jokes aside, we love Hims tiny ear!  #babies #cute #trend #funny #cutebabies #babyfever #babytok #pregnancy #microtia #hearingloss #babiesoftiktok #mama #fyp #foryoupage ",77600,490,18100,1500000,"babies, cute, trend, funny, cutebabies, babyfever, babytok, pregnancy, microtia, hearingloss, babiesoftiktok, mama, fyp, foryoupage",ECE Marketing Airball,2025-05-23 09:00:54,https://www.tiktok.com/@millerfamilyx6/video/7507562919056428334
7501758883736603926,rebekaviz,#roundface #chubbycheeks #roundfaceproblems ,1200000,5220,35800,10200000,"roundface, chubbycheeks, roundfaceproblems",Hahahaha again,2025-05-07 17:35:53,https://www.tiktok.com/@rebekaviz/video/7501758883736603926
7507633024020778282,funwithcairo,The Article bed was light work 😩😂 #asdmom #toddlersoftiktok #autismawareness #autism ,30500,155,289,309100,"asdmom, toddlersoftiktok, autismawareness, autism",i get it i get it,2025-05-23 13:31:40,https://www.tiktok.com/@funwithcairo/video/7507633024020778282
7507366093221072174,jennaclawson,@bryleej22 #fyp #graduation #viral #sound #transition ,149300,155,3234,1000000,"fyp, graduation, viral, sound, transition",original sound,2025-05-22 20:14:51,https://www.tiktok.com/@jennaclawson/video/7507366093221072174
7507370284928945454,kiley.17,Elf halo glow lip gloss #elfhaloglow #elf#aquaphor #benetint #trending #elflipgloss@e.l.f. Cosmetics @AquaphorUS@Benefit Cosmetics ,264300,618,5178,2100000,"elfhaloglow, elf, aquaphor, benetint, trending, elflipgloss",original sound - manda,2025-05-22 20:31:13,https://www.tiktok.com/@kiley.17/video/7507370284928945454
7501492067470757150,readlikeagoddess,Plotting the sequel rn #trend #trending #fyp #foryou #viral @maiawasheretoday ,399400,791,13700,3800000,"trend, trending, fyp, foryou, viral",original sound,2025-05-07 00:20:36,https://www.tiktok.com/@readlikeagoddess/video/7501492067470757150
7506975585688784174,whyk4re,Panjabi MC Cooked On This One 😮‍💨🔥 #punjabi #fypシ゚viral #singing ,627800,5824,222700,5200000,"punjabi, fypシ゚viral, singing",original sound,2025-05-21 18:59:33,https://www.tiktok.com/@whyk4re/video/7506975585688784174
7507108216187194654,l1lly._.562,#Ghostrider #knottsberryfarm #fyp ,69200,164,6341,368200,"ghostrider, knottsberryfarm, fyp",sonido original,2025-05-22 03:34:15,https://www.tiktok.com/@l1lly._.562/video/7507108216187194654
7507453710071745838,111pais,#fyp #fyppppppppppppppppppppppp #fypシ #lastyear #2024 #alert ,245500,1250,12500,922100,"fyp, fyppppppppppppppppppppppp, fypシ, lastyear, 2024, alert",original sound,2025-05-23 01:55:08,https://www.tiktok.com/@111pais/video/7507453710071745838
7507677294408764715,rita_sehmi,The feeling we get when we are on set together #DharMann #DharMannFam #actors #trend #fyp @Bhaavika @Amogh ,84000,1118,7480,1400000,"dharmann, dharmannfam, actors, trend, fyp",original sound,2025-05-23 16:23:00,https://www.tiktok.com/@rita_sehmi/video/7507677294408764715
7505139803030097182,minnygraphs99,Buddy was not a fan of me I guess… #buddyhield #goldenstatewarriors #nba #autographs #minnygraphs #sportscards ,93000,394,842,889100,"buddyhield, goldenstatewarriors, nba, autographs, minnygraphs, sportscards",original sound,2025-05-16 20:15:43,https://www.tiktok.com/@minnygraphs99/video/7505139803030097182
7507433676456693034,serenityalyyssa,Parenting skills from REN thank me later #serenityalyyssa EDIT: idc abt yal soft a$$es in my comments SYBAU and this is not my son yal😂,87100,1116,8074,279800,serenityalyyssa,original sound,2025-05-23 00:37:32,https://www.tiktok.com/@serenityalyyssa/video/7507433676456693034
7503699103960943877,theonlyviolett2,BRO #FYP,193000,853,3759,1400000,fyp,original sound,2025-05-12 23:05:01,https://www.tiktok.com/@theonlyviolett2/video/7503699103960943877
7507636319099555092,connoralik,"Проверил, как вам? #коннор #обзорпокупочек ",37100,424,580,1200000,"коннор, обзорпокупочек",оригинальный звук,2025-05-23 13:43:25,https://www.tiktok.com/@connoralik/video/7507636319099555092
7506956283111755038,venicewong4u,Oh! @harrisonwongg #fypシ #foryoupage #relatable #siblings #real #fypシ゚viral ,33000,196,873,318300,"fypシ, foryoupage, relatable, siblings, real, fypシ゚viral",Use this audio if you are fat,2025-05-21 17:44:36,https://www.tiktok.com/@venicewong4u/video/7506956283111755038
7507297121700171026,marwow,#help #viral #foryou #real #foruyou #relatable ,146400,271,1049,831400,"help, viral, foryou, real, foruyou, relatable",original sound,2025-05-22 15:47:03,https://www.tiktok.com/@marwow/video/7507297121700171026
7507424107437346079,user37151245845158,#acne #skincare #relatable #skinproblems #fyp ,256500,456,7023,1100000,"acne, skincare, relatable, skinproblems, fyp",original sound,2025-05-23 00:00:09,https://www.tiktok.com/@user37151245845158/video/7507424107437346079
7507865724136721686,vrcetti,Kai knew something was up when he seen India Love with Duke #dukedennis #indialove #kaicenat #streameruniversity ,53000,137,581,712400,"dukedennis, indialove, kaicenat, streameruniversity",want u - slowed + reverb,2025-05-24 04:33:52,https://www.tiktok.com/@vrcetti/video/7507865724136721686
7506159202239352094,carterr.fit,how much weight do you think i lost? DM me ‘COACH’ on instagram for 1:1 coaching #gym #fitness #motivation ,439600,1102,6095,4800000,"gym, fitness, motivation",Aint It Fun by Paramore,2025-05-19 14:11:50,https://www.tiktok.com/@carterr.fit/video/7506159202239352094
7507268428001086766,dawangraoming3,#fyp #foryou #tiktok #movie #911,32800,89,195,607600,,original sound - dawangraoming,2025-05-22 13:55:54,https://www.tiktok.com/@dawangraoming3/video/7507268428001086766
7501012356734962987,318darrius,i got hit at the end 🥲😂 #fyp #band #z ,156500,764,49000,1200000,"fyp, band, z",Dance (A$$) Remix,2025-05-05 17:19:54,https://www.tiktok.com/@318darrius/video/7501012356734962987
7507724738358267166,el.hombrecito,@Julión Álvarez no tienes permiso a subir mi esposa arriba contigo!! ,135400,1198,614,1800000,,original sound,2025-05-23 19:26:53,https://www.tiktok.com/@el.hombrecito/video/7507724738358267166
7505662707639602463,denemclips,Jamal goes off on lil Tay😂 #liltay #jamal @LIL TAY,55000,675,1778,783200,"liltay, jamal",I Can Do Anything / Finale,2025-05-18 06:05:11,https://www.tiktok.com/@denemclips/video/7505662707639602463
7507426622300278062,emmaleemeow,@Aida❤️ @Josie😈 @bella 👩‍🏫🐈 @hannah ,60200,5,12100,322400,,original sound,2025-05-23 00:10:21,https://www.tiktok.com/@emmaleemeow/video/7507426622300278062
7507472937734147358,colbylonganacre_,<3 #fyp #fyppppppppp #loveyou ,325900,1545,91400,1400000,"fyp, fyppppppppp, loveyou",i always seem to miss her,2025-05-23 03:09:31,https://www.tiktok.com/@colbylonganacre_/video/7507472937734147358
7505218434414710023,nicolayetski,un talento,178300,753,12600,3400000,,original sound,2025-05-17 01:20:47,https://www.tiktok.com/@nicolayetski/video/7505218434414710023
7496945331175836958,sombrfans,yk what hell yeah @sombr #sombr #backtofriends ,773200,915,20900,4700000,"sombr, backtofriends",back to friends,2025-04-24 18:17:05,https://www.tiktok.com/@sombrfans/video/7496945331175836958
7507560188333837574,qkeewinxx,#любовь #парочка #люблюАню ,140700,1846,79100,1900000,"любовь, парочка, люблюаню",оригинальный звук,2025-05-23 08:47:59,https://www.tiktok.com/@qkeewinxx/video/7507560188333837574
7499925586748673326,mariomirante,Ya maybe think again @brynne ,244700,495,5428,1400000,,original sound,2025-05-02 19:02:42,https://www.tiktok.com/@mariomirante/video/7499925586748673326
7507780884599246111,allrecipes,"Nicole's feeding us pasta and lobster! 🦞🍝 Only twenty bucks, but tastes like a million! This Trader Joe's Lobster Pasta will be on REPEAT in the kitchen. Continue reading or click the 🔗 in our bio for the full details on the recipe.  Idea Credit: @Vinny  🧑‍🍳: @NicoleMcLaughlin  #traderjoes #lobster #pasta #traderjoesrecipes #seafood #pasta #easydinners #budgetfriendlymeals #summerdinners #dinner",91700,678,44100,2500000,"traderjoes, lobster, pasta, traderjoesrecipes, seafood, easydinners, budgetfriendlymeals, summerdinners, dinner",Fall Colors,2025-05-23 23:04:36,https://www.tiktok.com/@allrecipes/video/7507780884599246111
7506586671543078190,sarahebaus,Hell yeah @I Prevail #ihopetheyplay #iprevail #taylorswift ,65900,401,7087,844500,"ihopetheyplay, iprevail, taylorswift",original sound,2025-05-20 17:50:46,https://www.tiktok.com/@sarahebaus/video/7506586671543078190
7507786486088256814,notkchaze,,46700,637,12500,595000,,original sound,2025-05-23 23:26:39,https://www.tiktok.com/@notkchaze/video/7507786486088256814
7507412197870505258,kylie.kelsey8,U can’t convince me otherwise #stopandwait #prettyprivilege #cringe #fyp ,167700,216,266,1000000,"stopandwait, prettyprivilege, cringe, fyp",original sound,2025-05-22 23:13:51,https://www.tiktok.com/@kylie.kelsey8/video/7507412197870505258
7507720436071795990,jamiee.innit,Website: icystar.ru | code Jamie #fyp #relatable #jokes ,413700,963,96200,2800000,"fyp, relatable, jokes",UPTOWN,2025-05-23 19:09:44,https://www.tiktok.com/@jamiee.innit/video/7507720436071795990
7505541438399089966,cr5we,guys im about to be insufferable #promdress #prom2025 #cr5we #fyp ,119600,1108,761,497200,"promdress, prom2025, cr5we, fyp",prom dress,2025-05-17 22:14:36,https://www.tiktok.com/@cr5we/video/7505541438399089966
7506989832694943006,mei_meis,No fr im just trying to help you 😭 . . . #pandaexpress #foodserviceproblems #foodserviceworkers #fyp #customerservice #workhumor ,38700,219,924,220600,"pandaexpress, foodserviceproblems, foodserviceworkers, fyp, customerservice, workhumor",original sound,2025-05-21 19:54:43,https://www.tiktok.com/@mei_meis/video/7506989832694943006
7504409026201980203,wes_tide,One last time before I leave this school,46000,166,17900,324400,,original sound,2025-05-14 20:59:59,https://www.tiktok.com/@wes_tide/video/7504409026201980203
7507439885096176942,leorealtoks,,130100,1456,5652,746800,,original sound,2025-05-23 01:01:39,https://www.tiktok.com/@leorealtoks/video/7507439885096176942
7507703070063824130,naarjesse,iykyk,167600,314,1636,1000000,,original sound,2025-05-23 18:02:22,https://www.tiktok.com/@naarjesse/video/7507703070063824130
7508075246079986986,sailing_with_phoenix,,236900,5599,2978,2100000,,Freedom,2025-05-24 18:07:06,https://www.tiktok.com/@sailing_with_phoenix/video/7508075246079986986
7507423661691915551,adrianpastor502,Carropatrulla Guatemala.. #parati #guatemala #fypage #502 #chapinesenusa🇬🇹💙🇺🇸  #unitedstates ,15900,473,2787,932100,"parati, guatemala, fypage, 502, chapinesenusa🇬🇹💙🇺🇸, unitedstates",Bad Boys (Theme from Cops),2025-05-22 23:58:24,https://www.tiktok.com/@adrianpastor502/video/7507423661691915551
7507339344160492843,gqsports,Are you with athletes or the rappers when it comes to jewelry #nba #nbaplayoffs #minnesota #timberwolves #anthonyedwards ,51300,89,266,363400,"nba, nbaplayoffs, minnesota, timberwolves, anthonyedwards",original sound,2025-05-22 18:31:02,https://www.tiktok.com/@gqsports/video/7507339344160492843
7507768745884929311,tasiaalexis,I know yall hear it 😎,67600,266,1080,360900,,New Flame (In The Style of Chris Brown) (Instrumental Version),2025-05-23 22:17:23,https://www.tiktok.com/@tasiaalexis/video/7507768745884929311
7507631111711984942,lilykateayres,#farmerwantsawife ,51000,524,566,1100000,farmerwantsawife,"I Love You, I'm Sorry",2025-05-23 13:24:00,https://www.tiktok.com/@lilykateayres/video/7507631111711984942
7507461285047569707,georgia.little,long distance got nothing on us🥳🥳🥳,87900,63,744,505100,,original sound,2025-05-23 02:24:40,https://www.tiktok.com/@georgia.little/video/7507461285047569707
7501912507020348718,barstoolsports,SHOVE DAY 🫡 @Barstool Baseball (via:@Jared Busche) ,422200,524,16200,5300000,,original sound,2025-05-08 03:32:40,https://www.tiktok.com/@barstoolsports/video/7501912507020348718
7507406515653922094,john.ross,,185600,1344,29600,715700,,It's ok I'm ok,2025-05-22 22:51:45,https://www.tiktok.com/@john.ross/video/7507406515653922094
7507430177975192863,leernicholas,Entanglement 2.0 🥴🥴 #fypシ #foryourpage #welcome2025 #thoughts #women #girl #relationship #married #wife #jokes #humor #thirstythursday #xyzcba ,21200,1236,1798,253200,"fypシ, foryourpage, welcome2025, thoughts, women, girl, relationship, married, wife, jokes, humor, thirstythursday, xyzcba",original sound,2025-05-23 00:23:39,https://www.tiktok.com/@leernicholas/video/7507430177975192863
7507575725705235758,fhyfdhs,Comment if the ref need a break #suburbbaby #skit #hood #referee #coach ,14400,41,114,516500,"suburbbaby, skit, hood, referee, coach",original sound,2025-05-23 09:50:10,https://www.tiktok.com/@fhyfdhs/video/7507575725705235758
7508013896557415723,dailymail,"A fit college student tragically died after suddenly collapsed while working out at the gym. Surveillance video showed Dayane de Jesus, 22, seated at an exercise machine Tuesday evening at the Forma Fitness gym in Rio de Janeiro, Brazil. As her fellow gym-goers worked out around her, de Jesus fell backward without warning as stunned witnesses rushed to her aid. Two men, including one later identified as a doctor, could be seen attempting to revive de Jesus before paramedics were called. The doctor reportedly requested a defibrillator, but the gym did not have one on site.  #news #brazil #gym #rip ",57700,1106,2239,976500,"news, brazil, gym, rip",snowfall,2025-05-24 14:09:27,https://www.tiktok.com/@dailymail/video/7508013896557415723
7506835493707910408,priya_mcpherson,literally though #humour #humortiktok #funny #funnyvideos ,220700,471,51500,1000000,"humour, humortiktok, funny, funnyvideos",original sound,2025-05-21 09:55:44,https://www.tiktok.com/@priya_mcpherson/video/7506835493707910408
7497746520746282271,slickpup,Asking Hawaii locals what their favorite local song is! #hawaii #islandmusic,202000,548,5247,1700000,"hawaii, islandmusic",original sound,2025-04-26 22:06:15,https://www.tiktok.com/@slickpup/video/7497746520746282271
7507003291318979845,jadynweltz,"If you know, you know #europe #portugal #lisbon #porto #travel #traveltiktok #fyp ",140200,395,28400,939800,"europe, portugal, lisbon, porto, travel, traveltiktok, fyp",gymnopédie no.1,2025-05-21 20:46:54,https://www.tiktok.com/@jadynweltz/video/7507003291318979845
7505375948552850719,iansaccount,It’s wild ngl #edcvegas ,63100,1003,4082,850600,edcvegas,original sound,2025-05-17 11:33:10,https://www.tiktok.com/@iansaccount/video/7505375948552850719
7507075565552422190,kayli_legros,"Some days it feels like I’m just getting through the hours. I do what needs done. I show up. I smile. But deep down, I know this isn’t living, this is surviving. And maybe you feel that too. God didn’t create you just to survive the week. He wants to walk with you in it. To meet you in the middle of the mess. To remind you that your heart still matters to Him. He still has more for you. More peace. More purpose. More life. #christiantok #christiantiktok #godlovesyou #fy #fyp #christianmotivation ",137600,1759,12400,2500000,"christiantok, christiantiktok, godlovesyou, fy, fyp, christianmotivation",The Mighty Rio Grande - Concept,2025-05-22 01:27:45,https://www.tiktok.com/@kayli_legros/video/7507075565552422190
7502109215524244758,saintjrmaine,Need tips asap #texturedskin #skincare ,62700,1474,610,928800,"texturedskin, skincare",original sound,2025-05-08 16:15:22,https://www.tiktok.com/@saintjrmaine/video/7502109215524244758
7507304278118223125,hazyeva1488,Ни в коем случае не катайтесь зацепом ,42600,1516,2025,748200,,оригинальный звук,2025-05-22 16:14:54,https://www.tiktok.com/@hazyeva1488/video/7507304278118223125
7507882604893392171,itsedwinceron,@🦊Esthefany r tajia🦊🦋 ,64400,2242,756,1300000,,sonido original,2025-05-24 05:39:52,https://www.tiktok.com/@itsedwinceron/video/7507882604893392171
7498338506129902870,paolo_jackson,@La mamma di Paolo #mumandson #momandson #mammaefiglio #paolojacksondance ,1100000,3478,174000,10500000,"mumandson, momandson, mammaefiglio, paolojacksondance",sonido original,2025-04-28 12:23:08,https://www.tiktok.com/@paolo_jackson/video/7498338506129902870
7501853490986143006,bobbylightss,He literally just swallowed them 😭,3400000,7795,68100,40000000,,original sound,2025-05-07 23:43:10,https://www.tiktok.com/@bobbylightss/video/7501853490986143006
7499935682496957751,fernando_villavicencio,"Rubén Sánchez, un joven estudiante de 27 años, resultó herido luego de ser arrojado desde el puente Yanbal, en el distrito de Los Olivos. El hecho ocurrió tras salir de una reunión, y según las primeras versiones, al menos siete jóvenes habrían estado involucrados en el ataque. Sánchez fue llevado de inmediato a un centro de salud en Puente Piedra, donde viene recibiendo atención médica.",78900,312,6076,561600,,sonido original,2025-05-02 19:41:01,https://www.tiktok.com/@fernando_villavicencio/video/7499935682496957751
7507714664550206763,cbsnews,"As Paul and Gail Cline laid in their bed the night of May 16, holding each other in their arms, an EF4 tornado suddenly tore their home to shreds. “When they were found, they were holding each other,” Brandy Bowman, one of the Clines’ nieces, told CBS affiliate WKYT. “And that’s why they lost opposite arms, because they were holding on to each other, and whatever impacted them impacted them at the same time.” The first time Paul was able to see his wife in the hospital after the tornado, their nieces said he immediately started reciting their wedding vows to Gail, who is on life support. “He kissed her on the forehead and she tried to open her eyes,” Bowman said. #tornado #londonky #london #kentucky #weather ",241600,1418,16300,2200000,"tornado, londonky, london, kentucky, weather",original sound,2025-05-23 18:47:59,https://www.tiktok.com/@cbsnews/video/7507714664550206763
7504320104910376214,themeparkextra,Bonus points if you know where I am. #fyp #rollercoaster ,53300,243,808,993000,"fyp, rollercoaster",som original,2025-05-14 15:14:44,https://www.tiktok.com/@themeparkextra/video/7504320104910376214
7507845401995726111,victorlara5442,Ésta es la sentencia que recibirán Julio y Gerson Flores por el ataque a Misael #vendedordefrutastehuacan #mamademisaeljovendetehuacan #MisaelFrutas  #ElPiñas #JulioFloresCabrera #GersonFlores #Tehuacan #TehuacanPuebla #esposadejulioflores #casodemisaelelpiñas #misaelelpiñas  #sentenciadejulioygersonflores,164900,9072,3482,5700000,"vendedordefrutastehuacan, mamademisaeljovendetehuacan, misaelfrutas, elpiñas, julioflorescabrera, gersonflores, tehuacan, tehuacanpuebla, esposadejulioflores, casodemisaelelpiñas, misaelelpiñas, sentenciadejulioygersonflores","Así Fue - En Vivo Desde Bellas Artes, México/ 2013",2025-05-24 03:14:54,https://www.tiktok.com/@victorlara5442/video/7507845401995726111
