video_id,author,description,likes,comments,shares,plays,hashtags,music,create_time,video_url
7505525366455405855,tineocollegeprep,These are part of Collegeboard’s new AP Career Kickstart program. High schools had to apply to be part of the pilot next year. More schools will only be able to participate in their national launch in 2026-27. . . . . #ap #aps #apexams #apexam #hs #highschool #fyp ,46500,649,6794,533300,"ap, aps, apexams, apexam, hs, highschool, fyp",ribs x for real this time mashup,2025-05-17 21:12:07,https://www.tiktok.com/@tineocollegeprep/video/7505525366455405855
7496955270426332471,kylxnft,#fyp #viral Nah i actually don’t know😭😭 @KenDayz ,406900,1943,102800,2200000,"fyp, viral",original sound,2025-04-24 18:55:27,https://www.tiktok.com/@kylxnft/video/7496955270426332471
7507635887841266990,wieszchowskifambam,People are so cruel 😢#fyp #fypp #animalsoftiktok #animals #kitten ,182000,2311,7190,949000,"fyp, fypp, animalsoftiktok, animals, kitten",mockingbird,2025-05-23 13:42:31,https://www.tiktok.com/@wieszchowskifambam/video/7507635887841266990
7507701957931404586,wearesunsetlovers,The results of a maternity photoshoot are always my favorite 💖,19500,14,460,333500,,The Winner Is... - DeVotchKa Version,2025-05-23 17:58:40,https://www.tiktok.com/@wearesunsetlovers/video/7507701957931404586
7503637604622028038,triplexoficial,#LIVEIncentiveProgram #LIVEDebut #PaidPartnership ,27700,446,4562,1400000,"liveincentiveprogram, livedebut, paidpartnership",sonido original,2025-05-12 19:06:22,https://www.tiktok.com/@triplexoficial/video/7503637604622028038
7507454811319684383,lexieskincarequeen,so upset i didn’t figure it out sooner #hellothea #skincare #GlowUp #skincareroutine #nomoreacnescars #acnescars #clearskintips ,27600,20,123,276200,"hellothea, skincare, glowup, skincareroutine, nomoreacnescars, acnescars, clearskintips",nhạc nền - me at home ☕️,2025-05-23 01:59:14,https://www.tiktok.com/@lexieskincarequeen/video/7507454811319684383
7507625647548747051,phdkitty,Kitty explain pyramid scheme,209600,600,30300,1400000,,original sound,2025-05-23 13:03:06,https://www.tiktok.com/@phdkitty/video/7507625647548747051
7506439677390474501,user21248200461980,@💋Эᴧᴧᴀ🥷 ,230800,12000,373000,2500000,,оригінальний звук,2025-05-20 08:19:53,https://www.tiktok.com/@user21248200461980/video/7506439677390474501
7507431233698581806,casketronnn,@Atticus Gonzalez #tortapounders4life ,94400,828,44700,613700,tortapounders4life,original sound,2025-05-23 00:28:07,https://www.tiktok.com/@casketronnn/video/7507431233698581806
7507531742404726046,mr.uchiha60,What a day to be a champion #ap #fyp #fypシ゚viral #gradution #classof2026 #dumb ,147700,257,10200,467400,"ap, fyp, fypシ゚viral, gradution, classof2026, dumb",originalljud,2025-05-23 06:58:22,https://www.tiktok.com/@mr.uchiha60/video/7507531742404726046
7507456806617124127,user2471310416074,#movies #edit ,26700,92,758,361600,"movies, edit",original sound,2025-05-23 02:06:55,https://www.tiktok.com/@user2471310416074/video/7507456806617124127
7507685426581523758,smehmemik,#юмор #прикол #круги ,47800,525,42800,945700,"юмор, прикол, круги",оригинальный звук,2025-05-23 16:54:57,https://www.tiktok.com/@smehmemik/video/7507685426581523758
7506358065805970718,sadiee.and.edenn,#sistervibes💕 ,157700,746,49500,626300,sistervibes💕,original sound,2025-05-20 03:03:15,https://www.tiktok.com/@sadiee.and.edenn/video/7506358065805970718
7507471722501950766,okyasirr,"im complaining, valid complaint tho idc #fyp #viral #philly ",92400,488,1970,502000,"fyp, viral, philly",Dust Collector,2025-05-23 03:05:23,https://www.tiktok.com/@okyasirr/video/7507471722501950766
7506667446695152926,camieelizabeth,W for the girls #iykyk,29500,88,417,283400,iykyk,original sound,2025-05-20 23:03:51,https://www.tiktok.com/@camieelizabeth/video/7506667446695152926
7507198166786215211,shitheadmetz,#stayfreaky #real #idaho #fyppppppppppppppppppppppp #inmetzwetrust🙏🏻 #alcoholic #fyp ,155200,7511,17300,1300000,"stayfreaky, real, idaho, fyppppppppppppppppppppppp, inmetzwetrust🙏🏻, alcoholic, fyp",original sound,2025-05-22 09:23:20,https://www.tiktok.com/@shitheadmetz/video/7507198166786215211
7502016524740234518,leandro.sv,real. #leandrosv #relatable #relate #fyp #travel #traveltiktok ,643300,1054,27100,3200000,"leandrosv, relatable, relate, fyp, travel, traveltiktok",suara asli - me.,2025-05-08 10:15:41,https://www.tiktok.com/@leandro.sv/video/7502016524740234518
7507323761876847918,tmccluskey19,Update on our baby. She’s hanging in there. Send a prayer this way if y’all don’t mind. Though she hasn’t been to a vet. We have been in contact with ours and we are following his recommendations. #snakebite #rattlesnake #fyp #viral #relatable #gretchen ,42500,1748,1043,1000000,"snakebite, rattlesnake, fyp, viral, relatable, gretchen",Good Ol' Dogs and God,2025-05-22 17:30:40,https://www.tiktok.com/@tmccluskey19/video/7507323761876847918
7505053188484074795,iisabellarogerss,he is now building sandcastles #beach #pcb #fyp @Jonathan Rogers ,83200,261,22600,972600,"beach, pcb, fyp",Free Bird,2025-05-16 14:39:41,https://www.tiktok.com/@iisabellarogerss/video/7505053188484074795
7507520767886675230,fab_thirty3,What you doing in my kitchen foo? #fypシ゚viral #funnyvideo #viraltiktok ,83100,360,28800,406800,"fypシ゚viral, funnyvideo, viraltiktok",original sound,2025-05-23 06:15:30,https://www.tiktok.com/@fab_thirty3/video/7507520767886675230
7507725454082821422,streameruniversityfeed,funny mike funny asl #streameruniversity #fyp #funnymike ,129100,731,6790,541700,"streameruniversity, fyp, funnymike","Mode Silence - Muet, Mode Silencieux, Calme, Chut Pour Iphone",2025-05-23 19:30:11,https://www.tiktok.com/@streameruniversityfeed/video/7507725454082821422
7507815901517991175,aazulraya,,2200000,3671,87200,13600000,,original sound,2025-05-24 01:20:16,https://www.tiktok.com/@aazulraya/video/7507815901517991175
7507263689339211028,ashantidj,DJ AND 2HOLLIS,144100,1448,11900,3000000,,оригинальный звук,2025-05-22 13:37:22,https://www.tiktok.com/@ashantidj/video/7507263689339211028
7507470511685799198,.morgangsta,#fyp #ex ,201900,246,441,891600,"fyp, ex",Bunna Summa,2025-05-23 03:00:11,https://www.tiktok.com/@.morgangsta/video/7507470511685799198
7506995826611326216,estebanalatorreservin,#paranormal#basilica #cdmx ,150100,1406,56300,2300000,"paranormal, basilica, cdmx",sonido original,2025-05-21 20:17:55,https://www.tiktok.com/@estebanalatorreservin/video/7506995826611326216
7506807621165370632,audreycrissy,"no starbucks, chocolates, fruits, soda, n ice cream… back to my usual habits now but i learned how to eat and drink less sweets! letting go of sugar is definetely a lifestyle im not ready for 😂😝🍰🍦🍫",607500,1330,27000,5600000,,som original,2025-05-21 08:07:36,https://www.tiktok.com/@audreycrissy/video/7506807621165370632
7507089873564634398,itskeniag,Congratulations to all the graduates of class of 2025 but specially my baby brother Tony 🥳 🎓 @Banda TAMBORRACHO #fyp #jalamoslabanda #surprisegift #parati #explorepage #bandaatgraduation #congratulationsgraduate #classof2025 #tamborracho #wichitaks #youmadeit ! ,112100,289,3429,720600,,original sound,2025-05-22 02:23:03,https://www.tiktok.com/@itskeniag/video/7507089873564634398
7507692487251660062,zenosclipz0,Deshae now Tbvnks? 💀😭😭 #fypage #viral #kaicenat #tbvnks ,25300,165,970,400800,"fypage, viral, kaicenat, tbvnks",Pep Rally,2025-05-23 17:21:36,https://www.tiktok.com/@zenosclipz0/video/7507692487251660062
7505263572260523310,concludely,Adin Is Forced To Leave His Warehouse By Police & Fbi After What Antonio Brown Did😲#adinross #fyp #viral,141700,377,699,1900000,"adinross, fyp, viral",original sound - Conc,2025-05-17 04:16:40,https://www.tiktok.com/@concludely/video/7505263572260523310
7507827583250173215,maxpreps,Look out for out for 6’10 WR Mike Broxton Jr. 👀⭐️  (via andyvillamarzo/IG) #football #widereciever #tall #catch #touchdown #bigman #floridafootball #beast #wemby #highschoolbasketball #highschoolsports #athlete #sports #highlight,72700,979,3667,874700,"football, widereciever, tall, catch, touchdown, bigman, floridafootball, beast, wemby, highschoolbasketball, highschoolsports, athlete, sports, highlight",original sound,2025-05-24 02:05:47,https://www.tiktok.com/@maxpreps/video/7507827583250173215
