video_id,author,description,likes,comments,shares,plays,hashtags,music,create_time,video_url
7505486832872721672,howeversnowy,артикул шорт из видео на WB: 325820928 мой тгк: howeversnowy ,213100,367,37200,1400000,,PDD,2025-05-17 18:42:16,https://www.tiktok.com/@howeversnowy/video/7505486832872721672
7505622018151189766,editforlara,Todos estão muito felizes #madslewis #nessaabarrett #jadenhossler #joshrichards ,230300,345,2514,1500000,"madslewis, nessaabarrett, jadenhossler, joshrichards",Daylight,2025-05-18 03:26:51,https://www.tiktok.com/@editforlara/video/7505622018151189766
7505859423592664363,domthetroll21,What place should we do next ? 😭🙏,107700,679,9469,958800,,original sound,2025-05-18 18:48:46,https://www.tiktok.com/@domthetroll21/video/7505859423592664363
7506671581565816110,gymjimm,#fypシ ,92700,4862,13800,1700000,fypシ,original sound,2025-05-20 23:19:50,https://www.tiktok.com/@gymjimm/video/7506671581565816110
7505563125865811231,lifewithmichela,Like why did I come back here again 🥲,43400,941,4595,354300,,The Ghetto,2025-05-17 23:38:27,https://www.tiktok.com/@lifewithmichela/video/7505563125865811231
7504998104513514774,retiredpermanently,I like WiFi but none of you guys had these pfps before he died💔 #wifiskeleton #jaydes #wifi #skel #indiemusic #fyp #foryoupage #foryou ,51300,1130,837,1100000,"wifiskeleton, jaydes, wifi, skel, indiemusic, fyp, foryoupage, foryou",Nope your too late i already died,2025-05-16 11:05:44,https://www.tiktok.com/@retiredpermanently/video/7504998104513514774
7505195617061244190,agent0328,#lipsync #pnbrock #masterpiece ,221200,1417,14900,819400,"lipsync, pnbrock, masterpiece",original sound,2025-05-16 23:52:26,https://www.tiktok.com/@agent0328/video/7505195617061244190
7505526218037546271,madib__50,@alexia LETS GOOO #softball #baseball #gameday #regionals #liberty ,92000,491,1394,464100,"softball, baseball, gameday, regionals, liberty",original sound,2025-05-17 21:15:28,https://www.tiktok.com/@madib__50/video/7505526218037546271
7505829336755211566,mrsbigtyne,..and I’m saying this with all the love. SEND HIM WITH HIS DADDY! #mamatok #fyp #viral ,64900,2284,10700,401100,"mamatok, fyp, viral",original sound,2025-05-18 16:51:49,https://www.tiktok.com/@mrsbigtyne/video/7505829336755211566
7507410162592910622,yafavpiscez,them cervical checks during contractions was PAINFUL #cervicalchecks #pregnancy ,116100,498,5125,1200000,"cervicalchecks, pregnancy",ECE Marketing Airball,2025-05-22 23:05:51,https://www.tiktok.com/@yafavpiscez/video/7507410162592910622
7507335226046025003,ykemaniiiii,,246700,213,2121,1100000,,original sound,2025-05-22 18:15:07,https://www.tiktok.com/@ykemaniiiii/video/7507335226046025003
7507642225124248833,stolichiyonanas,Окак,86600,54200,3953,1500000,,original sound,2025-05-23 14:06:39,https://www.tiktok.com/@stolichiyonanas/video/7507642225124248833
7505886622886448415,gabrielwhittakerr,These guardian bells are something every rider deserves. Guardian bells for the win.  #guardianbell #gremlinbell #motorcycle #motorcycles #biketok #2wheels #sportbike ,51100,347,1243,1600000,"guardianbell, gremlinbell, motorcycle, motorcycles, biketok, 2wheels, sportbike",original sound,2025-05-18 20:33:54,https://www.tiktok.com/@gabrielwhittakerr/video/7505886622886448415
7506312213720845610,dani_yelly_smelly_belly,Don’t get me wrong. I love Insane Clown Posse. I just wish it was a true. :( #icp #insaneclownposseicp #insaneclownposse #allegations #fupシ #forupageシ #foryou #foryoupage #fypシ゚viral ,24100,719,769,381600,"icp, insaneclownposseicp, insaneclownposse, allegations, fupシ, forupageシ, foryou, foryoupage, fypシ゚viral",The Neden Game,2025-05-20 00:05:49,https://www.tiktok.com/@dani_yelly_smelly_belly/video/7506312213720845610
7506368097528466731,hamiltonmusical,Give it up for this OG Schuyler Sisters performance at the Town Hall Spring Shout Benefit Concert honoring Lin-Manuel Miranda tonight! #TheSchuylerSisters #LinManuelMiranda,658500,2569,53900,2400000,"theschuylersisters, linmanuelmiranda",original sound,2025-05-20 03:42:45,https://www.tiktok.com/@hamiltonmusical/video/7506368097528466731
7506944975691664670,kubullpen,Rock Chalk Jayhawk ,20300,93,1730,194600,,Follow tshaamano,2025-05-21 17:00:44,https://www.tiktok.com/@kubullpen/video/7506944975691664670
7501690198254685486,sydneystarbuck_19,Passenger princess! 👸 #passengerprincessforlife #passengerprincess #roadtrip #familyvacation ,186000,270,35700,1900000,"passengerprincessforlife, passengerprincess, roadtrip, familyvacation",Western Music: Arizona Dreaming,2025-05-07 13:10:27,https://www.tiktok.com/@sydneystarbuck_19/video/7501690198254685486
7500074231493823774,katerina.rozmajzl,#engagementring #2026bride #sapphire #diamond #toietmoi ,965200,2092,11500,14200000,"engagementring, 2026bride, sapphire, diamond, toietmoi",son original,2025-05-03 04:38:56,https://www.tiktok.com/@katerina.rozmajzl/video/7500074231493823774
7505610398326869294,definitelynot_nick12,Starting Summer off right 🤩🤩 @Dane Frala @G_Strick4  #summer #bar #fyp #country ,79900,66,340,278300,"summer, bar, fyp, country",original sound,2025-05-18 02:42:05,https://www.tiktok.com/@definitelynot_nick12/video/7505610398326869294
7506028644532243720,mylovverty,#мед #студентмедик #жиза ,110300,218,15900,904400,"мед, студентмедик, жиза",Юля лав соса ДАВАЙ,2025-05-19 05:44:44,https://www.tiktok.com/@mylovverty/video/7506028644532243720
7506617295561657646,rushfighter0,real @jbowyy                                               Fit from @wealthycodeofficial ,314000,2625,58900,2000000,,Kentucky Love,2025-05-20 19:49:50,https://www.tiktok.com/@rushfighter0/video/7506617295561657646
7505625299493670175,yasmerii.s,miss him #bf #comeback #parati ,128900,140,29900,522500,"bf, comeback, parati",original sound,2025-05-18 03:39:46,https://www.tiktok.com/@yasmerii.s/video/7505625299493670175
7507294110634593582,jayguap3,,183000,456,14500,958800,,Swagg Talk,2025-05-22 15:35:35,https://www.tiktok.com/@jayguap3/video/7507294110634593582
7505872860108410130,userknq1whyyxm,#армия #вдв ,59400,342,5406,975800,"армия, вдв",оригинальный звук,2025-05-18 19:40:18,https://www.tiktok.com/@userknq1whyyxm/video/7505872860108410130
7505521026206420254,yogasurfbeer,,105500,345,1203,530300,,sonido original,2025-05-17 20:55:10,https://www.tiktok.com/@yogasurfbeer/video/7505521026206420254
7506685788227145003,home.sweet.hauls,We had too much fun with this. Their minds were blown.  #bubbles #bubblemachine #kidstoys #toysforkids #summerfun #funforkids ,24200,211,452,1000000,"bubbles, bubblemachine, kidstoys, toysforkids, summerfun, funforkids",original sound,2025-05-21 00:14:54,https://www.tiktok.com/@home.sweet.hauls/video/7506685788227145003
7495041066551282974,nando.and.manda,He doesn’t get it 🤦🏻‍♀️ #fyp #funny #extra #viral #Relationship #relatable #fypシ #grip #hinge @Hinge 🖤 ,239500,395,6414,5500000,"fyp, funny, extra, viral, relationship, relatable, fypシ, grip, hinge",oh my god bruh oh hell na man,2025-04-19 15:07:50,https://www.tiktok.com/@nando.and.manda/video/7495041066551282974
7499655595633478942,thereallightskinjay,Semaj washing dishes 😭 #fyppp #viral #thereallightskinjay #funny #skits ,199800,708,5398,1800000,"fyppp, viral, thereallightskinjay, funny, skits",original sound,2025-05-02 01:34:24,https://www.tiktok.com/@thereallightskinjay/video/7499655595633478942
7504697317283351830,onoxlol,#fyp #schwarzerhumor #humor #twitchclips ,159900,1386,140700,1400000,"fyp, schwarzerhumor, humor, twitchclips",Originalton,2025-05-15 15:38:31,https://www.tiktok.com/@onoxlol/video/7504697317283351830
7505141669965155614,ssexcshawt,so excitedddd,116400,520,6274,413000,,original sound,2025-05-16 20:22:57,https://www.tiktok.com/@ssexcshawt/video/7505141669965155614
7506299125210680618,kymccuen,"yes, she was singing her pink pony club😂 @Kyrst #greenscreenvideo #chappellroan #dancingfruit #screentime #baby #fyp ",50700,76,12700,286600,"greenscreenvideo, chappellroan, dancingfruit, screentime, baby, fyp",Pink Pony Club,2025-05-19 23:14:53,https://www.tiktok.com/@kymccuen/video/7506299125210680618
7506771071345986858,vaultofcontent4,#fyp #foryoupage #viral #blowthisup #thelastofus ,71600,798,12400,731600,"fyp, foryoupage, viral, blowthisup, thelastofus",The Last of Us,2025-05-21 05:45:58,https://www.tiktok.com/@vaultofcontent4/video/7506771071345986858
7505370050904198446,garjo_clips,When Speed Found The One!!😍💀 #ishowspeed #amy ,180500,207,1151,2700000,,I Wanna Be Yours,2025-05-17 11:10:58,https://www.tiktok.com/@garjo_clips/video/7505370050904198446
7506641388772298030,voicegift,The best birthday surprise… 💙🔊⚾️ #voicegift #giftideas #gift #diygifts #gifts #memories #birthday #birthdaysurprise #dodgers #ladodgers #dodgerstadium #baseball #baseballseason ,21000,18,36,266300,"voicegift, giftideas, gift, diygifts, gifts, memories, birthday, birthdaysurprise, dodgers, ladodgers, dodgerstadium, baseball, baseballseason",original sound,2025-05-20 21:23:21,https://www.tiktok.com/@voicegift/video/7506641388772298030
7500820253392293151,user543214476,like the sister i never had  #youngersister #bestfriend #fyp #loveher ,636800,8887,68500,3200000,"youngersister, bestfriend, fyp, loveher",original sound,2025-05-05 04:54:05,https://www.tiktok.com/@user543214476/video/7500820253392293151
7505899045659954478,caseeyrichardsonn,he stole the show #fyp #trending #relatable ,43100,142,646,263300,"fyp, trending, relatable",Original Sound,2025-05-18 21:22:25,https://www.tiktok.com/@caseeyrichardsonn/video/7505899045659954478
7507373397916208430,motherofthezs,Taking 7 kids on a road trip and camping! It’s going to be so much fun! #campingwithkids #hikingwithkids #roadtrip #momof7 #twinmom #getoutside #1000hoursoutside #campingtrip #tentcamping #vanlife #largefamily ,189100,310,1671,1800000,"campingwithkids, hikingwithkids, roadtrip, momof7, twinmom, getoutside, 1000hoursoutside, campingtrip, tentcamping, vanlife, largefamily",original sound,2025-05-22 20:43:15,https://www.tiktok.com/@motherofthezs/video/7507373397916208430
7506965899597892872,jkedivii,,163700,1376,1388,1700000,,original sound,2025-05-21 18:21:48,https://www.tiktok.com/@jkedivii/video/7506965899597892872
7505550823166856478,khaoticgang5x,"Emo vs Yn prank ,new character unlocked 😂",311300,2244,44300,2200000,,original sound,2025-05-17 22:50:47,https://www.tiktok.com/@khaoticgang5x/video/7505550823166856478
7506992386778860846,illuminatigam3s,I know I missed a few but this 5/5🥱,73300,2693,2710,948400,,original sound,2025-05-21 20:04:43,https://www.tiktok.com/@illuminatigam3s/video/7506992386778860846
7506989826407795999,babysharkrunningawaka,i love being tan 😊  can’t wait for dis summa tan #tanning ,65300,143,1252,240500,tanning,Shake Back,2025-05-21 19:54:46,https://www.tiktok.com/@babysharkrunningawaka/video/7506989826407795999
7506668813191056670,eithercrashinoutorcrying,,175500,1329,9405,533300,,original sound,2025-05-20 23:09:09,https://www.tiktok.com/@eithercrashinoutorcrying/video/7506668813191056670
7506306023687474478,lanializa,follow me on here and insta! #lanializa #fyp #foryoupage ,96200,582,6839,417400,"lanializa, fyp, foryoupage",original sound,2025-05-19 23:41:45,https://www.tiktok.com/@lanializa/video/7506306023687474478
7506664825532058911,preston.4nderson,makes me feel validated in my decision to be lazy😭 #fyp #college #relatable #real #viral ,1200000,1293,55400,3800000,"fyp, college, relatable, real, viral",original sound,2025-05-20 22:53:45,https://www.tiktok.com/@preston.4nderson/video/7506664825532058911
7505193716341050654,andresxjess,hotels are overrated anyway  #ibiza #hotelstay #sleeping #spain #budget ,140300,204,19900,1400000,"ibiza, hotelstay, sleeping, spain, budget",original sound,2025-05-16 23:44:59,https://www.tiktok.com/@andresxjess/video/7505193716341050654
7506210357065616671,silvia_silviaaaaa,#fypシ #fypage #fyp #fypシ゚viral #whatthehell #whatthehelly ,18800,307,15700,403900,"fypシ, fypage, fyp, fypシ゚viral, whatthehell, whatthehelly",original sound,2025-05-19 17:30:21,https://www.tiktok.com/@silvia_silviaaaaa/video/7506210357065616671
7507329917512764718,bigtimerush38,nothing can bring me down today #ilovebrazils #asf #gym #wax #tone,52400,125,278,778500,"ilovebrazils, asf, gym, wax, tone",Original Sound,2025-05-22 17:54:33,https://www.tiktok.com/@bigtimerush38/video/7507329917512764718
7506575668860243230,idkbritney_,1ra CENA FAMILIAR en mi 1er DEPARTAMENTO🏡 // Toda la familia junta y feliz❤️🍱 (parte 1) @La Familia Lopez @Orlando @Morrie Budler @Jocy🧚🏻‍♀️ @Justin H 🥷🏻🖤 ,205600,776,391,3300000,,sonido original,2025-05-20 17:07:57,https://www.tiktok.com/@idkbritney_/video/7506575668860243230
7505589831263735071,sidemoneytom,#repost of investigating the Mandalay Bay all these years later. Many believe to this day that he did not work alone. #RIP to all those lost and condolences to the family #fyp #foryou #vegas #mandalaybay ,50100,282,1417,716100,"repost, rip, fyp, foryou, vegas, mandalaybay",original sound,2025-05-18 01:22:15,https://www.tiktok.com/@sidemoneytom/video/7505589831263735071
7507039985258728750,djtracisteele,"My son’s 1st bday and now his 19th Bday 🎉 Happy Birthday my baby, not so baby anymore 😩",38800,307,367,283900,,I'm Just a Kid,2025-05-21 23:09:22,https://www.tiktok.com/@djtracisteele/video/7507039985258728750
7505924378991889710,burntoutteachers,The Intrusion Part 1  #bunker #imabunker #dontbeabunker #mrsbunker #burntoutteachers #teacher #teachers #teachersoftiktok #teachersontiktok #teacherlife #teachersbelike #teacherprob #teacherprobs #tiredteacher #teachertired #teacherfunny #teachertok ,50800,280,97,311100,"bunker, imabunker, dontbeabunker, mrsbunker, burntoutteachers, teacher, teachers, teachersoftiktok, teachersontiktok, teacherlife, teachersbelike, teacherprob, teacherprobs, tiredteacher, teachertired, teacherfunny, teachertok",original sound,2025-05-18 23:00:42,https://www.tiktok.com/@burntoutteachers/video/7505924378991889710
7506553920165006622,thatgurlhaylee,Dontt mind the hair jus got out the gym😛 #majorette dc: @Motion Of The Ocean ,68100,494,10700,1300000,majorette,original sound,2025-05-20 15:43:35,https://www.tiktok.com/@thatgurlhaylee/video/7506553920165006622
7506654100147227947,5150redd,#foryou #foryoupage #fypシ #fy #fyp ,481400,2021,18500,2900000,"foryou, foryoupage, fypシ, fy, fyp",son original,2025-05-20 22:12:34,https://www.tiktok.com/@5150redd/video/7506654100147227947
7505191546313018655,thee_amazonglowup,"I started my lip-lightening journey thinking tretinoin was the answer. I had dark, patchy lips and pigmentation around my mouth that made me feel super self-conscious. But instead of helping, the tretinoin dried out my lips terribly, left the corners raw, and actually made the discoloration worse. My skin barrier was screaming, and I didn’t even realize I was making it worse by skipping SPF and using such a strong active on sensitive areas. This is your sign to stop overdoing it and start treating your skin with kindness. The Ksecret Retinal Serum gave me results I never got from harsher products. 💛@KSECRET GLOBAL  #glowupwithretinalchallenge, #seoul1988 #ksecret #retinal #skincare #retinal #ksecretseoul1988retinalserum #7dayschallenge #7daystreatment #7daysresult #scartreatment #brighteningserum #serum #retinalserum #1week #seoul1988 #skincareroutines #ksecret #explore #trendingsounds #trendingaudios #trendingsongs #KsecretRetinal #LipLighteningJourney #PigmentationAroundMouth #BarrierRepairSkincare #DarkLips #BeforeAndAfterSkincare #SkincareReview #BlackSkinCare #blackskincareroutine ",106000,267,10200,3200000,"glowupwithretinalchallenge, seoul1988, ksecret, retinal, skincare, ksecretseoul1988retinalserum, 7dayschallenge, 7daystreatment, 7daysresult, scartreatment, brighteningserum, serum, retinalserum, 1week, skincareroutines, explore, trendingsounds, trendingaudios, trendingsongs, ksecretretinal, liplighteningjourney, pigmentationaroundmouth, barrierrepairskincare, darklips, beforeandafterskincare, skincarereview, blackskincare, blackskincareroutine",original sound,2025-05-16 23:36:39,https://www.tiktok.com/@thee_amazonglowup/video/7505191546313018655
7506879630570196280,evgeni3483,@fiker_di #motosport #motorcycle #moto #progasi #мотоспорт #мотоциклы #мотоцикл #мото #прогаси ,136400,4689,208300,2400000,"motosport, motorcycle, moto, progasi, мотоспорт, мотоциклы, мотоцикл, мото, прогаси",оригинальный звук,2025-05-21 12:47:02,https://www.tiktok.com/@evgeni3483/video/7506879630570196280
7505319093046627589,banthegoodguy,#fyp #lookism ,126300,665,2444,1100000,"fyp, lookism",original sound,2025-05-17 07:51:23,https://www.tiktok.com/@banthegoodguy/video/7505319093046627589
7506951089715940638,serenadenson,There is a Sora in the marsh that sounds like it’s laughing all the time!  Puppies fostered thru @Northwoods Animal Shelter IR  #adoptdontshop #goodhusband #fosteringsaveslives #fyp #reel #puppiesoftiktok ,281000,1290,27400,2100000,"adoptdontshop, goodhusband, fosteringsaveslives, fyp, reel, puppiesoftiktok",original sound,2025-05-21 17:24:27,https://www.tiktok.com/@serenadenson/video/7506951089715940638
7505493256126467374,thatfamousfamily,We’re all cooked 😂 #family #fyp Gen Z vs Millennial vs Gen Alpha,11500,52,63,557900,"family, fyp",original sound,2025-05-17 19:07:44,https://www.tiktok.com/@thatfamousfamily/video/7505493256126467374
7505824694155676971,illegalsubstancetrader,#funny #fyp #foryoupage #blowthisup #pizza ,96300,309,12600,665000,"funny, fyp, foryoupage, blowthisup, pizza",New Slaves Outro,2025-05-18 16:33:56,https://www.tiktok.com/@illegalsubstancetrader/video/7505824694155676971
7506233625931697450,theincrediblebrettable,The more you know #lifelesson #themoreyouknow #jokes #lineman #linemanissues #linework #bluecollar #bluecollarboys #linetrash⚡️ #linemanlife #viralvideo #trending #fyp #blowthisuptiktok #foryoupage #fypシ #relatable #trend #jackofalltrades ,24500,102,2322,206500,"lifelesson, themoreyouknow, jokes, lineman, linemanissues, linework, bluecollar, bluecollarboys, linetrash⚡️, linemanlife, viralvideo, trending, fyp, blowthisuptiktok, foryoupage, fypシ, relatable, trend, jackofalltrades",original sound,2025-05-19 19:00:49,https://www.tiktok.com/@theincrediblebrettable/video/7506233625931697450
7507057346384858375,kathebbss,That’s on community ,282200,830,4069,2000000,,Father Figure (Featured in 'Babygirl'),2025-05-22 00:16:40,https://www.tiktok.com/@kathebbss/video/7507057346384858375
7506228863651925278,theubdiaries,Y’all could never make me hate @Taylor Paul #momtok #secretlivesofmormonswives #hulu #taylorfrankiepaul ,87200,493,1870,436000,"momtok, secretlivesofmormonswives, hulu, taylorfrankiepaul",original sound,2025-05-19 18:42:08,https://www.tiktok.com/@theubdiaries/video/7506228863651925278
7503606707558354207,valhallaschosen369,Replying to @mtlhed73 ,24400,8874,474,597100,,Google is Free,2025-05-12 17:07:05,https://www.tiktok.com/@valhallaschosen369/video/7503606707558354207
7506653284346662162,citation.shelby,Простое это день. #фильмы #сериалы #рекомендации,36700,156,510,851600,,оригинальный звук - 𝖈𝖎𝖙𝖆𝖙𝖎𝖔𝖓.𝖘𝖍𝖊𝖑𝖇𝖞,2025-05-21 09:10:00,https://www.tiktok.com/@citation.shelby/video/7506653284346662162
7507459064138403102,victorthegoodboss,,14900,846,157,701800,,original sound,2025-05-23 02:15:46,https://www.tiktok.com/@victorthegoodboss/video/7507459064138403102
7507395347975638302,supercarconnection,What would you do?  Our full episode with @Fastrrr_llc is out now! Covering all things hypercars and the rarest of the rare! #supercarconnection #carpodcast #supercarlifestyle #carculture #carcommunity #carlove #hypercars #hypercarsdaily #koenigsegg ,12700,60,77,391900,"supercarconnection, carpodcast, supercarlifestyle, carculture, carcommunity, carlove, hypercars, hypercarsdaily, koenigsegg",original sound,2025-05-22 22:08:20,https://www.tiktok.com/@supercarconnection/video/7507395347975638302
7505181709827149098,elevacion_del_evangelio,,228100,32900,6047,1800000,,sonido original,2025-05-16 22:58:23,https://www.tiktok.com/@elevacion_del_evangelio/video/7505181709827149098
7507106160504229163,misspaolastyles,2 month transformation & I’m not stopping here💪🏻🍑🔥 #transformation #fitness #fy ,77800,608,7056,824900,"transformation, fitness, fy",Me Gusta,2025-05-22 03:26:34,https://www.tiktok.com/@misspaolastyles/video/7507106160504229163
7507179295052172575,yazmmin94,#irma #neni #girls ,39600,73,680,493200,"irma, neni, girls",ANDO,2025-05-22 08:11:11,https://www.tiktok.com/@yazmmin94/video/7507179295052172575
7506309470956440863,julia.whiteeee7,,95100,234,821,506000,,original sound,2025-05-19 23:54:46,https://www.tiktok.com/@julia.whiteeee7/video/7506309470956440863
7506496156243987754,josecanofficial,These foods genuinely taste the best and keep you full #gym #gymtok #snacks #rankings ,125700,649,2116,896200,"gym, gymtok, snacks, rankings",original sound,2025-05-20 12:00:22,https://www.tiktok.com/@josecanofficial/video/7506496156243987754
7506901140403965215,mkayboomr,“crashout” “yn” “fine shyt” “rizz” #ugrap #relatable #nyc #corny #ytpeople,58300,1510,3288,304000,"ugrap, relatable, nyc, corny, ytpeople",Feedback,2025-05-21 14:10:38,https://www.tiktok.com/@mkayboomr/video/7506901140403965215
7505990390730738990,tito_420_1974,#Meme #MemeCut #CapCut #memenatal #fyppppppppppppppppppppppp #followers➕ #tik #viralvideo #viralvideos #t #fy #fyp ,23700,252,42500,1500000,"meme, memecut, capcut, memenatal, fyppppppppppppppppppppppp, followers➕, tik, viralvideo, viralvideos, t, fy, fyp",HEY MAN SOMETIMES YOU GOTTA STFU,2025-05-19 03:16:56,https://www.tiktok.com/@tito_420_1974/video/7505990390730738990
7507312507464240430,notthekombuchaman,Replying to @Connor Franta love you connor<3 you ate with that  clapback #impression ,41600,75,204,322800,impression,original sound,2025-05-22 16:46:59,https://www.tiktok.com/@notthekombuchaman/video/7507312507464240430
7507340514992082218,grw.withmalaya,What ahve I done 😓😓 ##fyp #viral ,262100,3073,21800,1300000,"fyp, viral",som original,2025-05-22 18:35:39,https://www.tiktok.com/@grw.withmalaya/video/7507340514992082218
7507241093105274142,weddingprocass,Replying to @auntjenny48🇨🇦 this isn’t panning out- could Dylan be a suspect?? #weddingdrama  #weddingsituation #weddingstory #weddingstorytime #storywedding #storytimewedding #weddingskit #weddingguest #situationwedding #weddingvendor #weddinghumor #weddinglol #weddinglaugh #weddingplanning #weddingplanner #2023bride #2024bride #weddingtiktok #2025bride #2026bride #2027bride  #2028bride #dramawedding #skit  ,40000,469,69,278900,"weddingdrama, weddingsituation, weddingstory, weddingstorytime, storywedding, storytimewedding, weddingskit, weddingguest, situationwedding, weddingvendor, weddinghumor, weddinglol, weddinglaugh, weddingplanning, weddingplanner, 2023bride, 2024bride, weddingtiktok, 2025bride, 2026bride, 2027bride, 2028bride, dramawedding, skit",original sound,2025-05-22 12:09:49,https://www.tiktok.com/@weddingprocass/video/7507241093105274142
7506962620235140395,vinnylocasto,LIKE WHY IDGI #fyp #iphone #funny #comedyvideo #fypシ ,48200,208,2525,349600,"fyp, iphone, funny, comedyvideo, fypシ",original sound,2025-05-21 18:09:13,https://www.tiktok.com/@vinnylocasto/video/7506962620235140395
7506557524636634390,kluchik106,#рекомендации #дружба@n3zuko  ,326900,2340,86100,2600000,"рекомендации, дружба",оригинальный звук,2025-05-20 15:57:05,https://www.tiktok.com/@kluchik106/video/7506557524636634390
7505546305817644334,tbsmacka,Live your dream… ,90000,391,21100,608700,,1004 Kilómetros,2025-05-17 22:33:34,https://www.tiktok.com/@tbsmacka/video/7505546305817644334
7499280476478115103,sammyspammya,im joking hes basically my grandpas age,118000,321,2295,1300000,,original sound,2025-05-01 01:18:40,https://www.tiktok.com/@sammyspammya/video/7499280476478115103
7506279617750240555,b1gspicy,Firecracker is the best card in the game #clashroyale #clash #fyp #firecracker #funny ,103700,378,15100,994900,"clashroyale, clash, fyp, firecracker, funny",original sound,2025-05-19 21:59:23,https://www.tiktok.com/@b1gspicy/video/7506279617750240555
7505577435744701703,stunnakillaa,#zeusnetwork #fania ,53500,210,1127,309200,"zeusnetwork, fania",Bunna Summa,2025-05-18 00:33:54,https://www.tiktok.com/@stunnakillaa/video/7505577435744701703
7506809141881605419,ayzegamesofficial,HACKERS Are DESTROYING Grow a Garden! #growagarden,77500,2864,3108,1600000,growagarden,original sound - Ayze Roblox,2025-05-21 10:30:00,https://www.tiktok.com/@ayzegamesofficial/video/7506809141881605419
7504987231866604822,bluey,There's nothing wrong with being small! 💙🧡 #Blueytok,198400,652,5781,1500000,blueytok,original sound - Bluey,2025-05-18 17:00:00,https://www.tiktok.com/@bluey/video/7504987231866604822
7506991445157416222,eli_unique_,Yuck😂😂😂#eliunique #trending #foryou ,26200,647,497,598400,"eliunique, trending, foryou",original sound,2025-05-21 20:00:59,https://www.tiktok.com/@eli_unique_/video/7506991445157416222
7497266992945188126,j4ylvsu,Us on a daily @Ari🤍 #fyp #comeback  #relateable,427800,5245,50600,1900000,"fyp, comeback, relateable",original sound,2025-04-25 15:05:16,https://www.tiktok.com/@j4ylvsu/video/7497266992945188126
7504939267311865096,frog_in_sweater.0,#fyp #fep #ryf #kic ,87600,2151,1591,1200000,"fyp, fep, ryf, kic",оригинальный звук,2025-05-16 07:17:26,https://www.tiktok.com/@frog_in_sweater.0/video/7504939267311865096
