video_id,author,description,likes,comments,shares,plays,hashtags,music,create_time,video_url
7506310298005949727,lov3charlee,#6months ,421600,5409,6356,1100000,6months,My baby my baby,2025-05-19 23:57:53,https://www.tiktok.com/@lov3charlee/video/7506310298005949727
7507101218926349590,_gianniadinna_,#fypシ゚ #trending #gianniadinna ,34500,575,83,429300,"fypシ゚, trending, gianniadinna",original sound,2025-05-22 03:07:04,https://www.tiktok.com/@_gianniadinna_/video/7507101218926349590
7507314450089757983,notarden,I’m so BORED,392800,378,84700,2300000,,follow hellocallum,2025-05-22 16:54:30,https://www.tiktok.com/@notarden/video/7507314450089757983
7507443214039747886,thegiftedeventoff,"The way this client brought a smile to my face and never left 🥹  Full video on YouTube  All haircuts are free to every child because of your donations that make the work that I do possible.  To donate a free haircut, visit  Thegiftedevent.Com or click the link in my bio Each child’s gifted experience includes A haircut  A shirt  A toy Valued at $75 - $150 per client  The Gifted Event T shirt  https://mynoblestore.myshopify.com/products/youth-the-gifted-event-tee Shop everything I use for Gifted   https://www.amazon.com/shop/thegiftedeventofficial?ref_=cm_sw_r_apin_aipsfshop_aipsfthegiftedeventofficial_MC79AJNCHQZ5R5S3W69W&language=en_US",389200,16300,21800,3100000,,original sound,2025-05-23 01:14:30,https://www.tiktok.com/@thegiftedeventoff/video/7507443214039747886
7507386710829894942,kyeunvolley,they must have 1 million accessories #volleyball #spike #bounce #volleyballlife #volleyballworld #fyp,44200,651,292,401800,"volleyball, spike, bounce, volleyballlife, volleyballworld, fyp",suara asli - ˢᵃᵈⁿᵉˢˢ,2025-05-22 21:34:49,https://www.tiktok.com/@kyeunvolley/video/7507386710829894942
7506941396822084907,_mooselab,Time flies ,118500,236,5598,549400,,Rivers and Roads,2025-05-21 16:46:52,https://www.tiktok.com/@_mooselab/video/7506941396822084907
7507112194912341279,leannjed_,she’s drop dead gorgeous 🥰🪦 #fyp#4u#leannjed_#fypシ#viral#blowthisup#love#relationship#relationshipgoals#relationshiptiktok#couple#coupletok#girl#boy#girlfriend#boyfriend#love#relateable#relateablecontent,270400,1323,104000,1400000,"fyp, 4u, leannjed_, fypシ, viral, blowthisup, love, relationship, relationshipgoals, relationshiptiktok, couple, coupletok, girl, boy, girlfriend, boyfriend, relateable, relateablecontent",so anxious by ginuwine,2025-05-22 03:49:52,https://www.tiktok.com/@leannjed_/video/7507112194912341279
7507155573385809157,k.shapkina.k,#typ #rek #нах #голубь ,176500,177,77200,1900000,"typ, rek, нах, голубь",оригинальный звук,2025-05-22 06:37:53,https://www.tiktok.com/@k.shapkina.k/video/7507155573385809157
7505538988757929262,connorrliftss,Just go to their website to sign up #gymtok #real #connorrliftss #gymadvice #motivation ,111300,2931,9605,658200,"gymtok, real, connorrliftss, gymadvice, motivation",original sound,2025-05-17 22:05:05,https://www.tiktok.com/@connorrliftss/video/7505538988757929262
7507411483597294891,everydayfindsforyou,#toddlertoys #momlife #toddlersoftiktok #toddlermomlife #morningroutine #momtok ,22000,117,2581,394600,"toddlertoys, momlife, toddlersoftiktok, toddlermomlife, morningroutine, momtok",MAMMA MIA SCENE 5,2025-05-22 23:11:01,https://www.tiktok.com/@everydayfindsforyou/video/7507411483597294891
7506740516055158033,sabinkaa8_8,#хочуврек #реки #ижевск ребята это такой звук😉,95000,571,24200,786500,"хочуврек, реки, ижевск",оригинальный звук,2025-05-21 03:47:11,https://www.tiktok.com/@sabinkaa8_8/video/7506740516055158033
7507824842662628650,patrickgreene_,Growing up in the Bay just hit different!! #macdre #bayarea #fatherhood #dadsoftiktok #parenting ,144100,2089,6947,699000,"macdre, bayarea, fatherhood, dadsoftiktok, parenting",Feeling Myself - DJ Vlad Mix,2025-05-24 01:55:34,https://www.tiktok.com/@patrickgreene_/video/7507824842662628650
7505122562603552030,internetsfavoriteorphan,NO ONE REALIZED THIS?!,459900,555,3497,2200000,,Bloodline,2025-05-16 19:08:47,https://www.tiktok.com/@internetsfavoriteorphan/video/7505122562603552030
7507002638668451102,camfant,sorry i don’t make the rules ,241900,1977,2773,925800,,som original,2025-05-21 20:44:28,https://www.tiktok.com/@camfant/video/7507002638668451102
7507769606577196334,travelgirlcriggs,WHY….Jamaican  🇯🇲 people so serious about their mango trees! #jamaica #jamaicatiktok # jamaicatiktok🇯🇲 #women #men #reggae #islandlife #reggaeton #trinidad #trinidadtiktok #mom #momsofttiktok #bobmarley #jamaicanfood #black #blacktiktok #creator #creatorsearchinsights #howtogoviral #viraltiktok #tiktokshop #dog #doglovers #pet #doglife ,51600,7314,23700,782700,"jamaica, jamaicatiktok, women, men, reggae, islandlife, reggaeton, trinidad, trinidadtiktok, mom, momsofttiktok, bobmarley, jamaicanfood, black, blacktiktok, creator, creatorsearchinsights, howtogoviral, viraltiktok, tiktokshop, dog, doglovers, pet, doglife",original sound,2025-05-23 22:21:11,https://www.tiktok.com/@travelgirlcriggs/video/7507769606577196334
7506649137790651690,thelandonpatterson,"This is quite the trip down memory lane. I’m so lucky I got to transition so young. It wasn’t easy but getting to live my truth when I got to is truly what saved my life and I feel like has led me to such an amazing adult life so glad I got to express myself and fashion, and make up wise as the girl I was always supposed to be when I was younger. I hope y’all enjoy getting to look back at my life as a very young trans woman. ",286000,2688,1748,2900000,,Use this sound for a free kiss,2025-05-20 21:53:19,https://www.tiktok.com/@thelandonpatterson/video/7506649137790651690
7504365481327938847,breenoknees,makes me so sick,459300,549,15300,1600000,,original sound,2025-05-14 18:10:57,https://www.tiktok.com/@breenoknees/video/7504365481327938847
7500998083614887198,venald.b,,477400,4485,144200,3000000,,your gf wants to be mine,2025-05-05 16:24:09,https://www.tiktok.com/@venald.b/video/7500998083614887198
7506936081477078315,briellepuleo,this made me so emotional omg cheweyyyy 😭😭😭 #catsoftiktok #neighborhoodcat #animallover #empath #fyp #foryou #foryoupage #cats #kitten #outdoorcat ,117400,1045,1024,350700,"catsoftiktok, neighborhoodcat, animallover, empath, fyp, foryou, foryoupage, cats, kitten, outdoorcat",To be loved is to be changed,2025-05-21 16:26:14,https://www.tiktok.com/@briellepuleo/video/7506936081477078315
7507859049875000594,lozano_gf,POV: vas de compras con tu novia #fyp #parati #viral #humor #comedia #lozano ,503500,1955,29300,3400000,"fyp, parati, viral, humor, comedia, lozano",sonido original,2025-05-24 04:07:40,https://www.tiktok.com/@lozano_gf/video/7507859049875000594
7507776840199605547,theofficialpartyanimals,Replying to @Megan Warren cameraman go beast mode😤 #bts #trackstar #bananaball #dji #videography #ronin #gimbal ,138500,406,1833,1700000,"bts, trackstar, bananaball, dji, videography, ronin, gimbal",original sound,2025-05-23 22:49:18,https://www.tiktok.com/@theofficialpartyanimals/video/7507776840199605547
7507412586644802862,truckthedog,TWUCK #chocolatelab #dogsoftiktok #labrador #chubbydog ,175400,191,24600,867100,"chocolatelab, dogsoftiktok, labrador, chubbydog",original sound,2025-05-22 23:15:19,https://www.tiktok.com/@truckthedog/video/7507412586644802862
7506590017838419242,jdnwt,Best ranker in this app ngl. #ranking #list #fyp #soda #drinks ,79300,21700,4235,820400,"ranking, list, fyp, soda, drinks",original sound,2025-05-20 18:04:00,https://www.tiktok.com/@jdnwt/video/7506590017838419242
7505185068663524626,theoshakes,The switch 🤣 #movies #gangster #mob #crime #impression #movies #goodfellas #robertdeniro #martinscorsese #uk #nz #aus #canada #usa,322600,529,4615,2500000,"movies, gangster, mob, crime, impression, goodfellas, robertdeniro, martinscorsese, uk, nz, aus, canada, usa",original sound,2025-05-16 23:11:22,https://www.tiktok.com/@theoshakes/video/7505185068663524626
7505400636553448722,lizzka_strizzz2,Я сомневалась в этой идее😄,231900,463,1125,2700000,,♡ ᶫᵒᵛᵉᵧₒᵤ ♡,2025-05-17 13:07:46,https://www.tiktok.com/@lizzka_strizzz2/video/7505400636553448722
7504861459554422062,shannonnsteele,The only one to stay up and play after all his siblings went to bed🥹 #dalmatian #dogsoftiktok #puppy #souldog ,318300,749,22000,2100000,"dalmatian, dogsoftiktok, puppy, souldog",original sound,2025-05-16 02:15:57,https://www.tiktok.com/@shannonnsteele/video/7504861459554422062
7501050653293235474,julio_ramosb,#meme #bichos #disney #fyp #hormigas #zoom #unboxing #grwm #gym ,1400000,4087,483800,11900000,"meme, bichos, disney, fyp, hormigas, zoom, unboxing, grwm, gym",sonido original,2025-05-05 19:47:39,https://www.tiktok.com/@julio_ramosb/video/7501050653293235474
7506666091108650262,hdaesina,back with the braids 🙂‍↕️ she was missed #layeredbraids #braidsinspo #gingerbraids ,246500,1284,13400,924700,"layeredbraids, braidsinspo, gingerbraids",Freeeeeee,2025-05-20 22:58:25,https://www.tiktok.com/@hdaesina/video/7506666091108650262
7507407027052776709,infinityacademiass,Conocen este personaje 🎥 🚘#han #memestiktok #tokyodriftedit #rapidosyfuriosos #maisvelozesmaisfuriosos #tokyo #autos #paratiiiiiiiiiiiiiiiiiiiiiiiiiiiiiii @Rimer Franco Serrano @Luigi justiniano @Yosu Alex Estivariz ,834600,3658,137500,8400000,"han, memestiktok, tokyodriftedit, rapidosyfuriosos, maisvelozesmaisfuriosos, tokyo, autos, paratiiiiiiiiiiiiiiiiiiiiiiiiiiiiiii",original sound,2025-05-22 22:53:36,https://www.tiktok.com/@infinityacademiass/video/7507407027052776709
7505520447010688302,theaniyawilliams,Are you serious?? #holyairball #soccer #futbol #mexico #miseleccionmx #stanford #commited #college ,164300,618,1533,672800,"holyairball, soccer, futbol, mexico, miseleccionmx, stanford, commited, college",original sound,2025-05-17 20:53:18,https://www.tiktok.com/@theaniyawilliams/video/7505520447010688302
7507137110055357726,yourfaveundies,Daddy’s home ✨😮‍💨 #couple #couples #matching #fyp #matchingoutfits #couplegoals #foryoupage #meandyou #bf #fypシ #boyfriend #match #youandme #hellokitty #daddyshome ,101100,1415,54200,860700,"couple, couples, matching, fyp, matchingoutfits, couplegoals, foryoupage, meandyou, bf, fypシ, boyfriend, match, youandme, hellokitty, daddyshome",hey daddy,2025-05-22 05:26:48,https://www.tiktok.com/@yourfaveundies/video/7507137110055357726
7507735748292939010,redbullracing,This… is Parkour 🏃‍♂️  #f1 #yukitsunoda #parkour ,344900,728,19700,3800000,"f1, yukitsunoda, parkour",original sound,2025-05-23 20:09:10,https://www.tiktok.com/@redbullracing/video/7507735748292939010
7507786617751391531,clockitbycamilla,She’s never gunna talk about her again ,104600,344,510,987000,,original sound,2025-05-23 23:27:09,https://www.tiktok.com/@clockitbycamilla/video/7507786617751391531
7507406797699910955,t.larsen,I love you mom,180900,2257,7620,1600000,,Little Sparrow,2025-05-22 22:52:49,https://www.tiktok.com/@t.larsen/video/7507406797699910955
7506996665291803950,pickroxk,HOMEBOY‼️ #pickroxk ,67700,176,1164,376700,pickroxk,original sound,2025-05-21 20:21:17,https://www.tiktok.com/@pickroxk/video/7506996665291803950
7506621924257058090,drk5ive,,167600,1214,42900,976500,,in the yo,2025-05-20 20:07:35,https://www.tiktok.com/@drk5ive/video/7506621924257058090
7507020614356487470,abs_dens,#funny #fyp #food #pasta #meals #pizza #relationship #couple ,89200,1031,16800,1800000,"funny, fyp, food, pasta, meals, pizza, relationship, couple",Came Here to Forget,2025-05-21 21:54:14,https://www.tiktok.com/@abs_dens/video/7507020614356487470
7504447355622591775,muppetpool,#PuppetsOfTikTok #BlueBueller ,69900,585,91500,1600000,"puppetsoftiktok, bluebueller",original sound,2025-05-14 23:28:35,https://www.tiktok.com/@muppetpool/video/7504447355622591775
7501061828680617238,rankmuse,Ranking Best Bathroom Pranks  #ranking #fyp #funny #memes #vine #fail #funnymoments #cringe #prank #fartspray,231700,1646,32600,3200000,"ranking, fyp, funny, memes, vine, fail, funnymoments, cringe, prank, fartspray",original sound,2025-05-05 20:30:57,https://www.tiktok.com/@rankmuse/video/7501061828680617238
7507347590636211486,fartburger2016,,117800,194,2208,428500,,original sound,2025-05-22 19:03:02,https://www.tiktok.com/@fartburger2016/video/7507347590636211486
7507845802732031275,nicollesoficial,,50000,873,734,444800,,Bandido Ana Barbara,2025-05-24 03:16:45,https://www.tiktok.com/@nicollesoficial/video/7507845802732031275
7507265750214675734,buildingmarina,"You never think it’s going to be you, until it’s you 🥺 #emiliekiser ",70200,582,779,720400,emiliekiser,I Don't Want to Miss a Thing,2025-05-22 13:45:21,https://www.tiktok.com/@buildingmarina/video/7507265750214675734
7502812022183103762,v8_archive,That's just disrespectful🤣😂 • • • 📸Credit:[ gfreeman94/Ig ] Important‼️:[All the videos uploaded on this page are not mine.All videos have been downloaded and then posted on this page.] ©️:[ I don't have any copyright to any of the video. If you have any query regarding copyright then DM me. ] #streetrace #rollrace #fordmustang #ford #shelbygt500 #corvette #corvettezr1 #corvettec6 #corvettecorvette #brutal #sound #v8 #v8engine #v8power #cartok #car #cars #carsontiktok #racing #motorsport #carguys #fyp #fouryou #automobile,76900,643,7637,1000000,"streetrace, rollrace, fordmustang, ford, shelbygt500, corvette, corvettezr1, corvettec6, corvettecorvette, brutal, sound, v8, v8engine, v8power, cartok, car, cars, carsontiktok, racing, motorsport, carguys, fyp, fouryou, automobile",suara asli - V8 Archive,2025-05-10 13:42:35,https://www.tiktok.com/@v8_archive/video/7502812022183103762
7507822406719982894,notchas19,#short #fypシ #viral #like #relatable #ilovemybf ,143900,2732,47500,1000000,"short, fypシ, viral, like, relatable, ilovemybf",оригинальный звук,2025-05-24 01:45:52,https://www.tiktok.com/@notchas19/video/7507822406719982894
7507261982324690222,ornitorrincoviral,,5054,1049,18800,641300,,sonido original,2025-05-22 13:30:57,https://www.tiktok.com/@ornitorrincoviral/video/7507261982324690222
7507734390097726763,jxyhrd,😂😂😂 #fyp #viral #relatable #funny ,64300,415,3095,349300,"fyp, viral, relatable, funny",original sound,2025-05-23 20:04:41,https://www.tiktok.com/@jxyhrd/video/7507734390097726763
7507439752090619167,juicedlive,,21400,295,1808,525200,,original sound,2025-05-23 01:00:47,https://www.tiktok.com/@juicedlive/video/7507439752090619167
7502341672060128517,rubenxd1428,,336500,5983,63000,11400000,,El Trompetista,2025-05-09 07:17:32,https://www.tiktok.com/@rubenxd1428/video/7502341672060128517
7506650635337583914,cartdabart,drop your craziest or funniest screenshot in the comments😭🙏 #fyp #foryoupage #viral #trend #trending ,755700,60600,17300,4700000,"fyp, foryoupage, viral, trend, trending",Dust Collector,2025-05-20 21:58:56,https://www.tiktok.com/@cartdabart/video/7506650635337583914
7507285777164815638,edii.sgmz,Vino para tapar vergüenzas y se va como una leyenda Gracias Modrić🤍👑  #modric #lukamodric #fyp #futbol⚽️ ,258500,930,2710,3000000,"modric, lukamodric, fyp, futbol⚽️",sonido original,2025-05-22 15:03:02,https://www.tiktok.com/@edii.sgmz/video/7507285777164815638
7507422151767624990,username292822929,#foryoupage #prom ,278800,1089,3844,825800,"foryoupage, prom",ShlT Talking Grateful,2025-05-22 23:52:27,https://www.tiktok.com/@username292822929/video/7507422151767624990
7506700615624740142,caaarolinneeee,#recipesoftiktok ,54900,535,8915,544800,recipesoftiktok,Get It Sexyy,2025-05-21 01:12:29,https://www.tiktok.com/@caaarolinneeee/video/7506700615624740142
7506723950555139358,gumurz,Ignore how chopped i amm #fyp #real #viral #bf #iluvhim #me ,78800,3281,7955,750300,"fyp, real, viral, bf, iluvhim, me",original sound,2025-05-21 02:43:00,https://www.tiktok.com/@gumurz/video/7506723950555139358
7506996274160274718,johnmicheal1996,Maintenance 101 with Ricky! Running doesn’t mean fixed! #rickyandtheboss #breadstickricky #roughneckroscoe ,71900,480,6826,506400,"rickyandtheboss, breadstickricky, roughneckroscoe",original sound,2025-05-21 20:19:46,https://www.tiktok.com/@johnmicheal1996/video/7506996274160274718
7507001077041057070,apstaxx,literally 😂 #apstaxx #fyp ,88100,543,5586,273600,"apstaxx, fyp",original sound,2025-05-21 20:38:26,https://www.tiktok.com/@apstaxx/video/7507001077041057070
7507529893417176350,esportscenter,The exact conversation EA is having about Battlefront 3 right now 😂 #gaming #gamer #games #battlefront #battlefront2 #starwars #ea ,144500,3777,2128,1200000,"gaming, gamer, games, battlefront, battlefront2, starwars, ea",original sound,2025-05-23 06:51:35,https://www.tiktok.com/@esportscenter/video/7507529893417176350
7505862297395465515,coolgirldisney,A dream 🇮🇹✨ #italy #rome #travel #roma #europe #vacation #traveltok ,142500,173,3976,774400,"italy, rome, travel, roma, europe, vacation, traveltok",original sound,2025-05-18 18:59:52,https://www.tiktok.com/@coolgirldisney/video/7505862297395465515
7507298794334276910,pistolstarter_,Mfs Crazy …..,49000,368,5540,288400,,original sound,2025-05-22 15:53:47,https://www.tiktok.com/@pistolstarter_/video/7507298794334276910
7507670584956947734,a_damn_rat,"When Teacher Izuku is in a bad mood, you better answer correctly. #mha #myheroacademia #bnha #bokunoheroacademia #bakugou #bakugoukatsuki #katsukibakugou #deku #izukumidoriya #midoriya #katsuki ",118700,325,3291,414200,"mha, myheroacademia, bnha, bokunoheroacademia, bakugou, bakugoukatsuki, katsukibakugou, deku, izukumidoriya, midoriya, katsuki",original sound,2025-05-23 15:56:20,https://www.tiktok.com/@a_damn_rat/video/7507670584956947734
7505307230464380182,majittova,instagram: @majittova🥹🥰,195500,7174,14900,3700000,,original sound,2025-05-17 07:05:22,https://www.tiktok.com/@majittova/video/7505307230464380182
7507080349197913374,caseyalexandramedia,RAW —> FINAL 📸 #before #after #beforeafter #beforeandafter #photography #photographer #grad #graduate #graduation #raw #rawphoto #final #finalphoto #portrait #portraitphotography #portraitphotographer #beach #beachphotoshoot #chi #chicity #chicago #chicagophotography #chicagophotographer #fy #foryou #fyp #foryoupage ,16500,50,38,315200,"before, after, beforeafter, beforeandafter, photography, photographer, grad, graduate, graduation, raw, rawphoto, final, finalphoto, portrait, portraitphotography, portraitphotographer, beach, beachphotoshoot, chi, chicity, chicago, chicagophotography, chicagophotographer, fy, foryou, fyp, foryoupage",original sound,2025-05-22 01:45:58,https://www.tiktok.com/@caseyalexandramedia/video/7507080349197913374
7506906099639930154,aleahcxo,Smh #fyp ,245200,872,48700,882000,fyp,AkanniFitness original sound,2025-05-21 14:29:53,https://www.tiktok.com/@aleahcxo/video/7506906099639930154
7507346876338064686,adamightspam,the wind is blowing me away ho #newengland #mass #funny #massachusetts #boston #fyp #relatable #real #weather #goviral #viral #famous ,63100,838,3290,275500,"newengland, mass, funny, massachusetts, boston, fyp, relatable, real, weather, goviral, viral, famous",original sound,2025-05-22 19:00:21,https://www.tiktok.com/@adamightspam/video/7507346876338064686
7497732560672394538,n1ckwilkins,bro missed the assignment ,405000,2240,3951,2800000,,original sound,2025-04-26 21:12:09,https://www.tiktok.com/@n1ckwilkins/video/7497732560672394538
7507796394279832878,clippinghq,scary stuff #fyp #n3on #adinross #ashtonhall ,94100,752,1619,1100000,"fyp, n3on, adinross, ashtonhall",childhood,2025-05-24 00:05:05,https://www.tiktok.com/@clippinghq/video/7507796394279832878
7507125252237872427,user383844872,oh did i mention that everyone is actually fake #fyp #real #freshman #2029 #2028 #highschool #fypシ゚viral #relatable #school ,161500,880,3958,558400,"fyp, real, freshman, 2029, 2028, highschool, fypシ゚viral, relatable, school",original sound,2025-05-22 04:40:59,https://www.tiktok.com/@user383844872/video/7507125252237872427
7507091157806025992,benjalazort_,Por supuesto que le dimos comida 🥹,710100,2068,134700,3800000,,Ojos Tristes,2025-05-22 02:27:53,https://www.tiktok.com/@benjalazort_/video/7507091157806025992
7507073349638556933,human.anatomy.for,#creatorsearchinsights #medical #medicaltiktok #medicalstudent #medicaldiagnosis #medicine #anatomy #fyp #medicalcondition #doctor ,3077,1592,391,716000,"creatorsearchinsights, medical, medicaltiktok, medicalstudent, medicaldiagnosis, medicine, anatomy, fyp, medicalcondition, doctor",Hello,2025-05-22 01:18:46,https://www.tiktok.com/@human.anatomy.for/video/7507073349638556933
7506787198327426334,kim46619,😂😂,56300,1318,30300,959000,,sonido original,2025-05-21 06:48:32,https://www.tiktok.com/@kim46619/video/7506787198327426334
7505127534196002079,goodhangwithamy,Who wouldn’t want an omelet from the White House kitchen?🍳 #cooking #omelette ,188800,1151,4850,2500000,"cooking, omelette",original sound,2025-05-16 19:28:05,https://www.tiktok.com/@goodhangwithamy/video/7505127534196002079
7505164531291720991,afraidofnowoman,massive w for the new pope,69400,950,1113,1500000,,around the world,2025-05-16 21:51:39,https://www.tiktok.com/@afraidofnowoman/video/7505164531291720991
7501816808178109742,camrynmontez,it’s a need not a want 😢 #shopping #needs #hoodies #organize #lululemon #viral #shopping #foryou #trending #iloveyou #imsorry #mall #haul #closet #dresser #fyp ,667700,598,37600,2800000,"shopping, needs, hoodies, organize, lululemon, viral, foryou, trending, iloveyou, imsorry, mall, haul, closet, dresser, fyp",original sound,2025-05-07 21:21:16,https://www.tiktok.com/@camrynmontez/video/7501816808178109742
7506348596678184234,realjayllnn,#dinner ,440400,3158,42000,4000000,dinner,original sound,2025-05-20 02:26:50,https://www.tiktok.com/@realjayllnn/video/7506348596678184234
7506360166648974638,karlalololol,i love witnessing moments like this 🥲 #graduation #collegegrad #rutgers ,405600,698,14400,1300000,"graduation, collegegrad, rutgers",scott street x i know the end,2025-05-20 03:11:49,https://www.tiktok.com/@karlalololol/video/7506360166648974638
7506000948137938218,hannahhhensley,#weldingtiktok #weldertok #weldernation #remotebox #t300 #stingerv #pancakehood #lincolnwelder #carfreshies ,55900,276,1327,599300,"weldingtiktok, weldertok, weldernation, remotebox, t300, stingerv, pancakehood, lincolnwelder, carfreshies",ECE Marketing Airball,2025-05-19 03:58:03,https://www.tiktok.com/@hannahhhensley/video/7506000948137938218
7507258013581937951,davishinklee,#fyp ,126100,230,7218,665900,fyp,original sound,2025-05-22 13:15:29,https://www.tiktok.com/@davishinklee/video/7507258013581937951
7507435682663664942,gilsarena,No switch ups here 🙅‍♂️💀 #fyp #pacers #knicks #playoffs #nba #indianapacers #trending ,58900,282,3209,386300,"fyp, pacers, knicks, playoffs, nba, indianapacers, trending",original sound,2025-05-23 00:45:05,https://www.tiktok.com/@gilsarena/video/7507435682663664942
7500770429536079150,stevosociety,there’s no way there real 😭,544200,2174,18600,4000000,,original sound,2025-05-05 01:40:35,https://www.tiktok.com/@stevosociety/video/7500770429536079150
7507713309555100946,chupakabramems,"Зеленоград — ""советская Силиконовая долина"". Он был основан в 1958 году как научно-промышленный центр и изначально создавался по образцу американского города Саннивейл — сердца будущей Кремниевой долины. Здесь разрабатывали первые советские микропроцессоры и чипы. #смешноевидео #прикол #мем #кружок #юмор ",85700,393,47500,914600,"смешноевидео, прикол, мем, кружок, юмор",оригинальный звук,2025-05-23 18:42:07,https://www.tiktok.com/@chupakabramems/video/7507713309555100946
7499813751844015366,bbnotiktok,#europapa #eurovision ,535700,3080,17400,3100000,"europapa, eurovision",Europapa,2025-05-02 11:47:49,https://www.tiktok.com/@bbnotiktok/video/7499813751844015366
7508042632669547781,southpark,Tegridy Burger: Burgers with Tegridy. #SouthPark,367900,1124,33300,2600000,southpark,original sound,2025-05-24 16:00:04,https://www.tiktok.com/@southpark/video/7508042632669547781
7507408745236811050,ukxzaezae,like girl can yall get tf on somewhere #fyp #foryoupage #viral ,165300,321,8993,420800,"fyp, foryoupage, viral",original sound,2025-05-22 23:00:20,https://www.tiktok.com/@ukxzaezae/video/7507408745236811050
7507678411259694367,therealkaigekline1,@P Dogg🐕🤓 #strokegamestrong💪 #wrestling #wrestlingtiktok #real #fyppoppppppppppppppppppppppp #fypシ #fypage #bestfriend #flowrestling #wrestlinlife #wyoming,205500,5701,59900,921300,"strokegamestrong💪, wrestling, wrestlingtiktok, real, fyppoppppppppppppppppppppppp, fypシ, fypage, bestfriend, flowrestling, wrestlinlife, wyoming",What you heard D E P R E D,2025-05-23 16:27:02,https://www.tiktok.com/@therealkaigekline1/video/7507678411259694367
7506867102100294958,helloimskylarr,,142200,343,12500,474300,,original sound - delusions,2025-05-21 11:58:34,https://www.tiktok.com/@helloimskylarr/video/7506867102100294958
7506644306044701994,naguhcqmvh0,I AIN NEVVAAA CARED#fypシ゚viral #real#yeezys#school,41600,337,634,276700,"fypシ゚viral, real, yeezys, school",original sound,2025-05-20 21:34:26,https://www.tiktok.com/@naguhcqmvh0/video/7506644306044701994
7506791575813459230,rachelboudwin,this how I entertain my guests @Anisha Cheema #enchanted #fyp ,645200,826,30200,3400000,"enchanted, fyp",original sound,2025-05-21 07:05:28,https://www.tiktok.com/@rachelboudwin/video/7506791575813459230
