video_id,author,description,likes,comments,shares,plays,hashtags,music,create_time,video_url
7507058337306053934,orland.94,@Justin H 🥷🏻🖤 el es un cielo ,136700,2390,2731,1300000,,sonido original,2025-05-22 00:20:38,https://www.tiktok.com/@orland.94/video/7507058337306053934
7500952381652323626,only1bkk,,413900,780,35100,2100000,,original sound,2025-05-05 13:27:46,https://www.tiktok.com/@only1bkk/video/7500952381652323626
7506612818771430702,middleeasternnpc,#inmiddleeeasternnpcwetrust #jooooooooooooooooooooooooosh #fyp #foryou #famous #relateable #famous #govirsl #viral #smile,93900,2393,10200,824100,"inmiddleeeasternnpcwetrust, jooooooooooooooooooooooooosh, fyp, foryou, famous, relateable, govirsl, viral, smile",original sound,2025-05-20 19:32:14,https://www.tiktok.com/@middleeasternnpc/video/7506612818771430702
7505577949282782495,amiri.da,,223200,1478,28600,1500000,,original sound,2025-05-18 00:36:00,https://www.tiktok.com/@amiri.da/video/7505577949282782495
7507340965447781663,sammantha713,My poor curly hair 💔 #curlyhead #curls #curlscurlscurls #straighthair #foryoupage #paratii #trend #viral #newhairwhodis #curlssssssssss ,84500,64,598,580200,"curlyhead, curls, curlscurlscurls, straighthair, foryoupage, paratii, trend, viral, newhairwhodis, curlssssssssss",deuces,2025-05-22 18:37:20,https://www.tiktok.com/@sammantha713/video/7507340965447781663
7507031054218251563,alle4627,can he clean his room #room #boi #fyp #gf ,133500,375,10700,432100,"room, boi, fyp, gf",Kiss me Sixpence None The Richer,2025-05-21 22:34:48,https://www.tiktok.com/@alle4627/video/7507031054218251563
7505790474712583467,aaronparnas1,5/18,92200,4524,17500,907600,,original sound,2025-05-18 14:21:16,https://www.tiktok.com/@aaronparnas1/video/7505790474712583467
7505792379404750111,manucicilia,😂😂🤦🏻‍♂️  #contenido #paratiiiiiiiiiiiiiiiiiiiiiiiiiiiiiii #fypage ,10600,0,5711,371500,"contenido, paratiiiiiiiiiiiiiiiiiiiiiiiiiiiiiii, fypage",sonido original,2025-05-18 14:28:20,https://www.tiktok.com/@manucicilia/video/7505792379404750111
7506373100683021599,sol8ce_,"Oh lover, you should’ve come over.",231600,1219,7474,1200000,,"Lover, You Should've Come Over",2025-05-20 04:01:48,https://www.tiktok.com/@sol8ce_/video/7506373100683021599
7505988324398583070,kadencefrminsta,#fy #fyp ,74300,411,11500,282200,"fy, fyp",Be My Baby,2025-05-19 03:08:39,https://www.tiktok.com/@kadencefrminsta/video/7505988324398583070
7506925064156089646,uongbotsandayconc,#movie #movieclips #foryou #fyp #fypシ ,205600,419,1638,4300000,"movie, movieclips, foryou, fyp, fypシ",original sound,2025-05-21 15:43:26,https://www.tiktok.com/@uongbotsandayconc/video/7506925064156089646
7506727254332935467,clipsnatchur,Tylil trying to explain to Ray the girl’s laced him#tylil #rayasianboy #viral #fyp ,39400,113,412,455300,"tylil, rayasianboy, viral, fyp",Night Trouble,2025-05-21 02:55:54,https://www.tiktok.com/@clipsnatchur/video/7506727254332935467
7507440798536060206,epicstream.clips,Ray needs to be stopped 😭❤️‍🩹 #indialove #rayasianboy #ray #kaicenat #fyp ,34600,75,157,558100,"indialove, rayasianboy, ray, kaicenat, fyp",Intervallo II,2025-05-23 01:05:03,https://www.tiktok.com/@epicstream.clips/video/7507440798536060206
7505381011060952350,lisa.lovebooks,Тгк: Lisa.lovebooks  #книжныйблогер #чтопочитать #буктокер #обзор #читаю #подборка #книжныйрек #книжныерекомендации  #библиотека #новыекниги #книжныерекомендации,42600,1321,15200,419300,"книжныйблогер, чтопочитать, буктокер, обзор, читаю, подборка, книжныйрек, книжныерекомендации, библиотека, новыекниги",оригинальный звук,2025-05-17 11:52:28,https://www.tiktok.com/@lisa.lovebooks/video/7505381011060952350
7506249329494002966,kat617568,,194000,756,34000,1100000,,swimming pools,2025-05-19 20:01:06,https://www.tiktok.com/@kat617568/video/7506249329494002966
7506262581670104338,yo549125,🤍 #valeriamarquez #bebidastarbucks ,129800,1223,1866,3400000,"valeriamarquez, bebidastarbucks",sonido original,2025-05-19 20:52:37,https://www.tiktok.com/@yo549125/video/7506262581670104338
7507341996407786798,jissire_xarmen,Another one thank yaaa!!! @Chadaaae💞 #jissire_xarmen #fypシ #blowthisup #viral #fyppppppppppppppppppppppp #dancechallenge #dance #highschool ,84700,217,2642,467400,"jissire_xarmen, fypシ, blowthisup, viral, fyppppppppppppppppppppppp, dancechallenge, dance, highschool",Rock Wit U (Awww Baby),2025-05-22 18:41:23,https://www.tiktok.com/@jissire_xarmen/video/7507341996407786798
7507422051662155038,trevinpeterson,DAY 26: Hole in one challenge highlights🔥 Here are some of the best shots of the 294 shots it took to make a hole in one ⛳️  #golf #golfchallenge #holeinone #kidsgolf ,320300,748,11800,3500000,"golf, golfchallenge, holeinone, kidsgolf",original sound,2025-05-22 23:51:59,https://www.tiktok.com/@trevinpeterson/video/7507422051662155038
7505559473071836462,dollyhiss,#fyp #relatable #goviral #trending #trend #foryourpage ,170700,1598,7452,730100,"fyp, relatable, goviral, trending, trend, foryourpage",original sound,2025-05-17 23:24:39,https://www.tiktok.com/@dollyhiss/video/7505559473071836462
7506513533123775774,dippedbyryder,make a $448 order w me as a 15 year old treat maker 🙂‍↔️ #dippedbyryder #treatmaker #chocolatecoveredtreats #youngentrepreneur #buisnessowner #chocolatecovered #foryourpage #fyp ,45300,291,722,669900,"dippedbyryder, treatmaker, chocolatecoveredtreats, youngentrepreneur, buisnessowner, chocolatecovered, foryourpage, fyp",original sound,2025-05-20 13:07:02,https://www.tiktok.com/@dippedbyryder/video/7506513533123775774
7505594098275994885,masterwilly6,#funny#fyp#relatable#meme#cyber,286100,5356,32000,1500000,"funny, fyp, relatable, meme, cyber",original sound,2025-05-18 01:38:31,https://www.tiktok.com/@masterwilly6/video/7505594098275994885
7505835137465191703,brandonplayspiano,Look What You’ve Done by Drake - Piano Cover #drake #raptok #pianocover ,390700,2590,36300,1800000,"drake, raptok, pianocover",original sound,2025-05-18 17:13:50,https://www.tiktok.com/@brandonplayspiano/video/7505835137465191703
7506521567220845855,motivercity89en,Tag a someone who’s always pushing you to be a better version of yourself ! #dewaynenoel #motivation #jordanpetersonquotes #happiness #motivationalquotesandsayings #hustlehard #powerfulquotes #peace #quotelife #love #loyalty #foryou #TI #mindest #lifelessons #lifeadvice #lifelesson #lifeadvices #motivercity89 #motivercity89en,105200,659,52300,1200000,"dewaynenoel, motivation, jordanpetersonquotes, happiness, motivationalquotesandsayings, hustlehard, powerfulquotes, peace, quotelife, love, loyalty, foryou, ti, mindest, lifelessons, lifeadvice, lifelesson, lifeadvices, motivercity89, motivercity89en",original sound - MOTIVERCITY89EN,2025-05-20 20:00:00,https://www.tiktok.com/@motivercity89en/video/7506521567220845855
7506324833999850794,.madeline_,sorry i’m so obsessed with you @Dalton ,201000,871,41800,677800,,dont make me drink alone,2025-05-20 00:54:33,https://www.tiktok.com/@.madeline_/video/7506324833999850794
7506687590980996394,49ers,Are we all just collectively crying now? 😭🥹 #BrockPurdy #Family #Emotional #Wholesome #HopeCore ,62800,166,756,496400,"brockpurdy, family, emotional, wholesome, hopecore",The Champion,2025-05-21 00:21:58,https://www.tiktok.com/@49ers/video/7506687590980996394
7506575056760245550,reeganpawlicki,Thanks boo #watermelon #summervibes #fyp ,16600,445,284,279000,"watermelon, summervibes, fyp",original sound,2025-05-20 17:05:57,https://www.tiktok.com/@reeganpawlicki/video/7506575056760245550
7507014248036338974,caroline_easom,It’s not an art or a science but it is hurtful! #coloranalysis #fyp #pov #asmr ,413900,756,8418,2300000,"coloranalysis, fyp, pov, asmr",original sound,2025-05-21 21:29:28,https://www.tiktok.com/@caroline_easom/video/7507014248036338974
7507041388714872106,im_doing_marbleous,Accurate? #nba #basketball #knicks #pacers #thunder #timberwolves #okc #oklahomacity #indianapacers #newyorkknicks #nbafinals #nbaplayoffs ,8301,114,304,688100,"nba, basketball, knicks, pacers, thunder, timberwolves, okc, oklahomacity, indianapacers, newyorkknicks, nbafinals, nbaplayoffs",original sound,2025-05-21 23:14:51,https://www.tiktok.com/@im_doing_marbleous/video/7507041388714872106
7505889223715769646,taylor.ridgley,,137800,26800,13900,598300,,"Stress, tension, suspense, mystery",2025-05-18 20:44:16,https://www.tiktok.com/@taylor.ridgley/video/7505889223715769646
7506692070036426030,thejaysalazar,@Chili’s Grill & Bar for the win! #cheesepull #mozzerellasticks ,24200,463,2610,737400,"cheesepull, mozzerellasticks",original sound,2025-05-21 00:39:20,https://www.tiktok.com/@thejaysalazar/video/7506692070036426030
7505880471117499678,carlos_eduardo_espina,Los migrantes si pueden viajar por avión dentro de Estados Unidos 🤔🇺🇸,97000,2481,10600,2300000,,original sound,2025-05-18 20:09:59,https://www.tiktok.com/@carlos_eduardo_espina/video/7505880471117499678
7504123655044091182,setsbyjanailz,"ms girl nails done, lashes on & blinged up😜 #labubu #nails ",321300,2063,43500,1700000,"labubu, nails",Bunna Summa,2025-05-14 02:32:50,https://www.tiktok.com/@setsbyjanailz/video/7504123655044091182
7505813088365530410,cure921,#tiktok #foryou ,152400,799,676,2600000,"tiktok, foryou",original sound,2025-05-18 15:48:49,https://www.tiktok.com/@cure921/video/7505813088365530410
7505857788288044293,esimkhaan_04,Ловзар Актобе @iriskaan #ловзар #Лезгинка #lezginka ,155000,553,3581,1800000,"ловзар, лезгинка, lezginka",оригинальный звук,2025-05-18 18:41:47,https://www.tiktok.com/@esimkhaan_04/video/7505857788288044293
7505792396177722654,daalmightypat,Offended 🔥w/@imotion 1 #daalmightypat #fyp #foryou #dance #dancechallenge #viral #trending ,172300,515,10400,912900,"daalmightypat, fyp, foryou, dance, dancechallenge, viral, trending",original sound - sonastral,2025-05-18 14:28:23,https://www.tiktok.com/@daalmightypat/video/7505792396177722654
7506068707064433927,sneezyy696,Арт на футболку: 382210876 #юмор #др ,146500,563,51600,767800,"юмор, др",เสียงต้นฉบับ - John (Songs Station),2025-05-19 08:20:13,https://www.tiktok.com/@sneezyy696/video/7506068707064433927
7505525488903834902,talesoftheunexplained0,"This doll was so dangerous, they locked it away forever. And no, it’s NOT the one from the movie. Would you dare visit Annabelle? #HauntedObject #Annabelle #TrueStory #CreepyTikTok #Paranormal #HauntedDoll #RealHorror #EdAndLorraineWarren #Occult #ScaryStory #fyp ",107800,6238,3563,1500000,"hauntedobject, annabelle, truestory, creepytiktok, paranormal, haunteddoll, realhorror, edandlorrainewarren, occult, scarystory, fyp",Horror Sound Music,2025-05-17 21:12:15,https://www.tiktok.com/@talesoftheunexplained0/video/7505525488903834902
7506562361591942431,katekatekate_______,The BEST gluten free donuts. 🍩🤤💕 @Bismarck Doughnuts #donuts #donutshop #disney #beignets #tiana #princessandthefrog #glutenfree #celiac #celiacdisease #celiactiktok #gf #glutenfreelife #glutenfreedonuts #glutenfreebeignets ,83700,545,2979,1200000,"donuts, donutshop, disney, beignets, tiana, princessandthefrog, glutenfree, celiac, celiacdisease, celiactiktok, gf, glutenfreelife, glutenfreedonuts, glutenfreebeignets",Almost there,2025-05-20 16:16:12,https://www.tiktok.com/@katekatekate_______/video/7506562361591942431
7505555965702475016,carlaerandigr,Nimodillo @Alex Mora Así es esto 🤣🤣🤣,834200,5473,6907,13100000,,sonido original,2025-05-17 23:10:35,https://www.tiktok.com/@carlaerandigr/video/7505555965702475016
7505998229398457631,urlocalweirdolostflies,happy birthday to my yb you know you my mf yb😂 #fyp ,66000,1245,12100,284900,fyp,original sound,2025-05-19 03:47:00,https://www.tiktok.com/@urlocalweirdolostflies/video/7505998229398457631
7505917438756654367,itsrainwolff,let’s gooo #foryou #trending #viral #allstar #dance #worldchampion #usasfworlds ,23000,1325,60,237500,"foryou, trending, viral, allstar, dance, worldchampion, usasfworlds",original sound,2025-05-18 22:33:24,https://www.tiktok.com/@itsrainwolff/video/7505917438756654367
7507043716327034117,happy.lorik,#fyp ,118900,3413,4072,2200000,fyp,DEFEATED,2025-05-21 23:23:46,https://www.tiktok.com/@happy.lorik/video/7507043716327034117
7506845762312015160,281imb,@JANIN @кстати катя ,212100,1147,47000,1400000,,оригинальный звук,2025-05-21 10:35:37,https://www.tiktok.com/@281imb/video/7506845762312015160
7507016535010069790,aaronchiz,THIS WAS WILD 💀 #mariokart8deluxe #mariokartwii #mariokartchallenge #mariokart #fypシ ,94900,189,2899,1400000,"mariokart8deluxe, mariokartwii, mariokartchallenge, mariokart, fypシ",original sound,2025-05-21 21:38:25,https://www.tiktok.com/@aaronchiz/video/7507016535010069790
7505455143987547414,em.ma509,Chatt am i cooked?!!#fyp #f #chat #gpt #GPT #chatgpt #chatGPT #faster #quick #shorter #illnes #mentalhealth ,513900,2703,115900,3200000,"fyp, f, chat, gpt, chatgpt, faster, quick, shorter, illnes, mentalhealth",no surprises by radiohead,2025-05-17 16:39:16,https://www.tiktok.com/@em.ma509/video/7505455143987547414
7506102686618586410,worldnews3669,#annabelle #doll #neworleans #fafo #why #wtf #fyp #foryoupage #news #tiktok ,59500,1557,13300,1200000,"annabelle, doll, neworleans, fafo, why, wtf, fyp, foryoupage, news, tiktok",original sound,2025-05-19 10:34:39,https://www.tiktok.com/@worldnews3669/video/7506102686618586410
7507469678432750891,taraswrld,95% is devastating im never getting out of that site fr😭,60000,169,205,700800,,original sound,2025-05-23 02:57:13,https://www.tiktok.com/@taraswrld/video/7507469678432750891
7501058300742470958,itz_justlola,How do I explain I wanna be a teenage girl forever just not in highschool 😁,692800,1218,33100,4300000,,som original,2025-05-05 20:17:54,https://www.tiktok.com/@itz_justlola/video/7501058300742470958
7506347159328001310,user50452901979403,Replying to @trashboat Taylor really did that... #taylorfrankiepaul #whitneyleavitt #momtok #drama,67000,469,1178,1900000,"taylorfrankiepaul, whitneyleavitt, momtok, drama",original sound,2025-05-20 02:21:03,https://www.tiktok.com/@user50452901979403/video/7506347159328001310
7505462899360435511,mosqcentro_ec,🥸,135600,711,57000,2200000,,sonido original,2025-05-17 17:09:24,https://www.tiktok.com/@mosqcentro_ec/video/7505462899360435511
7506542966614510894,barstoolsports,Bro glitched 💀 @Rubbin’ is Racing (via:@BobbyScootz) ,108200,3572,18300,2500000,,original sound,2025-05-20 15:01:43,https://www.tiktok.com/@barstoolsports/video/7506542966614510894
7506291861447855406,theestallion,,119100,0,9581,1200000,,original sound - Megan Thee Stallion,2025-05-19 22:46:47,https://www.tiktok.com/@theestallion/video/7506291861447855406
7506555400523681070,sydthekid2210,My husband is gonna be rich so I’ll only work 10’s in my early 20s😅🫡#welder #girlwelder #bankroll #bigmoney #husband #weldislife,56200,337,459,304200,"welder, girlwelder, bankroll, bigmoney, husband, weldislife",original sound,2025-05-20 15:49:30,https://www.tiktok.com/@sydthekid2210/video/7506555400523681070
7505902044876934446,alyssandallin,Replying to @nintsen she wanted to play hide and seek the whole time 🤣 but hopefully this makes sense! ,83900,71,331,574200,,夏とブランチ (Acoustic),2025-05-18 21:34:16,https://www.tiktok.com/@alyssandallin/video/7505902044876934446
7505218313962802463,3purxpii,#greenscreen ,156100,829,1442,1800000,greenscreen,original sound,2025-05-17 01:20:31,https://www.tiktok.com/@3purxpii/video/7505218313962802463
7505557976896392490,intotheelements,"As someone who solo backpacks & camps a lot, I always pull my zippers to the top and either loop them into each other or use a small carabiner to make sure my doors are “locked”  #backpacking #solofemaletraveler #backpackinghacks #femaletraveler #hacksandtips ",7299,960,57,323600,"backpacking, solofemaletraveler, backpackinghacks, femaletraveler, hacksandtips",Take My Hand,2025-05-17 23:18:54,https://www.tiktok.com/@intotheelements/video/7505557976896392490
7500372543962942750,add1s0n.b_22,#xyzbca ,90700,1366,3753,1800000,xyzbca,unfazed by jankai,2025-05-03 23:56:27,https://www.tiktok.com/@add1s0n.b_22/video/7500372543962942750
7495658359064907029,dy14zz,,325400,187,11500,1400000,,original sound,2025-04-21 07:02:52,https://www.tiktok.com/@dy14zz/video/7495658359064907029
7505458296891919621,..boys_yard,"ради них , зхоть звезду с неба  наш тгк: https://t.me/zhwachkka#fupシ #fakebodyy⚠️ #танцы #мирдружбажвачка #origamidance @алекса🫶🏻 @moska.a ",188800,262,49800,1200000,"fupシ, fakebodyy⚠️, танцы, мирдружбажвачка, origamidance",оригинальный звук,2025-05-17 16:51:32,https://www.tiktok.com/@..boys_yard/video/7505458296891919621
7507297658042699038,kavni1987,I am so irritated pray for me 🙏🏾🙏🏾🙏🏾 #fyp #explorepage #graduation #motherhood #fatherhood ,49500,2142,20100,507500,"fyp, explorepage, graduation, motherhood, fatherhood",Set It Off,2025-05-22 15:49:18,https://www.tiktok.com/@kavni1987/video/7507297658042699038
7505379672084040981,_nyan_master_,Вейдер что делал? #fortnite #darthvader #fortnitedarthvader #aidarthvader ,91400,322,49900,715400,"fortnite, darthvader, fortnitedarthvader, aidarthvader",оригинальный звук,2025-05-17 11:46:26,https://www.tiktok.com/@_nyan_master_/video/7505379672084040981
7507486704769535278,alyzzahh,I’m gonna crash out,61800,247,619,541600,,buddah lovazzz,2025-05-23 04:03:20,https://www.tiktok.com/@alyzzahh/video/7507486704769535278
7506499254765112594,homehusbands,"We’re not just making it pretty, we’re making it ours! ✨💫 #husbands #renovations #hometransformation ",358200,2637,55100,2100000,"husbands, renovations, hometransformation",original sound,2025-05-20 12:10:57,https://www.tiktok.com/@homehusbands/video/7506499254765112594
7507224946553261320,alexworkeroff,,114900,1017,23600,1600000,,оригинальный звук,2025-05-22 11:06:59,https://www.tiktok.com/@alexworkeroff/video/7507224946553261320
7507006856628309270,jammydodged,Client did this today so thought it was fitting to make this #foryoupage #fyp #trending #irish #tattoo #viral #uk #houseoftiktok ,874900,7083,40500,6400000,"foryoupage, fyp, trending, irish, tattoo, viral, uk, houseoftiktok",original sound,2025-05-21 21:00:42,https://www.tiktok.com/@jammydodged/video/7507006856628309270
7506130926171180334,cowgirlbarista,"Hi, I’m Nicole and I own a coffee stand in a tiny town in Oregon - Damascus! I had the idea of a bucket sized coffee and it kinda broke the internet! Now coffee shops all around the states are adding buckets to their menu! 🫶🏼#coffee #oregon #coffeetiktok #oregoncoffee #pnw #pnwcoffee #bucketcoffee #bucketcoffee #cowgirlbaristacoffee ",16500,1113,1064,361900,"coffee, oregon, coffeetiktok, oregoncoffee, pnw, pnwcoffee, bucketcoffee, cowgirlbaristacoffee",Nice To Meet You,2025-05-19 12:22:48,https://www.tiktok.com/@cowgirlbarista/video/7506130926171180334
7505119084405673259,chelsealiyah,#nigeriantiktok #yorubatiktok #blackgirl #inspo #naijatiktok #goviral #africanpromdress #explorepage #prom2k25 #2k25 #igbo #234 #fypシ ,164200,2322,2319,1500000,"nigeriantiktok, yorubatiktok, blackgirl, inspo, naijatiktok, goviral, africanpromdress, explorepage, prom2k25, 2k25, igbo, 234, fypシ",My Darling,2025-05-16 18:55:20,https://www.tiktok.com/@chelsealiyah/video/7505119084405673259
7506339508170886407,diariocambio,El curandero milagroso que asombra a Puebla: vino de Rumania y usa su energía con las manos ➡️ Más información en: diariocambio.com.mx #diariocambio #Puebla #pueblamexico #alerta #noticias #noticiaspuebla #noticiastiktok #viral #viralvideo #tiktoknews #tiktokinformativo #ParatiViral #México #tendencia #poblanos #curandero #rumania #quitadolores ,365200,11800,122300,7600000,"diariocambio, puebla, pueblamexico, alerta, noticias, noticiaspuebla, noticiastiktok, viral, viralvideo, tiktoknews, tiktokinformativo, parativiral, méxico, tendencia, poblanos, curandero, rumania, quitadolores",sonido original,2025-05-20 01:51:05,https://www.tiktok.com/@diariocambio/video/7506339508170886407
7505448198178196778,mama._.liz,Like guys let the man have a minute to BREATHE 😩😭 #sotr #sunriseonthereaping #sunriseonthereapingtrailer #suzannecollins #hungergames #thehungergames #balladofsongbirdsandsnakes #theballadofsongbirdsandsnakes #tbosas #hungergamesmovies #hungergamesedit #sunriseonthereapingedit #haymitchabernathy #katnisseverdeen #lenoredove #maysileedonner #thehungergamesmovies #booktok #books #newmovie #newhungergamesmovie #fyp #foryou #movietrailer #fypage #fypシ #viral #trend #trending #trendingaudio #trendingsound #viralaudio #viralsound #mockingjay #catchingfire #hungergamesofficial #thehungergamesofficial #hungergamesaccount #kiefersutherland #hugergamescasting #sunriseonthereapingcasting #casting #donaldsutherland ,40800,135,188,305800,"sotr, sunriseonthereaping, sunriseonthereapingtrailer, suzannecollins, hungergames, thehungergames, balladofsongbirdsandsnakes, theballadofsongbirdsandsnakes, tbosas, hungergamesmovies, hungergamesedit, sunriseonthereapingedit, haymitchabernathy, katnisseverdeen, lenoredove, maysileedonner, thehungergamesmovies, booktok, books, newmovie, newhungergamesmovie, fyp, foryou, movietrailer, fypage, fypシ, viral, trend, trending, trendingaudio, trendingsound, viralaudio, viralsound, mockingjay, catchingfire, hungergamesofficial, thehungergamesofficial, hungergamesaccount, kiefersutherland, hugergamescasting, sunriseonthereapingcasting, casting, donaldsutherland",i ABSOLUTELY have to,2025-05-17 16:12:52,https://www.tiktok.com/@mama._.liz/video/7505448198178196778
7507186769683680543,maitchii,i think it's because i've been here once a month for 4 months straight wearing the same dress and always overordering 😭😭😭😭 #kbbq #ayce #chubbycattle ,46300,92,4937,338900,"kbbq, ayce, chubbycattle",original sound,2025-05-22 08:40:33,https://www.tiktok.com/@maitchii/video/7507186769683680543
7507076141228805383,jazmitorrex_,Y Fack pal suelo😭💔#foryoupage #viralvideos #huapangos #fyp #bailes #parati #fyp #caidas #leongto #mexico ,94100,814,11600,1300000,"foryoupage, viralvideos, huapangos, fyp, bailes, parati, caidas, leongto, mexico",original sound,2025-05-22 01:29:36,https://www.tiktok.com/@jazmitorrex_/video/7507076141228805383
7506623806736321838,trintheweirdo,I truly believe they’d do the most f*** the rules  😭  #jjk #jujustukaisen #sukunaryomen #uraume #anime #mang ,192100,1006,6231,675200,"jjk, jujustukaisen, sukunaryomen, uraume, anime, mang",original sound,2025-05-20 20:14:59,https://www.tiktok.com/@trintheweirdo/video/7506623806736321838
