video_id,author,description,likes,comments,shares,plays,hashtags,music,create_time,video_url
7506172993769442566,katelyn.wieler,#greenscreen • Creator Nottoway plantation #nottowayplantation #plantation #haunted #conjuringhorror #conjuring #theconjuring2 #theconjuring3 #theconjuringuniverse #theconjuringhouse #thecojuring3 #theconjuring4 #ghosts #samandcolby #samandcolbyedit #ghosthunters ,976900,6431,56800,5200000,"greenscreen, nottowayplantation, plantation, haunted, ConjuringHorror, conjuring, theconjuring2, theconjuring3, theconjuringuniverse, theconjuringhouse, thecojuring3, theconjuring4, ghosts, samandcolby, samandcolbyedit, ghosthunters",original sound,2025-05-19 15:04:56,https://www.tiktok.com/@katelyn.wieler/video/7506172993769442566
7506078647879519495,mix_flizzz,Mr Beast 🧎🏻‍♀️‍➡️#video #mrbeast #fyp ,1800000,6916,72000,15500000,"video, mrbeast, fyp",original sound,2025-05-19 08:58:48,https://www.tiktok.com/@mix_flizzz/video/7506078647879519495
7507928141336169735,marishkakhum_,😳,108600,918,554,1800000,,original sound - Neon,2025-05-24 08:35:47,https://www.tiktok.com/@marishkakhum_/video/7507928141336169735
7507817819426295082,piperrockelle,#fyp ,249400,1380,3316,2200000,fyp,Head in a Jar,2025-05-24 01:28:11,https://www.tiktok.com/@piperrockelle/video/7507817819426295082
7496973337717951790,n1ckwilkins,sign us up for Americans got talent 🤩🥲,457100,2426,10200,3400000,,original sound,2025-04-24 20:05:42,https://www.tiktok.com/@n1ckwilkins/video/7496973337717951790
7507401761884359966,the.crf.125cc,I need money though#fyppppppppppppppppppppppp #fyp #famous #dontletthisflop #dirtbike #lockin ,14500,139,700,366400,"fyppppppppppppppppppppppp, fyp, famous, dontletthisflop, dirtbike, lockin",original sound,2025-05-22 22:33:18,https://www.tiktok.com/@the.crf.125cc/video/7507401761884359966
7507780367789755653,camilocifuentes96,Repartiendo donitas en la calle. Su TikTok @Little Sweet Donuts  #paratii #foryoupage #videoviral ,1400000,32100,19100,12500000,"paratii, foryoupage, videoviral",original sound,2025-05-23 23:02:23,https://www.tiktok.com/@camilocifuentes96/video/7507780367789755653
7507757137133686047,imalex.2,yay part of the pink fishing rod 💗🐟🎣#fishing #pinkrod #makemefamous #likemyvideos💫 #fyp ,75000,159,8027,515200,"fishing, pinkrod, makemefamous, likemyvideos💫, fyp",sonido original,2025-05-23 21:32:31,https://www.tiktok.com/@imalex.2/video/7507757137133686047
7505847680229215510,ethan.allen42,Always,204200,542,112700,1700000,,original sound,2025-05-18 18:02:29,https://www.tiktok.com/@ethan.allen42/video/7505847680229215510
7507390062317931807,removefac,#streameruniversity #kaicenat #twitch #fypシ #campus ,20700,183,186,913600,"streameruniversity, kaicenat, twitch, fypシ, campus",original sound,2025-05-22 21:47:50,https://www.tiktok.com/@removefac/video/7507390062317931807
7506889766458215711,joshuacgrace,But growing your own food is kinda gangsta right ?  #gardentok #plantlover #garden #farming #homestead ,140900,3323,46900,1100000,"gardentok, plantlover, garden, farming, homestead",Notorious Thugs (2014 Remaster),2025-05-21 13:26:33,https://www.tiktok.com/@joshuacgrace/video/7506889766458215711
7504924429101600046,rain.drop318,They really don’t play about there nephew ❤️ ,159900,9193,2246,739400,,I Love You So,2025-05-16 06:21:16,https://www.tiktok.com/@rain.drop318/video/7504924429101600046
7500649637439720746,miranda.lopezxx,I fear he may rock it better than me…..,1100000,2353,37100,7000000,,original sound,2025-05-04 17:51:56,https://www.tiktok.com/@miranda.lopezxx/video/7500649637439720746
7507051311049805102,philo.deeja,Drinks a solid 10/10. I’ll be getting one everyday #dunkin #mangolassi #coffee #fyp #trending @Dunkin' ,95000,715,18000,782900,"dunkin, mangolassi, coffee, fyp, trending",original sound,2025-05-21 23:53:22,https://www.tiktok.com/@philo.deeja/video/7507051311049805102
7500465622963326238,alanadcqvzk,@Mr Kap #viral ,171600,539,1740,2800000,viral,original sound,2025-05-04 05:58:04,https://www.tiktok.com/@alanadcqvzk/video/7500465622963326238
7498762174974676246,lucinda,zoom did its thing,1300000,481,11600,6200000,,original sound,2025-04-29 15:47:06,https://www.tiktok.com/@lucinda/video/7498762174974676246
7505344261999676678,nisakki1,"Животные — это удивительные существа, которые обитают на нашей планете и играют важную роль в экосистемах. Вот несколько интересных фактов о животных: ### Классификация 1. **Млекопитающие** - теплокровные животные с волосяным покровом. Примеры: львы, слоны, дельфины. 2. **Птицы** - пернатые существа, большинство из которых умеет летать. Примеры: орлы, пингвины, попугай. 3. **Рептилии** - холоднокровные позвоночные. Примеры: крокодилы, змеи, ящерицы. 4. **Амфибии** - животные, которые живут как на суше, так и в воде. Примеры: лягушки, саламандры. 5. **Насекомые** - самый многочисленный класс животных. Примеры: мухи, бабочки, пчёлы. ### Уникальные способности - **Дельфины** используют эхолокацию для навигации и общения. - **Совы** могут поворачивать голову на 270 градусов благодаря специальным шейным позвонкам. - **Камбала** может менять цвет и текстуру кожи для маскировки. ### ЗапThreat  Защитите разнообразие! Многие виды животных находятся под угрозой исчезновения из-за изменения климата, потерь среды обитания и охоты. Сохранение биологических видов имеет важное значение для здоровья всей планеты. Если вас интересует определённая группа животных или их поведение, не стесняйтесь спрашивать! #fyp #животные ",129800,566,44500,1700000,"fyp, животные",Потеряшка,2025-05-17 09:29:03,https://www.tiktok.com/@nisakki1/video/7505344261999676678
7507199702622866710,doseofdoxy,#tattoos #airball #foryoupage❤️❤️ #girlswithtattoos ,145700,11200,69700,2000000,"tattoos, airball, foryoupage❤️❤️, girlswithtattoos",ECE Marketing Airball,2025-05-22 09:29:04,https://www.tiktok.com/@doseofdoxy/video/7507199702622866710
7507316174590381358,goodluckkarly,i’m sorry i’m a coconut water denier idk how you guys do it. i #DontBelieve ,146800,4114,22200,1000000,dontbelieve,original sound,2025-05-22 17:01:14,https://www.tiktok.com/@goodluckkarly/video/7507316174590381358
7507322691272199455,ginagabris,Trying to teach Colleen some manners and how to say thank you in Spanish… that went well 🤦‍♀️😂#fyp #downsyndrome #sodownimup #extrachromiehomie #extrachromesome #extracheomosomeextrafun ,39100,621,20400,599800,"fyp, downsyndrome, sodownimup, extrachromiehomie, extrachromesome, extracheomosomeextrafun",original sound,2025-05-22 17:26:30,https://www.tiktok.com/@ginagabris/video/7507322691272199455
7507437913970543918,deltonamusic,being @Mrs. Miller ☻ helper is just as rewarding 🤝🏼 #teacher #fyp #country #band #deltona #teachertok #classroom ,23500,45,171,224900,"teacher, fyp, country, band, deltona, teachertok, classroom",Funny,2025-05-23 00:53:51,https://www.tiktok.com/@deltonamusic/video/7507437913970543918
7507178753315867911,wenkkekk,я#щитпост #щп #fyp #соевоемясо #латяо ,254300,1125,49400,2000000,"щитпост, щп, fyp, соевоемясо, латяо",оригинальный звук,2025-05-22 08:07:45,https://www.tiktok.com/@wenkkekk/video/7507178753315867911
7505159771197017374,annessupersecretacc,#fyp #fyppppppppppppppppppppppp #relateable #trending #fypdongggggggg #fyppp #reposting #tan #reposts ,171000,689,10500,738700,"fyp, fyppppppppppppppppppppppp, relateable, trending, fypdongggggggg, fyppp, reposting, tan, reposts",STOP ATTACKING ME,2025-05-16 21:33:11,https://www.tiktok.com/@annessupersecretacc/video/7505159771197017374
7507711208556907822,denzelcrispy,“Different strokes for different folks!” #cher #future #parody #reenactment @gap @Cher @Future ,196200,1930,22800,924500,"cher, future, parody, reenactment",original sound,2025-05-23 18:34:32,https://www.tiktok.com/@denzelcrispy/video/7507711208556907822
7507149988930129195,imsotiredofts8,#pupusas #p #u #p #u #s #a #s #viral #fyp #xyzbca #fypシ #elsalvador🇸🇻 ,358800,1730,52300,1300000,"pupusas, p, u, s, A, viral, fyp, xyzbca, fypシ, elsalvador🇸🇻",original sound,2025-05-22 06:18:15,https://www.tiktok.com/@imsotiredofts8/video/7507149988930129195
7507431659176840470,ih3artamber,,924700,6383,18900,3700000,,original sound,2025-05-23 00:29:33,https://www.tiktok.com/@ih3artamber/video/7507431659176840470
7507826014400105771,brwalkoff,Braves went on to lose 2-1 💔 #baseball #mlb #mlbtheshow #baseballszn #baseballlife #homerun #braves #atlanta #padres ,30600,277,1563,575200,"baseball, mlb, mlbtheshow, baseballszn, baseballlife, homerun, braves, atlanta, padres",original sound,2025-05-24 01:59:54,https://www.tiktok.com/@brwalkoff/video/7507826014400105771
7506002623686823198,jel1xe,#авто #автоприколы #приколы ,104000,557,25300,916300,"авто, автоприколы, приколы",оригинальный звук,2025-05-19 04:04:07,https://www.tiktok.com/@jel1xe/video/7506002623686823198
7507136596370607403,_nonchalantcreep_,I still think this piercing is ugly #bodymodsoftiktok #piercingtok #fypシ゚viral ,38000,328,1014,935000,"bodymodsoftiktok, piercingtok, fypシ゚viral",original sound,2025-05-22 05:25:29,https://www.tiktok.com/@_nonchalantcreep_/video/7507136596370607403
7499896622311116063,zyclockedit,They literally had to trick her into coming here just so I can get my fade 😂😂 #fyp #foryoupage #relatable #messy #messytiktok #messytok ,1200000,7511,17400,9400000,"fyp, foryoupage, relatable, messy, messytiktok, messytok",OD CRASHIN,2025-05-02 17:09:56,https://www.tiktok.com/@zyclockedit/video/7499896622311116063
7507442101420887338,itzmicahw,nah we twins #viral #fyp #itzmicahw #famous #boondocks #twins,115200,1382,20500,771400,"viral, fyp, itzmicahw, famous, boondocks, twins",original sound,2025-05-23 01:10:11,https://www.tiktok.com/@itzmicahw/video/7507442101420887338
7507746017996098862,thepitmansisters,Try the KPop Demon Hunters Dance Challenge and watch the film on @Netflix !! #NetflixPartner @TWICE ,62400,162,754,2700000,netflixpartner,TAKEDOWN by JEONGYEON JIHYO CHAEYOUNG of TWICE,2025-05-23 20:49:42,https://www.tiktok.com/@thepitmansisters/video/7507746017996098862
7507243121571564846,fiscooemo,Which is your favorite tag? #metroboomin #producer #tag #song #top10 #rapper #album #review #rating #ranking #fiscooemo #rap #hiphop #rnb #music ,107400,387,2312,1200000,"metroboomin, producer, tag, song, top10, rapper, album, review, rating, ranking, fiscooemo, rap, hiphop, rnb, music",Superhero (Heroes & Villains) - Instrumental,2025-05-22 12:17:47,https://www.tiktok.com/@fiscooemo/video/7507243121571564846
7507402175778245930,username1252720301,ok wtf.. this year was interesting #fyp #8thgrade #middleschool ,178900,654,1537,883600,"fyp, 8thgrade, middleschool",original sound,2025-05-22 22:34:56,https://www.tiktok.com/@username1252720301/video/7507402175778245930
7507131507207638290,zazoootxt,,42700,956,9836,565300,"7grade, 2026, fyp, fyppppppppppppppppppppppp, foryoupage, xybca, graduation, rowadalkhaleejdammam",الصوت الأصلي,2025-05-22 05:04:26,https://www.tiktok.com/@zazoootxt/video/7507131507207638290
7507640214299462955,lataayy,and we went to different hs #graduation #graduate #friendshipgoals ,154800,827,22100,854900,"graduation, graduate, friendshipgoals",original sound,2025-05-23 13:59:48,https://www.tiktok.com/@lataayy/video/7507640214299462955
7504034584560979230,kayleeaaron,Give me ur best recs plzz #summertan #fypシ #summervibes #sun #sunscreen #tanningoil #tanner #selftanner ,33300,650,213,801100,"summertan, fypシ, summervibes, sun, sunscreen, tanningoil, tanner, selftanner",original sound,2025-05-13 20:47:13,https://www.tiktok.com/@kayleeaaron/video/7504034584560979230
7498425511878659350,dreamhavenx,Which pool do you chill in for hours? 🥶🥶 #lockdown #interiordesign #nostalgia #architecture #dreamhome @𝑉𝐴𝑃𝑂𝑅𝐴𝑀𝐴 夢想 ,81300,5232,65600,1700000,"lockdown, interiordesign, nostalgia, architecture, dreamhome",Originalton,2025-04-28 18:00:43,https://www.tiktok.com/@dreamhavenx/video/7498425511878659350
7504865181269347590,krolgiraldo1,"Un hermoso #tbt 🥰😂 (Para licencias o uso, contacta con licensing@viralhog.com)",237700,896,80500,2400000,tbt,sonido original,2025-05-16 02:29:59,https://www.tiktok.com/@krolgiraldo1/video/7504865181269347590
7507470939571916075,king68clipz,king68 needs to be nerfed. #fyp #trending #viral #king68 #foryoupage ,21200,295,1143,424400,"fyp, trending, viral, king68, foryoupage",original sound,2025-05-23 03:02:01,https://www.tiktok.com/@king68clipz/video/7507470939571916075
7504794198290222367,mak._.kijanowski,there she go #wlw #wlwtiktok #fyp ,259900,1005,4144,1200000,"wlw, wlwtiktok, fyp",She Go (Summer Version Remix) [feat. Chef Boy],2025-05-15 21:54:30,https://www.tiktok.com/@mak._.kijanowski/video/7504794198290222367
7507020407451421998,tracynuggeto,starting to fall out now #miliaremoval #cryotherapy ,123800,198,676,936800,"miliaremoval, cryotherapy",Glitter on my eyes,2025-05-21 21:53:25,https://www.tiktok.com/@tracynuggeto/video/7507020407451421998
7507403231232789806,risprivstory,5 years later ,75000,121,825,481700,,original sound,2025-05-22 22:38:57,https://www.tiktok.com/@risprivstory/video/7507403231232789806
7507424087493315882,olsenventures,Or maybe it’s just 2025 #neworleans #nola #frenchquarter #annabelle #prisonescape #voodoo ,12200,464,2795,505800,"neworleans, nola, frenchquarter, annabelle, prisonescape, voodoo",original sound,2025-05-23 00:00:11,https://www.tiktok.com/@olsenventures/video/7507424087493315882
7507335496930954526,madisonmariea,was going though old content bc i miss AZ & my bestie :(   #fyp #contentcreator #bestfriends #dysonairwrap ,25900,151,2786,345100,"fyp, contentcreator, bestfriends, dysonairwrap",Girls Just Want to Have Fun,2025-05-22 18:16:08,https://www.tiktok.com/@madisonmariea/video/7507335496930954526
7507551933750578454,memerofls45,"Mercedes-Benz 300 SLR Uhlenhaut - самая дорогая машина  Цена: $142 млн  Мощность мотора: 310 л.с.  Максимальная скорость: 290 км/ч  Mercedes-Benz 300 SLR Uhlenhaut — весьма знаменитый автомобиль. Известно, что он является самым дорогим автомобилем в мире на нашу эпоху, а также самой дорогой машиной в истории человечества. В 2022 году за него были заплачены огромные 135 миллионов евро, что на тот момент соответствовало 142 миллионам долларов. 300 SLR Uhlenhaut — это своеобразная дорожная адаптация гоночного родстера 300 SLR, специально разработанного для участия в самых престижных гонках 1950-х годов. Всего были созданы лишь два экземпляра этого автомобиля с жесткой крышей и типичными для него дверьми, напоминающими крыло чайки. Оба автомобиля получили свои названия в честь одного из соучредителей 300 SLR — Рудольфа Уленхаута, который сам использовал купе этой модели в качестве своего личного автомобиля.  Некогда оба автомобиля 300 SLR Uhlenhaut находились в музее Mercedes-Benz, но в прошлом году компания приняла решение продать одну из них. Именно ту двухдверную модель, на которой покатался сам Уленхаут, продали на закрытом аукционе. Приобретенные средства были вложены в финансирование разнообразных образовательных проектов. Хотя имя покупателя так и осталось тайной, известно, что он согласился время от времени предоставлять автомобиль для публичных показов.  Существуют и другие роскошные автомобили, к которым можно отнести модели, такие как «Pagani Huayra BC», «Lykan HyperSport» и многие другие. Все они отличаются элитарностью, высочайшим качеством и ценой, которая зачастую кажется недостижимой для обычных автомобилистов.  Топовые бренды автомобилей, такие как Bugatti, Rolls-Royce, Lamborghini и другие, постоянно соревнуются друг с другом, стремясь создать машины с новыми рекордами скорости, исключительным дизайном и несравненным комфортом. Большинство самых дорогих автомобилей в мире являются уникальными экземплярами, специально созданными для состоятельных покупателей по индивидуальному заказу.  Путешествуя по улицам городов, маловероятно заметить их, ведь многие из этих автомобилей будут храниться в частных гаражах своих владельцев, стремясь сохранить их вдали от посторонних глаз. Очевидно, что стоимость этих машин превышает все ожидания и может достигать нескольких миллионов долларов. Таким образом, мир самых дорогих автомобилей представляет собой уникальную нишу, доступную лишь небольшому кругу людей. #юмор #смешнодослез #лучшиеприколы #старыеприколы #неожиданнаяконцовка #смешноевидео #прикол #рофл #рек2025 #отмечайтедрузей #отметьегоилиеё #rofl #кругляшки #угар #рек #реки #приколы #угар #смешныевидео #топ #FunnyVideos, #ComedyTikTok, #Relatable",44200,271,73400,700800,"юмор, смешнодослез, лучшиеприколы, старыеприколы, неожиданнаяконцовка, смешноевидео, прикол, рофл, рек2025, отмечайтедрузей, отметьегоилиеё, rofl, кругляшки, угар, рек, реки, приколы, смешныевидео, топ, funnyvideos, comedytiktok, relatable",оригинальный звук,2025-05-23 08:15:58,https://www.tiktok.com/@memerofls45/video/7507551933750578454
7501925086367321390,icesiss1k,chat does this not sound fun 😂? We can act mysterious 🤣🤣 #fypシ ,639700,5020,131600,3900000,fypシ,original sound,2025-05-08 04:21:58,https://www.tiktok.com/@icesiss1k/video/7501925086367321390
7505498833527377198,broken_day_thugger,,71300,447,12600,622100,,Little Spouse,2025-05-17 19:29:25,https://www.tiktok.com/@broken_day_thugger/video/7505498833527377198
7508090192662777119,onlyftc,#cashnasty #stephcurry #fyp ,151500,284,4387,868500,"cashnasty, stephcurry, fyp",original sound,2025-05-24 19:04:56,https://www.tiktok.com/@onlyftc/video/7508090192662777119
7507261627712965918,john_sheffield206,Can’t believe we finally did it 🪐☄️ Happy opening day to everyone!! #epicuniverse #universalstudios #epicuniverse2025 #fyp #uotm ,225300,816,1914,897600,"epicuniverse, universalstudios, epicuniverse2025, fyp, uotm",Scott Street (Slowed Down),2025-05-22 13:29:31,https://www.tiktok.com/@john_sheffield206/video/7507261627712965918
7505007076515761454,livserotonin,,150500,217,6853,721300,,original sound,2025-05-16 11:40:47,https://www.tiktok.com/@livserotonin/video/7505007076515761454
7501925539280686367,inkoranges,Blue raspberry! #funny #fyp #viral #slushy ,322100,863,76400,1600000,"funny, fyp, viral, slushy",original sound,2025-05-08 04:23:10,https://www.tiktok.com/@inkoranges/video/7501925539280686367
7507694958330088747,jacob.cline.161,no more 🩲#fyp #trending #mlm #dancetrend #dance #2000s #mlmtiktok ,177100,667,5023,723400,"fyp, trending, mlm, dancetrend, dance, 2000s, mlmtiktok",I Aint Got No Panties on on the Dance Flooo,2025-05-23 17:31:36,https://www.tiktok.com/@jacob.cline.161/video/7507694958330088747
7507724065990380831,laurenalaina,Biggest release of my career ✔️ Biggest release of my life tbd  #pregnant #newmusic #countrymusic #countrymusic #funny #fyp ,46500,505,577,485600,"pregnant, newmusic, countrymusic, funny, fyp",All My Exes,2025-05-23 19:24:13,https://www.tiktok.com/@laurenalaina/video/7507724065990380831
7507241951561813278,vilebrides,@daggwr !! made a playlist of evidence on my lage btw,128200,1330,890,607200,,original sound,2025-05-22 12:13:07,https://www.tiktok.com/@vilebrides/video/7507241951561813278
7507304229388881198,againsigma,Felt his aura from miles away this spot needs to be cleaned up #shmerg #fyp #paris ,112000,432,11100,823900,"shmerg, fyp, paris",original sound,2025-05-22 16:14:51,https://www.tiktok.com/@againsigma/video/7507304229388881198
7507370158269173035,5citymedia,Who’s honest with their doctor?  #doctor #shanegillis #doctorlife #beerdrinker #doctorsoftiktok ,14000,161,1644,355800,"doctor, shanegillis, doctorlife, beerdrinker, doctorsoftiktok",original sound,2025-05-22 20:30:40,https://www.tiktok.com/@5citymedia/video/7507370158269173035
7505727463884852486,allie.nkosi,I need the girly tips  #4chairclub #hairgrowthtips #girltipsandtricks  #relatable #fyp #imbored,145400,4137,1581,1500000,"4chairclub, hairgrowthtips, girltipsandtricks, relatable, fyp, imbored",original sound,2025-05-18 10:16:01,https://www.tiktok.com/@allie.nkosi/video/7505727463884852486
7505436294529568042,angelinaababyy,They never get caught #pov #fyp ,328000,681,13700,1700000,"pov, fyp",original sound,2025-05-17 15:26:53,https://www.tiktok.com/@angelinaababyy/video/7505436294529568042
7507451146080980232,smlm939,#stitch #cinepolismx ,421700,5447,335000,7500000,"stitch, cinepolismx",sonido original,2025-05-23 01:44:48,https://www.tiktok.com/@smlm939/video/7507451146080980232
7505158674583702826,alexia.8311,Maybe he does love me 😩 #fyp #viral #relationship #life #drunk #boyfriend @lało✞ ,185200,470,9027,642100,"fyp, viral, relationship, life, drunk, boyfriend",Pretty Little Baby - Stereo Mix,2025-05-16 21:28:58,https://www.tiktok.com/@alexia.8311/video/7505158674583702826
7507271203883715847,waezarty,,88000,2157,26400,1100000,,оригинальный звук,2025-05-22 14:06:33,https://www.tiktok.com/@waezarty/video/7507271203883715847
7506927380687031560,vita.oki,#littleanimiegirldancingonacaredit #edit #нижнийновгород #нн  #нижний800 #назайцева ,220200,1712,7454,1700000,"littleanimiegirldancingonacaredit, edit, нижнийновгород, нн, нижний800, назайцева",9mm,2025-05-21 15:52:17,https://www.tiktok.com/@vita.oki/video/7506927380687031560
7507708781493505326,mrlootes,It’s so ahh 💩 #smalltown #fyp ,108500,1015,20600,723000,"smalltown, fyp",Welcome to My House,2025-05-23 18:25:11,https://www.tiktok.com/@mrlootes/video/7507708781493505326
7505077925717249311,harryponderss,let em know 😌🤳,200600,1988,152700,1600000,,original sound,2025-05-16 16:15:33,https://www.tiktok.com/@harryponderss/video/7505077925717249311
7507329917512764718,bigtimerush38,nothing can bring me down today #ilovebrazils #asf #gym #wax #tone,56300,130,300,828500,"ilovebrazils, asf, gym, wax, tone",Original Sound,2025-05-22 17:54:33,https://www.tiktok.com/@bigtimerush38/video/7507329917512764718
7505183290698108191,chideraprecious0,My family was too excited to pull up to the graduation with their doctoral caps 😭 #nigeriantiktok #africantiktok #tiktoknigeria #naijatiktok #fyp #foryou ,142700,496,1943,568900,"nigeriantiktok, africantiktok, tiktoknigeria, naijatiktok, fyp, foryou",Game Changer (Dike),2025-05-16 23:04:29,https://www.tiktok.com/@chideraprecious0/video/7505183290698108191
