video_id,author,description,likes,comments,shares,plays,hashtags,music,create_time,video_url
7507367325260320046,crackedbybryanagain,#griffinmethod #fypシ #yapping #voicechanger ,107900,417,17500,505500,"griffinmethod, fypシ, yapping, voicechanger",Gymnopedie No.1 [Piano famous song](204824),2025-05-22 20:19:43,https://www.tiktok.com/@crackedbybryanagain/video/7507367325260320046
7499913381453827374,dreskii03_,Aint no way she aint see her😭☠️,141600,500,19500,651200,,original sound,2025-05-02 18:15:03,https://www.tiktok.com/@dreskii03_/video/7499913381453827374
7506894663966756098,bansheesia,they are so... tiny 😭😭 @The Hunger Games @Lionsgate #hungergames #hungergamesedit #booktok #booktoker #reading #book #sunriseonthereaping #sotr #haymitch #haymitchabernathy #woodyharrelson #suzannecollins #hungergamescatchingfire #hungergamestheballadofsongbirdsandsnakes #movie #actors #fyp #viral #trend #relatable #reader #bookstagram #loulou #louella #children ,95300,287,1162,967800,"hungergames, hungergamesedit, booktok, booktoker, reading, book, sunriseonthereaping, sotr, haymitch, haymitchabernathy, woodyharrelson, suzannecollins, hungergamescatchingfire, hungergamestheballadofsongbirdsandsnakes, movie, actors, fyp, viral, trend, relatable, reader, bookstagram, loulou, louella, children",Careful What You Wish For,2025-05-21 13:45:22,https://www.tiktok.com/@bansheesia/video/7506894663966756098
7507471493400448298,kodvis,#real #xaviersobased ,90700,394,2153,554400,"real, xaviersobased",original sound,2025-05-23 03:04:29,https://www.tiktok.com/@kodvis/video/7507471493400448298
7507297013197851947,zzzsrollingpaper,Mary Jane - making the mundane memorable since the beginning of time 🧼 #fyp #skit #mrclean ,101200,1171,35800,1200000,"fyp, skit, mrclean",original sound,2025-05-22 15:46:52,https://www.tiktok.com/@zzzsrollingpaper/video/7507297013197851947
7507044251960610078,fartsnifferxoxo,More gazelle tigers pls #zootopia #zootopia2 #disney ,107100,585,1984,718500,"zootopia, zootopia2, disney",original sound,2025-05-21 23:25:55,https://www.tiktok.com/@fartsnifferxoxo/video/7507044251960610078
7507634095434845482,akillesnyc,#fyp #ddg #indialove #streameruniversity #kaicenat #late #professor #viral #xyzbca #fypシ @DDG @Kai Cenat @Indialove ,40300,215,56,453200,"fyp, ddg, indialove, streameruniversity, kaicenat, late, professor, viral, xyzbca, fypシ",original sound,2025-05-23 13:35:53,https://www.tiktok.com/@akillesnyc/video/7507634095434845482
7507367261527641387,bxby.trappa,#414 #milwaukee #fypage ,28000,1612,6367,399300,"414, milwaukee, fypage",Pale Pale Moon Sinners Nola Bounce Mix,2025-05-22 20:19:23,https://www.tiktok.com/@bxby.trappa/video/7507367261527641387
7504411936445041966,loganscandies,Secret Menu Item?! 🍬🍬🍬,45500,303,205,1000000,,original sound,2025-05-14 21:11:19,https://www.tiktok.com/@loganscandies/video/7504411936445041966
